2026-02-11	cnbc-us	698d63226e6392ce6c8cb928	Instagram chief likens social media addiction to being hooked on a Netflix show in trial testimony
2026-02-11	japantoday	698d61f26e6392ce6c8cb5cb	Instagram CEO denies addiction claims in landmark U.S. trial
2026-02-11	straits-times	698c2084a317c9d02ef1d4e7	Instagram boss to testify at social media addiction trial
2026-02-12	bbc-top	698d62be6e6392ce6c8cb890	Instagram boss: 16 hours of daily use is 'problematic,' not addiction
2026-02-12	straits-times	698d624e6e6392ce6c8cb7b3	Instagram CEO denies addiction claims in landmark US trial
2026-02-12	thehindu	698ec77cc1fa2e60d4ea1546	Install cameras to prevent waste dumping in Amayizhanjan Canal: SHRC
2026-02-11	tass	698d62a26e6392ce6c8cb810	Instead of financing Ukraine, EU should return Russian frozen assets — Finnish politician
2026-02-11	thehindu	698d63336e6392ce6c8cb994	Interest of institutional lenders can’t outweigh right of owner over stolen gold ornaments: Karnataka High Court
2026-02-11	scrollin	698d63a16e6392ce6c8cba02	International law is failing, but a tiny ASEAN country wants to bring charges against Myanmar junta
2026-02-12	thehindu	698d63296e6392ce6c8cb93a	International Fleet Review: Vizag Beach Road to get enclosures for audience
2026-02-11	indiaexpress	698c1fa1a317c9d02ef1d33c	Interstate drug racket busted, 2 held with over 1.28 kg charas: UT Police
2026-02-11	scrollin	698c1f34a317c9d02ef1d2b5	Interview: ‘Hasina thought only India mattered,’ says Yunus press secretary
2026-02-11	tass	698d62a56e6392ce6c8cb81f	IOC may look at reinstating Russian Olympic body in April or May — sports official
2026-02-11	tass	698d62b76e6392ce6c8cb866	IOC bans Ukrainian athlete from wearing 'propaganda' helmet at 2026 Olympics
2026-02-12	bbc-world	698ec78bc1fa2e60d4ea1579	IOC criticised for selling Nazi-era Olympics T-shirt
2026-02-12	ukrinform	698ec649c1fa2e60d4ea1273	IOC President comments on Heraskevych's disqualification over 'helmet of remembrance'
2026-02-12	breitbart	698ec871c1fa2e60d4ea1747	Iowa Bill Would Ban Mail-Order Abortion Pills, Require Hospitals to Track Complications
2026-02-11	africa-news	698d63c06e6392ce6c8cba57	Iran marks revolution anniversary amid US threats and sanctions
2026-02-11	arutz-sheva	698c203fa317c9d02ef1d431	Iran claims Netanyahu's US visit aimed at undermining negotiations
2026-02-11	mehr-news	698c1f92a317c9d02ef1d2e0	Iran displaces wreckage of Israeli drones
2026-02-11	mehr-news	698d61976e6392ce6c8cb5a0	Iran ready to discuss enrichment level if rights respected
2026-02-11	mehr-news	698d619a6e6392ce6c8cb5a5	Iran authority, armed force depends on people participation
2026-02-11	tass	698d62a96e6392ce6c8cb832	Iran intends to strengthen cooperation with EAEU, BRICS, SCO — president
2026-02-12	bbc-me	698ec651c1fa2e60d4ea1287	Iran fortifies underground complex near nuclear site, satellite images show
2026-02-12	breitbart	698d62476e6392ce6c8cb777	Iran Claims U.N. Chief Congratulated It on Anniversary of Islamist Revolution
2026-02-12	mehr-news	698ec659c1fa2e60d4ea12be	Iran committed to diplomacy for peace: envoy
2026-02-12	mehr-news	698ec65cc1fa2e60d4ea12c2	Iran climbs to fourth place in FIFA Futsal Ranking Update
2026-02-12	mehr-news	698ec65dc1fa2e60d4ea12c3	Iran non-oil exports tops $86 billion since June 2024: IRICA
2026-02-12	mehr-news	698ec660c1fa2e60d4ea12c8	Iran naval forces monitoring enemy moves constantly: cmdr.
2026-02-12	mehr-news	698ec661c1fa2e60d4ea12c9	Iran consulate in Iraq Sulaymaniyah marks anniv. of rev.
2026-02-12	mehr-news	698ec661c1fa2e60d4ea12ca	Iran consulate in Istanbul marks anniversary of rev.
2026-02-12	mehr-news	698ec665c1fa2e60d4ea12d0	Iran has right to enrich uranium as NPT member
2026-02-11	tass	698d62a76e6392ce6c8cb829	Iran, US not discussing complete cessation of uranium enrichment — Security Council chief
2026-02-12	mehr-news	698ec65bc1fa2e60d4ea12c0	Iran, Uzbekistan transport ministers stress boosting ties
2026-02-11	arutz-sheva	698d62086e6392ce6c8cb60b	Iran's Foreign Minister launches attack against Miriam Adelson
2026-02-11	mehr-news	698d619a6e6392ce6c8cb5a4	Iran's Larijani holds talks with Qatari FM in Doha
2026-02-11	et-me	698d62d56e6392ce6c8cb8e8	Iranian President Apologizes to People Affected by Protests, Unrest
2026-02-11	fox-world	698d63936e6392ce6c8cb9f2	Iranian brutality: Nobel laureate fighting for life after barbaric assault at notorious prison
2026-02-12	tass	698ec75fc1fa2e60d4ea14b2	Iranian satellite Jam-e Jam 1 enters orbit by Russian Proton-M launch system
2026-02-13	arutz-sheva	698ec70fc1fa2e60d4ea145d	Iranian TV director fired after reporter’s ‘Death to Khamenei’ remark
2026-02-13	ntp-world	698ec7d8c1fa2e60d4ea15e5	Iranian reporter says ‘Death to Khamenei’ during Islamic Revolution rally in ‘slip of the tongue’ moment
2026-02-11	mehr-news	698c1f95a317c9d02ef1d2e4	Iranians celebrate 47th anniversary of Islamic Revolution
2026-02-12	arutz-sheva	698d62086e6392ce6c8cb603	Iran’s top adviser: Missile program is non-negotiable
2026-02-12	mehr-news	698ec662c1fa2e60d4ea12cc	Iran’s streets scene of bonds between nation and govt.
2026-02-12	mehr-news	698ec667c1fa2e60d4ea12d3	Iran’s trade exchange with Africa up 66% in 9 months
2026-02-12	mehr-news	698ec668c1fa2e60d4ea12d4	Iran’s rights, dignity, honor ‘non-negotiable’: Araghchi
2026-02-11	gbnews	698d62bf6e6392ce6c8cb8a9	Iraqi man faces deportation for hand in international people smuggling ring
2026-02-12	arutz-sheva	698ec710c1fa2e60d4ea1465	Ireland to play Israel in soccer despite seeking its expulsion
2026-02-12	et-uspol	698ec82bc1fa2e60d4ea168a	IRS Shared Tax Data on 47,000 Taxpayers With ICE, Official Says
2026-02-12	fox-latest	698d62d66e6392ce6c8cb8ea	IRS erroneously shared confidential immigrant taxpayer data with DHS: court filing
2026-02-11	dw	698d62cc6e6392ce6c8cb8cf	Is Heraskevych's Olympic 'helmet of remembrance' political?
2026-02-12	dw	698ec7edc1fa2e60d4ea1611	Is banned Olympic 'helmet of remembrance' political?
2026-02-12	et-aus	698ec6d5c1fa2e60d4ea13d5	Is the Liberal Party Doomed to Repeat the Fate of its Predecessor?
2026-02-11	indiaexpress	698c1fa0a317c9d02ef1d32c	‘Is a blood sugar reading of 156 normal 2 hours after eating?’
2026-02-12	japantoday	698ec863c1fa2e60d4ea1710	IS suspects transferred from Syria to Iraq interrogated in Baghdad prison
2026-02-11	waustralian-pol	698c1f4aa317c9d02ef1d2c8	Isaac Herzog meets Governor-General Sam Mostyn
2026-02-12	indiaexpress	698ec6cac1fa2e60d4ea1383	Ishan Kishan, Varun Chakarvarthy shine as India thrash Namibia by 93 runs despite middle-order struggles
2026-02-11	mehr-news	698c1f95a317c9d02ef1d2e5	Islamic Revolution role model for all independent nations
2026-02-11	saudi-gaz	698d63a96e6392ce6c8cba19	Islamic Affairs Ministry readies 18,691 mosques across Saudi Arabia ahead of Ramadan
2026-02-11	fox-politics	698d63c46e6392ce6c8cba77	Israel joins Board of Peace ahead of Netanyahu-Trump meeting
2026-02-12	et-me	698ec6d6c1fa2e60d4ea13da	Israel Has Joined Trump’s Board of Peace, Netanyahu Says
2026-02-12	straits-times	698d62516e6392ce6c8cb7bd	Israel has joined Trump’s ‘Board of Peace’, Prime Minister Netanyahu says
2026-02-13	arutz-sheva	698ec710c1fa2e60d4ea1463	Israel officially joins Board of Peace
2026-02-11	straits-times	698c2081a317c9d02ef1d4de	Israel's Netanyahu expected to press Trump over Iran diplomacy
2026-02-11	waustralian-pol	698d62ee6e6392ce6c8cb922	Israeli President Isaac Herzog blasts genocide ‘lie’, says anti-Semitism is present in Australia
2026-02-12	et-aus	698ec6d4c1fa2e60d4ea13d4	Israeli President Cancels Visit to Melbourne Synagogue Over Security Concerns
2026-02-12	tass	698ec75ec1fa2e60d4ea14ac	Israeli president says no decision yet on Netanyahu pardon request
2026-02-12	tass	698ec761c1fa2e60d4ea14bb	Israeli premier says won't come to US for inaugural Board of Peace meeting
2026-02-12	straits-times	698ec79cc1fa2e60d4ea15ad	Israel’s Netanyahu says Trump may be creating conditions for Iran deal
2026-02-11	tass	698d62b76e6392ce6c8cb868	Issue of keeping membership in WTO is challenging — Lavrov
2026-02-12	indiaexpress	698ec6cac1fa2e60d4ea137a	‘It burns!’: 9-year-old nearly blinded after viral TikTok toy hack; why kids are vulnerable to dangerous online trends
2026-02-11	straits-times	698c2088a317c9d02ef1d4f5	Italian reporters plan to strike after TV anchor mangles celebrity IDs
2026-02-12	indiaexpress	698ec6cdc1fa2e60d4ea138e	Italy cricket: ‘We are coming to Kolkata to shoot England down’
2026-02-11	indiaexpress	698c1fa1a317c9d02ef1d333	It’s a truce, but T20 row leaves behind questions
2026-02-13	breitbart	698ec86fc1fa2e60d4ea171e	Jacob Frey: We're Suing Trump Administration for Stripping Away Citizens Constitutional Rights
2026-02-11	breitbart	698d62486e6392ce6c8cb787	James Van Der Beek, 'Dawson's Creek,' 'Varsity Blues' Star Dies at 48
2026-02-11	fox-latest	698d62d76e6392ce6c8cb900	James Van Der Beek shared colorectal cancer warning sign months before his death
2026-02-12	thehindu	698ec77ac1fa2e60d4ea152b	Jammu invokes Section 163 to ban ‘cross-gender’ massage parlours, bars bolting of enclosures
2026-02-11	indiaexpress	698c1f9ea317c9d02ef1d315	Janakpuri biker death: Contractors to join probe, no coercive action until Feb 18
2026-02-11	mainichi	698c1fc9a317c9d02ef1d3c0	Japan PM may keep Cabinet members, as parliament set to convene next week
2026-02-11	mainichi	698d633f6e6392ce6c8cb9c5	Japan startup on 3rd attempt to create artificial meteor shower from space
2026-02-11	mainichi	698d63406e6392ce6c8cb9c7	Japan main opposition to choose new leader on Fri. after election loss
2026-02-11	mainichi	698d63406e6392ce6c8cb9c8	Japan minister seeks 'in-depth' talks with US on 1st investment project
2026-02-12	cnbc-top	698d63aa6e6392ce6c8cba21	Japan stocks extend post-election rally with Nikkei 225 breaching 58,000 for the first time
2026-02-12	japantoday	698ec86fc1fa2e60d4ea171c	Japan chip industry reports solid profit growth amid AI boom
2026-02-12	mainichi	698ec70cc1fa2e60d4ea1453	Japan researchers to study bear sightings' impact on human health
2026-02-13	bbc-top	698ec645c1fa2e60d4ea125f	Japan says it seized Chinese vessel amid tensions with Beijing
2026-02-13	dw	698ec7e1c1fa2e60d4ea15f3	Japan seizes Chinese fishing vessel in a first since 2022
2026-02-13	japantoday	698ec85ac1fa2e60d4ea1706	Japan seizes Chinese fishing boat off Nagasaki, arrests skipper
2026-02-13	mainichi	698ec707c1fa2e60d4ea1447	Japan moves to revise retrial system for 1st time, add disclosure rules
2026-02-13	mainichi	698ec70ac1fa2e60d4ea144e	Japan, US to quicken investment plans under $550 billion package
2026-02-11	japantoday	698d61e76e6392ce6c8cb5bf	Japan's industry minister visits U.S. to discuss $550 billion investment plans
2026-02-11	mainichi	698d633e6e6392ce6c8cb9c1	Japan's industry minister in Washington over investment plans
2026-02-12	mainichi	698d633b6e6392ce6c8cb9ba	Japan's main opposition party leadership race begins after election defeat
2026-02-12	mainichi	698d633c6e6392ce6c8cb9bc	Japan's main opposition in fight for survival after election rout
2026-02-13	mainichi	698ec70bc1fa2e60d4ea1450	Japan's main opposition to pick new leader after crushing election defeat
2026-02-11	et-asiapac	698d63c86e6392ce6c8cba8e	Japanese Companies Quietly Pulling Back From China Over Increased Instability: Insiders
2026-02-11	mainichi	698c1fc5a317c9d02ef1d3b9	Japanese yen briefly rises to lower 153 vs. dollar as US long-term yields fall
2026-02-12	cnbc-top	698d63aa6e6392ce6c8cba22	Japanese stocks are on a record-breaking spree. But the rally may be 'fragile'
2026-02-11	et-asiapac	698d63c76e6392ce6c8cba8d	Japan’s Historic LDP Landslide to Steel Tokyo Against Chinese Infiltration: Analysts
2026-02-12	tass	698ec773c1fa2e60d4ea14fc	Japan’s steps brought relations with Russia to point of no return — diplomat
2026-02-11	breitbart	698d62496e6392ce6c8cb795	JD Vance to Olympic Athletes with 'Mixed Emotions': 'You're There to Play a Sport,' Not 'Pop Off About Politics'
2026-02-11	indiaexpress	698c1fa0a317c9d02ef1d32e	JEE Main Result 2026 Date: NTA to release Session 1 scorecards by this date
2026-02-12	indiaexpress	698d62336e6392ce6c8cb6c5	JEE Mains Result 2026, Jeemain.nta.nic.in Live Updates: When to check JEE Main Session 1 scorecards ?
2026-02-12	indiaexpress	698d62356e6392ce6c8cb6e0	JEE Main Result 2026: January Session scorecards delayed; here’s what we know so far
2026-02-13	indiaexpress	698ec6c6c1fa2e60d4ea134c	JEE Main: 14 toppers with 100 percentile in last year’s session 1 repeated perfect score in session 2
2026-02-11	indiaexpress	698c1fa4a317c9d02ef1d358	Jemimah Rodrigues on fitness, periods, and the pressure of pro cricket: ‘The most challenging part is managing the mental side’
2026-02-13	nyp-us	698ec81bc1fa2e60d4ea165a	Jennifer Siebel Newsom reveals sad story behind her beloved pet chicken’s name in glowing Marie Claire puff piece
2026-02-11	ntp-world	698d63576e6392ce6c8cb9d6	Jesse Van Rootselaar, 18, ID’d as transgender ex-student behind Tumbler Ridge mass shooting
2026-02-11	post-mill	698d63826e6392ce6c8cb9ef	Jesse Van Rootselaar shot mother, brother dead at home before killing 6 at Tumbler Ridge Secondary School
2026-02-12	mehr-news	698ec664c1fa2e60d4ea12ce	Jewish Extremism: The Foundation of the Zionist Regime
2026-02-13	arutz-sheva	698ec710c1fa2e60d4ea145e	Jewish student assaulted near Yeshiva University
2026-02-11	fox-latest	698c207da317c9d02ef1d4ce	JFK’s grandson Jack Schlossberg doubles down on attacks against RFK Jr, warns of 'dangerous' agenda
2026-02-12	et-uk	698ec7d4c1fa2e60d4ea15d6	Jim Ratcliffe Apologises After Claiming Migrants Have ‘Colonised’ the UK
2026-02-12	gbnews-pol	698ec757c1fa2e60d4ea1494	Jim Ratcliffe apologises over claims Britain is colonised by migrants as backlash intensifies
2026-02-11	indiaexpress	698c1fa0a317c9d02ef1d330	Jimmy Lai’s sentence, China’s chilling message
2026-02-11	nyp-us	698c2050a317c9d02ef1d46b	Joe Rogan blasts former podcast guest who tried introducing him to Jeffrey Epstein: ‘B–ch, are you high?’
2026-02-11	africa-news	698d63bf6e6392ce6c8cba52	Johannesburg residents protest weeks of dry taps
2026-02-11	gbnews-pol	698d622c6e6392ce6c8cb68c	John Swinney opens Scotland's first walk-in GP clinic in Edinburgh
2026-02-13	indiaexpress	698ec6c2c1fa2e60d4ea131f	Joint parliamentary panel gets time until Monsoon Session to submit report on Bill to replace UGC
2026-02-12	breitbart	698ec86fc1fa2e60d4ea171d	Josh Hawley Calls For Indictment of Minnesota AG Keith Ellison over Alleged Ties to Somali Fraudsters
2026-02-12	nyp-pol	698ec6fac1fa2e60d4ea140d	Josh Hawley demands congressional oversight of abortion pill over safety concerns
2026-02-11	indiaexpress	698c1fa6a317c9d02ef1d37c	Journalist gets year in jail in case of Adani defamation
2026-02-11	scrollin	698c1f33a317c9d02ef1d2b4	Journalist Ravi Nair convicted in Adani defamation case, sentenced to one-year imprisonment
2026-02-11	nyp-us	698c2054a317c9d02ef1d470	Judge clears way for mega lawsuit blaming LA and California for deadly Palisades Fire
2026-02-12	bbc-world	698ec78bc1fa2e60d4ea157a	Judge blocks US military from demoting Mark Kelly over 'illegal orders' video
2026-02-12	et-uspol	698ec82dc1fa2e60d4ea168f	Judge Boasberg Orders Government to Facilitate Return of Deported Venezuelans
2026-02-12	fox-latest	698d62d66e6392ce6c8cb8ef	Judge orders ex-NFL player Darron Lee held without bond as prosecutors weigh death penalty
2026-02-13	cnbc-politics	698ec66ac1fa2e60d4ea12dc	Judge blocks Pete Hegseth's censure of Sen. Mark Kelly over troops video, for now
2026-02-13	et-uspol	698ec82ac1fa2e60d4ea1682	Judge Halts Trump Admin’s $600 Million Public Health Funding Cut Targeting 4 Blue States
2026-02-13	japantoday	698ec861c1fa2e60d4ea170d	Judge blocks Pentagon from punishing Sen Mark Kelly for call to resist unlawful orders
2026-02-13	nyp-us	698ec817c1fa2e60d4ea1655	Judge dismisses California deportation case for Mexican father of 3 U.S. Marines
2026-02-12	gbnews	698ec706c1fa2e60d4ea143c	Jupiter-bound spacecraft turns attention to interstellar object from beyond our solar system
2026-02-12	thehindu	698ec77bc1fa2e60d4ea153e	Jyothi Buddha Prakash assumes charges as Singareni CMD
2026-02-12	fox-us	698ec6fcc1fa2e60d4ea1420	K-9 hit by vehicle during bank robbery chase keeps going and helps capture suspect
2026-02-11	thehindu	698d632c6e6392ce6c8cb953	Kadalukku Oru Kaditham: when the sea waits for letters
2026-02-11	thehindu	698c2077a317c9d02ef1d4ad	Kalaburagi DC reviews development works, urges officials to ensure effective implementation of schemes
2026-02-11	fox-latest	698c207da317c9d02ef1d4d4	Kaley Cuoco says ‘bad’ Botox mishap left her shocked by how her face looked on ‘Big Bang Theory’
2026-02-11	indiaexpress	698d62426e6392ce6c8cb74a	Karan Johar spent a ‘lot of money’ buying art, artist was later imprisoned: ‘They have no value now, can’t even sell’
2026-02-12	nyp-us	698d62e16e6392ce6c8cb919	Karen Bass ordered LA cops to turn on body cams at ICE operations. They already do, union says
2026-02-11	indiaexpress	698d623d6e6392ce6c8cb729	Karnataka techie shot dead in Canada: Police suspect ‘targeted killing’, says Chandan’s friend
2026-02-11	thehindu	698d632c6e6392ce6c8cb954	Karnataka Revenue Department makes plea to High Court
2026-02-11	thehindu	698d632c6e6392ce6c8cb956	Karnataka High Court defers cross-examination of witnesses in murder case to prevent exposure of defence strategy
2026-02-11	thehindu	698d63306e6392ce6c8cb984	Karnataka introduces online scrutiny to prevent revenue courts from admitting cases beyond their jurisdiction 
2026-02-12	indiaexpress	698ec6d0c1fa2e60d4ea13ae	Karnataka Upalokayukta orders crackdown on illegal resorts, homestays in eco-sensitive zones of Mandya
2026-02-12	thehindu	698ec77bc1fa2e60d4ea1538	Karnataka High Court directs State government to set up Municipal Trust Property Management System to protect public properties
2026-02-12	thehindu	698ec77bc1fa2e60d4ea1540	Karnataka govt. gives conditional clearance to IPL matches at M. Chinnaswamy Stadium 
2026-02-13	indiaexpress	698ec6c2c1fa2e60d4ea1324	Karnataka Lokayukta raids 4 officers across 29 locations; PWD engineer found with Rs 12.8 crore in assets
2026-02-13	indiaexpress	698ec6c2c1fa2e60d4ea1325	Karnataka Cabinet clears M Chinnaswamy Stadium for IPL 2026; RCB to begin IPL title defence at Bengaluru
2026-02-11	gbnews-pol	698c1f8ca317c9d02ef1d2d7	Keir Starmer's bid to save face goes up in flames as bombshell report finds trade deal built on sand
2026-02-11	gbnews-pol	698d622c6e6392ce6c8cb683	Keir Starmer accused of 'stratospheric levels of delusion' over paedophile-linked Labour peer
2026-02-11	gbnews-pol	698d622c6e6392ce6c8cb687	Keir Starmer called to resign as Andy Burnham's ex-advisor demands leadership election in furious rant
2026-02-11	gbnews-pol	698d622c6e6392ce6c8cb68a	Keir Starmer demands Jim Ratcliffe apologises after Manchester United owner warns 'UK is being colonised by immigrants'
2026-02-11	gbnews-pol	698d622d6e6392ce6c8cb697	Keir Starmer's own allies admit he's 'too weak to sack Wes Streeting' - PM could still face coup
2026-02-12	gbnews	698ec706c1fa2e60d4ea1439	Keir Starmer told to water down 'unfair' migrant crackdown in blow to 'stop the boats' pledge
2026-02-12	gbnews-op	698ec80fc1fa2e60d4ea1645	Keir Starmer is about to learn the hard way that his Achilles heel was never Peter Mandelson - Paul Embery
2026-02-12	post-mill	698ec73ac1fa2e60d4ea1476	Kennedy Center plans massive staff cuts ahead of renovations as new director of artistic programming quits after 2 weeks
2026-02-11	africa-news	698d63c06e6392ce6c8cba54	Kenya starvation cult preacher Paul Mackenzie charged over 52 more deaths
2026-02-11	africa-news	698d63c26e6392ce6c8cba62	Kenya FM to visit Russia over forced conscripts in Ukraine
2026-02-12	africa-intel	698ec7d0c1fa2e60d4ea15cf	Kenya : Business community in the central region treads carefully amid rising tensions
2026-02-11	thehindu	698d632c6e6392ce6c8cb94f	Kerala High Court orders high-level probe into Suraj Lama’s death
2026-02-11	thehindu	698d63316e6392ce6c8cb98f	Kerala CM meets Sri Lankan delegation
2026-02-12	scrollin	698ec826c1fa2e60d4ea1675	Kerala MLA Rahul Mamkootathil granted anticipatory bail in rape case
2026-02-12	thehindu	698ec77fc1fa2e60d4ea1554	Kerala disillusioned with LDF, UDF, looking to BJP-NDA with great hope: Modi
2026-02-11	fox-politics	698c1f43a317c9d02ef1d2b6	Key House committee advances nationwide voter ID bill, setting up 2026 election fight
2026-02-12	egyptian-streets	698ec75ac1fa2e60d4ea14a0	Khufu’s Crowned Best Restaurant in the Middle East and North Africa
2026-02-11	breitbart	698d62496e6392ce6c8cb798	Kid Rock Buries Bad Bunny in TMZ's Post-Super Bowl Halftime Show Poll
2026-02-11	tass	698d62a56e6392ce6c8cb821	Kiev requires €60 billion in foreign support this year — German defense minister
2026-02-12	tass	698ec76dc1fa2e60d4ea14e8	Kiev expects to receive over $51 bln in Western aid in 2026
2026-02-11	tass	698d62b36e6392ce6c8cb858	Kiev's forced evacuation of children tears families apart — ombudswoman
2026-02-12	indiaexpress	698ec6cac1fa2e60d4ea1379	Killing inside law college: Victim had a dream — ‘Sir, one day I’ll become a judge too’
2026-02-12	bbc-world	698ec78bc1fa2e60d4ea1575	Kim Jong Un chooses teen daughter as heir, says Seoul 
2026-02-12	dw-world	698ec74fc1fa2e60d4ea147d	Kim Jong Un's daughter set to be his successor, Seoul says
2026-02-12	et-intl	698ec7a3c1fa2e60d4ea15c1	Kim Jong Un Positioning Teen Daughter as Successor: South Korean Officials
2026-02-12	ntp-world	698ec7ddc1fa2e60d4ea15ed	Kim Jong Un’s daughter will soon be appointed North Korea’s future leader, spy agency says
2026-02-13	gbnews	698ec706c1fa2e60d4ea1430	Kim Jong-un names teenage daughter as heir to North Korea
2026-02-11	gbnews-pol	698d622c6e6392ce6c8cb68d	King Charles welcomes Sir Keir Starmer and Lady Victoria Starmer to royal residence
2026-02-12	saudi-gaz	698ec851c1fa2e60d4ea16f0	King Salman appoints Fahad Al-Saif new minister of investment
2026-02-11	thehindu	698d632c6e6392ce6c8cb94e	KMRL gets nod to seek ₹1016-cr. loan for Kochi metro phase-2
2026-02-11	scrollin	698d63a76e6392ce6c8cba11	‘Kohrra 2’ review: Gripping and suspenseful, but the edge is missing
2026-02-11	straits-times	698d62566e6392ce6c8cb7ca	Kosovo parliament votes in new government after year of deadlock
2026-02-11	cnbc-world	698d63c56e6392ce6c8cba88	Kraft Heinz pauses work to split the company as new CEO says 'challenges are fixable'
2026-02-12	mehr-news	698ec65fc1fa2e60d4ea12c7	Kremlin rules out attendance at US Peace Council meeting
2026-02-13	nyp-us	698ec814c1fa2e60d4ea1651	Kylie Jenner takes her $500K bag to dinner at strip mall sushi hot spot
2026-02-11	breitbart	698d62496e6392ce6c8cb793	La Linea: The Mexican Cartel Controlling the El Paso-Juarez Metropolitan Area
2026-02-12	nyp-us	698d62dd6e6392ce6c8cb913	LA man dead after skiing accident at Lake Tahoe resort
2026-02-11	et-aus	698d62bc6e6392ce6c8cb87a	Labor Reintroduces ‘Super Tax’ With New 40 Percent Tax Threshold
2026-02-11	gbnews-pol	698d622c6e6392ce6c8cb686	Labour considering new Help to Buy scheme for first-time buyers: 'We're having discussions!'
2026-02-11	gbnews-pol	698d622d6e6392ce6c8cb694	Labour vote COLLAPSES in Welsh seat as voters pass damning judgement on Keir Starmer's party
2026-02-12	gbnews-pol	698ec757c1fa2e60d4ea148d	Labour mayor who helped hide son’s phone after he raped 15-year-old girl blamed 'mother's love'
2026-02-11	scrollin	698d63a16e6392ce6c8cba04	Lakhs of ‘doubtful voters’ deleted in Assam based on BJP complaints, says Himanta Sarma
2026-02-12	dnaindia	698d62636e6392ce6c8cb7df	Lamborghini crash: Shivam Mishra, son of Tobacco tycoon, arrested
2026-02-12	dnaindia	698ec787c1fa2e60d4ea156e	Lamborghini Crash: How much did Kanpur tobacco tycoon pay to get bail for Shivam Mishra?
2026-02-12	dnaindia	698ec787c1fa2e60d4ea156f	Lamborghini crash: Shivam Mishra, tobacco tycoon's son, released hours after arrest, know why
2026-02-12	tass	698d62a06e6392ce6c8cb809	Lancet drone operators hit Ukrainian Ceasar self-propelled system in Zaporozhye Region
2026-02-11	mehr-news	698d61936e6392ce6c8cb599	Larijani meets with Hamas officials in Doha
2026-02-12	fox-us	698ec6fcc1fa2e60d4ea1424	Latest FBI neighborhood canvass in Guthrie case could mean feds have 'digital evidence:' former agent
2026-02-12	bbc-top	698d62be6e6392ce6c8cb882	Laughing gas canisters explode at waste centres hundreds of times a week, firms say
2026-02-12	indiaexpress	698ec6d3c1fa2e60d4ea13c8	Lavanya Tripathi defends Chiranjeevi after his earlier male heir remark: ‘If somebody comes for my family…’
2026-02-11	tass	698d62ae6e6392ce6c8cb846	Lavrov says BRICS never works against anyone, but refuses to depend on West’s whims
2026-02-11	tass	698d62b86e6392ce6c8cb869	Lavrov tells US to keep out of regions that don't concern it
2026-02-11	indiaexpress	698c1fa1a317c9d02ef1d33d	Law student who shot himself after killing woman classmate still critical
2026-02-12	tass	698ec772c1fa2e60d4ea14f8	Law on cryptocurrency regulation set to be adopted during State Duma spring session
2026-02-11	et-uspol	698d61f76e6392ce6c8cb5e1	Lawmakers Urge Trump Admin to Exercise Leverage Over China With Chipmaking Equipment Controls
2026-02-11	japantoday	698d61e06e6392ce6c8cb5b8	Lawyers of Chicago woman shot by federal agents say documents show how DHS lies about investigations
2026-02-12	indiaexpress	698d62386e6392ce6c8cb6ef	Layoffs, AI, restructuring: Is the downside over for Indian IT stocks?
2026-02-12	mehr-news	698ec65bc1fa2e60d4ea12c1	Leader hails people's turnout to revolution anniv. rallies
2026-02-13	mehr-news	698ec656c1fa2e60d4ea12b9	Leader’s message on people's turnout to 22 Bahman rallies
2026-02-12	waustralian-pol	698ec693c1fa2e60d4ea12ff	Leadership aspirant Angus Taylor has spent more than a decade building his standing inside the Liberal Party
