2026-02-12	arutz-sheva	698d62086e6392ce6c8cb606	Russia moves to block WhatsApp as it promotes state surveillance app
2026-02-12	bbc-top	698d62be6e6392ce6c8cb892	Russia moves to block WhatsApp in messaging app crackdown
2026-02-12	cnbc-politics	698ec66bc1fa2e60d4ea12df	Russia shrugs off Trump’s tariff threats on those who provide oil to Cuba
2026-02-12	dw-world	698ec74fc1fa2e60d4ea147b	Russia blocks YouTube and WhatsApp
2026-02-12	fox-world	698ec872c1fa2e60d4ea1751	Russia to suspend flights to Cuba as Trump sanctions cut fuel supply
2026-02-12	japantoday	698ec867c1fa2e60d4ea1714	Russia cracking down on WhatsApp and Telegram
2026-02-12	ntp-world	698ec7dbc1fa2e60d4ea15eb	Russia to ship oil to Cuba in defiance of Trump tariff threat
2026-02-12	nyp-tech	698ec670c1fa2e60d4ea12f0	Russia has tried to fully block WhatsApp and ‘drive users to state-owned surveillance app’
2026-02-12	straits-times	698ec7a0c1fa2e60d4ea15b4	Russia attack knocked out pipeline carrying its own oil to Europe, Ukraine says
2026-02-12	tass	698d62a16e6392ce6c8cb80d	Russia to send batch of oil to Cuba as humanitarian aid — Russian embassy
2026-02-12	tass	698ec766c1fa2e60d4ea14ce	Russia holds about 20% of global DFA market — Alfa-Bank CEO
2026-02-12	tass	698ec76dc1fa2e60d4ea14e7	Russia continues to be Armenia's reliable partner in nuclear industry — MFA
2026-02-12	tass	698ec772c1fa2e60d4ea14f9	Russia not planning to block Google at this time, senior lawmaker says
2026-02-12	ukrinform	698d62206e6392ce6c8cb661	Russia strikes Dnipro with missiles and drones, two children injured
2026-02-12	ukrinform	698d62216e6392ce6c8cb665	Russia forcibly passportizing children in occupied territories – UK intel
2026-02-12	ukrinform	698ec64ac1fa2e60d4ea1274	Russia militarizing children in temporary occupied Ukrainian territories – CCD 
2026-02-13	straits-times	698ec78ec1fa2e60d4ea1587	Russia says Ukrainian drones hit houses, enterprises in Volgograd
2026-02-13	tass	698ec75cc1fa2e60d4ea14a7	Russia pushes Ukrainian troops out of two towns in Zaporozhye Region — military expert
2026-02-13	ukrinform	698ec645c1fa2e60d4ea1269	Russia loses 800 troops, one air defense system in Ukraine war over past day
2026-02-11	straits-times	698c2081a317c9d02ef1d4dd	Russia, facing labour crunch worsened by war, pivots to India for workers
2026-02-11	tass	698d62af6e6392ce6c8cb848	Russia, Bangladesh work out repayment plan on state loan to Dhaka — Russian Ambassador
2026-02-12	tass	698ec771c1fa2e60d4ea14f4	Russia's foreign trade surplus falls to $10 billion in December — Central Bank
2026-02-11	bbc-top	698c1f9da317c9d02ef1d305	Russian strike near Kharkiv kills four, including children, official says
2026-02-11	breitbart	698d624a6e6392ce6c8cb79d	Russian Drone Strike Kills Father and Three Children in Ukraine's Kharkiv
2026-02-11	egyptian-independant	698d62106e6392ce6c8cb629	Russian drone strike kills three Ukrainian toddlers and their father
2026-02-11	fox-world	698d63946e6392ce6c8cb9f6	Russian attack on Kharkiv wipes out young family, leaving pregnant mother as sole survivor
2026-02-11	ntp-world	698d63566e6392ce6c8cb9d4	Russian drone strike kills Ukrainian dad, 3 toddlers, and seriously injures pregnant wife: officials
2026-02-11	tass	698d62a66e6392ce6c8cb823	Russian Cabinet approves ratification of protocol on LNG projects with China
2026-02-11	tass	698d62a76e6392ce6c8cb827	Russian stock indices in the green on Wednesday — market data
2026-02-11	ukrinform	698c204aa317c9d02ef1d45b	Russian court sentences nine Ukrainian prisoners in one week – media
2026-02-11	ukrinform	698d62246e6392ce6c8cb66b	Russian forces strike store in Barvinkove, Kharkiv region, leaving seven injured
2026-02-11	ukrinform	698d62246e6392ce6c8cb66c	Russian drone attacks railway infrastructure again in Konotop district
2026-02-11	ukrinform	698d62276e6392ce6c8cb674	Russian attacks on Dnipropetrovsk region leave two civilians killed, three injured 
2026-02-11	ukrinform	698d62286e6392ce6c8cb676	Russian forces unable to enter Riasne in Sumy region – military 
2026-02-12	straits-times	698d624d6e6392ce6c8cb7b0	Russian war losses now exceed recruitment, Western officials say
2026-02-12	tass	698ec762c1fa2e60d4ea14bc	Russian envoy urges UN to continue providing humanitarian assistance to Yemen
2026-02-12	tass	698ec765c1fa2e60d4ea14c9	Russian cross-country skier Nepryayeva finishes 21st in women’s 10km event at Olympics
2026-02-12	tass	698ec769c1fa2e60d4ea14d9	Russian lawmaker urges Rutte not to hurl threats at world's largest nuclear power
2026-02-12	tass	698ec773c1fa2e60d4ea14fe	Russian foreign debt grew by $30 bln in 2025, reach $319.8 bln
2026-02-12	ukrinform	698d621f6e6392ce6c8cb660	Russian drone attack damages infrastructure facility in Odesa, one person injured
2026-02-12	ukrinform	698ec64fc1fa2e60d4ea1281	Russian forces attack three districts of Dnipropetrovsk region with artillery, drones in one day
2026-02-13	mehr-news	698ec656c1fa2e60d4ea12ba	Russian FM congratulates Iran revolution victory anniversary
2026-02-13	tass	698ec75dc1fa2e60d4ea14a8	Russian president's press service uses AI — Kremlin
2026-02-11	ukrinform	698c204aa317c9d02ef1d45c	Russians attack three communities in Sumy region over past day; one person killed, another injured 
2026-02-12	ukrinform	698ec650c1fa2e60d4ea1285	Russians continue to attack Kherson TPP with drones 
2026-02-13	ukrinform	698ec648c1fa2e60d4ea126f	Russians try to recruit Ukrainians to register Starlink terminals
2026-02-12	tass	698ec765c1fa2e60d4ea14c7	Russia’s first high-speed train to be tested in 2027
2026-02-12	tass	698ec773c1fa2e60d4ea14fd	Russia’s international reserves dropped by $29.3 bln over week — Central Bank
2026-02-12	et-europe	698ec82ac1fa2e60d4ea1680	Rutte Says 30,000 Russians Killed Monthly on Battlefield
2026-02-12	tass	698ec76bc1fa2e60d4ea14de	Rutte is engaging in verbal escalation, threatening Russia — legislator
2026-02-11	gbnews	698d62bf6e6392ce6c8cb8a7	Ryanair passenger 'head-butts and punches worker in face' over overweight baggage row
2026-02-11	gbnews-pol	698c1f8ca317c9d02ef1d2d6	Sadiq Khan addresses London school stabbing amid claims attacker shouted 'Allahu Akbar'
2026-02-12	cnbc-world	698ec6e3c1fa2e60d4ea13ea	Safe-haven currencies might not be so safe after a volatile year. Here's how the market is rethinking the Swiss franc, dollar and yen
2026-02-11	cnbc-world	698c1f84a317c9d02ef1d2d1	Salesforce employees call on CEO Benioff to cancel ICE 'opportunities'
2026-02-11	fox-latest	698c207da317c9d02ef1d4d1	Sam Darnold on what his NFL journey's lesson would be after Super Bowl win: 'Always believe in yourself'
2026-02-11	dw	698d62d06e6392ce6c8cb8db	Samer Tawk: From intensive care to Winter Olympic return
2026-02-12	saudi-gaz	698ec851c1fa2e60d4ea16f4	SAMI unveils fully Saudi-designed HEET armored vehicle program
2026-02-11	fox-us	698d63366e6392ce6c8cb9ac	San Francisco teachers union strike leaves 50,000 children out of school
2026-02-11	nyp-us	698c205aa317c9d02ef1d478	San Fran medical examiner trashes human skull, then fires worker who caught him, lawsuit claims
2026-02-12	nyp-us	698d62df6e6392ce6c8cb916	San Jose assistant principal honored with 49ers teaching award arrested in child predator sting
2026-02-11	bbc-top	698c1f9da317c9d02ef1d2fa	Sanctions-busting shadow ships are increasing - the big question is what to do about them
2026-02-12	breitbart	698ec86fc1fa2e60d4ea1725	Sanctuary California: Illegal Alien Hit with More Child Rape Charges After Allegedly Murdering 13-Year-Old Boy
2026-02-13	fox-politics	698ec654c1fa2e60d4ea12a1	Sanctuary policies let alleged child predator roam free until DHS made Portland, Oregon, airport arrest
2026-02-11	bbc-top	698d62be6e6392ce6c8cb880	Sarah Ferguson asked Epstein for bankruptcy advice while he was in jail, emails suggest
2026-02-11	waustralian-int	698c2016a317c9d02ef1d3e5	Sarah Ferguson makes 10-word vow to friend after shock Epstein bombshell
2026-02-11	bbc-pol	698d624b6e6392ce6c8cb7a5	Sarwar denies being part of wider plot to oust Starmer
2026-02-11	saudi-gaz	698d63a96e6392ce6c8cba15	Saudi FM receives letter from Russian counterpart
2026-02-11	saudi-gaz	698d63a96e6392ce6c8cba17	Saudi Aramco hits 70% localization benchmark as “iktva” generates 200,000 jobs
2026-02-11	saudi-gaz	698d63a96e6392ce6c8cba1a	Saudi Arabia and UK announce 2029 as joint cultural year
2026-02-11	saudi-gaz	698d63aa6e6392ce6c8cba1d	Saudi women’s pivotal security role spotlighted at World Defense Show
2026-02-12	dw-world	698ec752c1fa2e60d4ea1484	Saudi Arabia reshapes Vision 2030 around new priorities
2026-02-12	saudi-gaz	698ec850c1fa2e60d4ea16e6	Saudi FM arrives in Munich to attend security conference
2026-02-12	saudi-gaz	698ec851c1fa2e60d4ea16ed	Saudi defense minister meets Pakistan army chief in Riyadh
2026-02-12	saudi-gaz	698ec851c1fa2e60d4ea16ee	Saudi authorities step up crackdown on water leaks to prevent road flooding
2026-02-12	syrian-obs	698ec7a0c1fa2e60d4ea15b7	Saudi Acwa Clarifies Role in Syria After Oil and Gas Reports; Focus Remains on Water Desalination
2026-02-12	cnbc-politics	698d62ba6e6392ce6c8cb86f	SAVE Act: House advances Trump-backed voter ID bill
2026-02-12	gbnews-pol	698d622c6e6392ce6c8cb682	Savers rush to little-known tool to protect their retirement from Rachel Reeves's pension raid
2026-02-11	scrollin	698d63a06e6392ce6c8cba01	SC asks Calcutta HC to examine if invoking UAPA in Beldanga violence probe was justifiable
2026-02-12	scrollin	698ec824c1fa2e60d4ea166f	SC refuses to entertain Karnataka shrine’s plea seeking to restrict Shivratri rituals in premises
2026-02-12	scrollin	698ec828c1fa2e60d4ea167a	‘Scarpetta’ trailer: Crime show led by Nicole Kidman is based on the Patricia Cornwell bestsellers
2026-02-12	bbc-top	698d62be6e6392ce6c8cb881	Scrap proposed England holiday tax, hospitality bosses urge
2026-02-11	japantoday	698d61e16e6392ce6c8cb5b9	Seahawks celebrate Super Bowl win with title parade
2026-02-12	breitbart	698d62476e6392ce6c8cb770	Sean Duffy Blocks Illegal Truckers amid Many Road Killings
2026-02-12	straits-times	698ec79ac1fa2e60d4ea15a5	Second Uzbek woman dismembered, remains dumped in Istanbul bins: Turkish media
2026-02-13	ntp-world	698ec7d6c1fa2e60d4ea15e3	Second US aircraft carrier is being sent to the Middle East: report
2026-02-13	et-aus	698ec6d3c1fa2e60d4ea13ca	Security Bill Expands ASIO Questioning Warrants, Removes Sunset Clause
2026-02-11	fox-politics	698d63c36e6392ce6c8cba6a	‘Seditious Six’ Democrat lawmakers probed by Trump threaten legal battle
2026-02-12	nyp-pol	698ec6f4c1fa2e60d4ea1405	See the billionaires flooding Matt Mahan’s Gov campaign with cash – rivals says he’s owned by big tech
2026-02-12	fox-us	698ec6fdc1fa2e60d4ea1428	SEE IT: FBI scours neighborhoods near Nancy Guthrie’s Arizona home
2026-02-11	tass	698d62b56e6392ce6c8cb85f	Segezha Group's supplies to China via Northern Sea Route grow fourfold
2026-02-11	nyp-pol	698d62086e6392ce6c8cb5ff	Sen. Dave McCormick tells Pod Force One he’s ‘not satisfied’ with Trump Butler assassination attempt probes
2026-02-12	et-uspol	698ec82cc1fa2e60d4ea168d	Senate Blocks DHS Bill as Negotiations Continue 1 Day Before Shutdown Deadline
2026-02-12	et-aus	698d62bc6e6392ce6c8cb879	Senator Questions Whether eSafety Crackdown Could Strain US-Australia Ties
2026-02-12	et-uspol	698d61f56e6392ce6c8cb5d1	Senators Introduce Bipartisan Legislation to Break Up Health Care Conglomerates
2026-02-12	straits-times	698d62526e6392ce6c8cb7be	Senators question why US agency pushed out officials working on Chinese threats
2026-02-11	africa-news	698d63c26e6392ce6c8cba61	Senegal and Egypt's top diplomats discuss strengthening bilateral relations
2026-02-11	africa-news	698d63c26e6392ce6c8cba64	Senegalese government says death of student in protests is a 'tragedy'
2026-02-12	tass	698ec761c1fa2e60d4ea14ba	Senior Russian senator meets with Iranian ambassador
2026-02-12	et-uspol	698d61f56e6392ce6c8cb5d2	Sens. Kelly, Slotkin Denounce Justice Department for Seeking to Indict Them
2026-02-12	tass	698ec764c1fa2e60d4ea14c3	Severstal CEO expects decline in metals industry financials for 2025
2026-02-13	japantoday	698ec854c1fa2e60d4ea16ff	Sex workers at Nevada brothel fight for first-ever unionization
2026-02-11	bbc-world	698c1fc9a317c9d02ef1d3c4	Shaheen Malik: An acid attack survivor's fight for justice and dignity
2026-02-11	cnbc-world	698c1f85a317c9d02ef1d2d5	Shares of Australian biotech major CSL plunge to 8-year low after CEO departure, weak earnings
2026-02-12	fox-us	698ec6fdc1fa2e60d4ea1426	Sheriff disputes viral 911 call reporting key evidence found in Nancy Guthrie disappearance
2026-02-12	ukrinform	698ec650c1fa2e60d4ea1284	Shmyhal says damaged TPP-5 and TPP-6 in Kyiv to be restored within two days
2026-02-11	tass	698d62b46e6392ce6c8cb85c	Shooting at vocational school in Krasnodar Region: what we know
2026-02-13	fox-us	698ec6fcc1fa2e60d4ea1410	Shooting at South Carolina State University leaves two dead
2026-02-11	africa-news	698d63c26e6392ce6c8cba5f	Shootings at school and home in British Columbia, Canada, leave 10 dead
2026-02-11	japantoday	698c1faaa317c9d02ef1d39b	Shootings at school and home in British Columbia leave 10 dead, including shooter
2026-02-11	mainichi	698d63426e6392ce6c8cb9ca	Shootings at school and home in northeast British Columbia leave 10 dead including shooter
2026-02-11	cnbc-us	698d63246e6392ce6c8cb932	Shopify stock drops despite revenue beat, $2 billion buyback
2026-02-12	scrollin	698ec823c1fa2e60d4ea166e	Short fiction: The demolition of the Babri Masjid sends the journalists of a newspaper into a flurry
2026-02-12	et-intl	698ec7a3c1fa2e60d4ea15c5	Singapore Most Religiously Diverse Country, But US Tops Most Populated Nations: Study
2026-02-13	cnbc-asia	698ec758c1fa2e60d4ea149b	Singapore launches AI support measures, tax breaks in 2026 Budget
2026-02-11	bbc-top	698ec645c1fa2e60d4ea1261	Sir Jim Ratcliffe Says Sorry (To Some) For 'Colonised' Comments
2026-02-11	gbnews-pol	698d622c6e6392ce6c8cb689	Sir Ed Davey meets King Charles at Windsor Castle months after boycotting Donald Trump banquet
2026-02-12	bbc-top	698ec644c1fa2e60d4ea124f	Sir Chris Wormald forced out as head of Civil Service
2026-02-13	scrollin	698ec81cc1fa2e60d4ea165c	‘Sirat’ review: A hypnotic, sensorial experience of hostility and survival
2026-02-11	bbc-top	698d62be6e6392ce6c8cb893	Six dead in suspected murder-suicides in Bulgarian mountains, officials say
2026-02-11	nyp-pol	698d61fe6e6392ce6c8cb5f2	Six House Republicans break with White House to repeal Trump’s  Canada tariffs
2026-02-12	straits-times	698ec79ec1fa2e60d4ea15b0	Six more children reunited with Russian, Ukrainian families, US and Russia say
2026-02-13	fox-latest	698ec7d5c1fa2e60d4ea15de	Slovak man who traveled to Winter Olympics to cheer on hockey team arrested after 16 years on lam
2026-02-11	japantoday	698d61ec6e6392ce6c8cb5c5	Slovakia upsets Finland 4-1 to open men's ice hockey
2026-02-11	et-canada	698d62c56e6392ce6c8cb8c0	Snap Election Prospects Recede as Budget Bill Negotiations Under Way Between Liberals, Tories
2026-02-11	tass	698d62a96e6392ce6c8cb830	Snap check of Belarusian Armed Forces proceeds intensively — Security Council secretary
2026-02-12	gbnews	698ec706c1fa2e60d4ea1440	Snoop Dogg security guards 'involved in altercation' with Winter Olympics legend as US role turns sour
2026-02-12	et-uk	698ec7d4c1fa2e60d4ea15d5	Snow and Ice Warnings Issued as Arctic Air Blows In
2026-02-12	nyp-us	698d62e36e6392ce6c8cb91b	SoCal police chief faces ouster over holiday party striptease
2026-02-12	cnbc-world	698ec6e8c1fa2e60d4ea13f3	SoftBank books $4.2 billion gain on OpenAI bet, boosting its Vision Fund
2026-02-12	africa-intel	698ec7d2c1fa2e60d4ea15d1	South Africa : PetroSA closer to appointing new interim CEO
2026-02-12	africa-news	698ec7fbc1fa2e60d4ea162f	South Africa: Ramaphosa announces deployment of army to tackle crime
2026-02-12	dw	698ec7e3c1fa2e60d4ea15f6	South Africa's Ramaphosa to deploy army to combat crime
2026-02-12	et-asiapac	698ec850c1fa2e60d4ea16e5	South Korea’s Former Interior Minister Receives 7-Year Sentence in Martial Law Case
2026-02-12	straits-times	698ec798c1fa2e60d4ea15a2	South African president pledges focus on crime and water crises
2026-02-12	tass	698ec76cc1fa2e60d4ea14e5	Special operation experience to be used in CSTO exercises — Chief of Staff
2026-02-11	ukrinform	698c204ba317c9d02ef1d45e	Specialists destroy remains of Russian glide bomb in Kramatorsk
2026-02-13	nyp-us	698ec813c1fa2e60d4ea164f	Spencer Pratt’s bold strategy end LA’s drug and homeless problem
2026-02-11	bbc-top	698c1f9da317c9d02ef1d2fd	Spike in antisemitism reports after synagogue attack
2026-02-12	cnbc-us	698ec78cc1fa2e60d4ea1582	Spirit Airlines sells more planes, calls back 500 flight attendants from furlough ahead of spring break
2026-02-12	et-aus	698d62bc6e6392ce6c8cb877	Spy Chief Stands by 2019 Assessment of Bondi Gunman, Warns of Intelligence Limits
2026-02-12	cnbc-asia	698ec758c1fa2e60d4ea149a	Sri Lanka launched a new digital nomad visa—find out if you qualify and how to apply
2026-02-11	ukrinform	698d62226e6392ce6c8cb667	SSU exposes Russian agent behind attacks on Pokrovsk front
2026-02-11	bbc-pol	698d624a6e6392ce6c8cb7a3	Starmer faces call to appoint woman to first secretary of state role
2026-02-12	bbc-pol	698ec6d6c1fa2e60d4ea13db	Starmer agrees with Nandy over government's challenges, says No 10
2026-02-11	nyp-us	698c2051a317c9d02ef1d46c	State Department identifies Code Pink and other far-left groups as vectors of Chinese influence operations
2026-02-11	post-mill	698d63726e6392ce6c8cb9eb	State Dept reveals ties between leftist groups like Code Pink and CCP influence operations
2026-02-12	bbc-top	698ec644c1fa2e60d4ea1250	Statement win underlines GB curlers' golden claim
2026-02-12	et-uspol	698ec831c1fa2e60d4ea16a1	States Sue HHS to Try to Stop Withholding of $600 Million in Public Health Grants
2026-02-11	breitbart	698d62486e6392ce6c8cb782	Stephen A. Smith Knocks Bad Bunny Halftime Show: 'Would Have Been Nice if Some of the Songs Were in English'
2026-02-13	nyp-us	698ec813c1fa2e60d4ea1650	Steve Hilton’s CAL DOGE claims $370M California state funds went to Dems’ ‘voter machines’
2026-02-13	breitbart	698ec86fc1fa2e60d4ea172a	Steven Spielberg Donates $25,000 to James Van Der Beek's Family After Beloved Actor's Death
2026-02-13	straits-times	698ec78ec1fa2e60d4ea1585	Stowaway raccoon from US finds new home in Belarus
2026-02-11	dn-egypt	698d63616e6392ce6c8cb9e5	Strong expectations of 1-2% cut in EGP interest rates at CBE’s first meeting of 2026
2026-02-12	straits-times	698ec79ec1fa2e60d4ea15b1	Strong winds disrupt flights, injure dozens in Spain
2026-02-12	africa-news	698ec7ffc1fa2e60d4ea1643	Students turn on Senegalese government over Dakar university violence
2026-02-12	tass	698ec768c1fa2e60d4ea14d6	SUAL reduces stake in Rusal to 22.249% — company
2026-02-12	tass	698ec767c1fa2e60d4ea14d1	Sual’s stake in Rusal essentially unchanged, reduction is technical in nature
2026-02-11	africa-intel	698c209aa317c9d02ef1d51a	Sudan : Berlin peace conference aims to avoid London mistakes
2026-02-11	africa-news	698d63c06e6392ce6c8cba58	Sudan RSF drone strike on school kills two children
2026-02-11	bbc-top	698c1f9da317c9d02ef1d2f9	Sunbed ads spreading harmful misinformation to young people
2026-02-12	bbc-pol	698ec6d7c1fa2e60d4ea13e4	Supersized dump fire risk report kept from public
2026-02-11	scrollin	698d63a46e6392ce6c8cba0a	Supreme Court approves Assam mechanism to evict alleged encroachers of forest land
2026-02-12	et-uspol	698ec831c1fa2e60d4ea16a2	Supreme Court to Hear Roundup Maker’s Bid to Block Thousands of Lawsuits in April
2026-02-12	scrollin	698ec825c1fa2e60d4ea1672	Supreme Court rejects Jairam Ramesh’s plea against retrospective environmental clearances
2026-02-11	fox-politics	698c1f43a317c9d02ef1d2b8	Susan Collins shrugs off attacks by Democrats and Trump, says Maine voters ‘Don’t vote party line’
2026-02-13	et-aus	698ec6d4c1fa2e60d4ea13cf	Sussan Ley Quits After 25 Years, Says She’ll Step Away ‘Comprehensively’
2026-02-13	waustralian-pol	698ec67ac1fa2e60d4ea12f7	Sussan Ley’s full speech announcing resignation after being ousted from Liberal leadership
2026-02-11	et-intl	698d63356e6392ce6c8cb99f	Sweden Tightens Up Citizenship Rules Amid Illegal Immigration Crackdown
2026-02-12	japantoday	698ec860c1fa2e60d4ea170c	Sweden’s women overwhelm Olympic cross-country field with seven of nine medals so far
2026-02-11	japantoday	698d61ee6e6392ce6c8cb5c7	Swiatek, Rybakina fight back to reach Qatar Open quarterfinals
2026-02-12	japantoday	698ec859c1fa2e60d4ea1705	Swiatek, Rybakina dumped out of Qatar Open
2026-02-12	japantoday	698ec85bc1fa2e60d4ea1707	Swiss bar owners face wrath of bereaved families
2026-02-12	dw-world	698ec74ec1fa2e60d4ea147a	Switzerland to vote on capping population at 10 million
2026-02-11	ntp-world	698d635d6e6392ce6c8cb9dd	Sydney chef Davide Vulpis dies in Bali motorcycle crash
2026-02-12	syrian-obs	698ec7a1c1fa2e60d4ea15b9	Syrian-Jordanian Business Forum Launches in Damascus to Explore Investment Opportunities
2026-02-12	tass	698ec76ec1fa2e60d4ea14eb	T-Plus explores potential energy projects with Tajikistan
2026-02-12	tass	698ec76fc1fa2e60d4ea14ed	T-Plus net profit may reach $64.73-90.63 mln in 2025
2026-02-12	tass	698ec76fc1fa2e60d4ea14ef	T-Plus to raise 2026 investment program by 21.3% to $627.87 mln
2026-02-12	tass	698ec770c1fa2e60d4ea14f1	T-Plus power generation down 4.7% in 2025 to 55.1 bln kWh
2026-02-12	nyp-tech	698ec66ec1fa2e60d4ea12ee	Table for one? Now you can take your AI chatbot on an actual date at NYC’s ‘world first’ companion cafe
2026-02-13	tass	698ec75bc1fa2e60d4ea14a1	Taiwan, US sign trade agreement on tariff reduction — newspaper
2026-02-11	et-asiapac	698d63c86e6392ce6c8cba8f	Taiwanese President Urges Parliament to Pass Military Budget to Bolster Defense Against China
2026-02-11	cnbc-politics	698d62bb6e6392ce6c8cb872	Tariff bills across U.S. states mount as affordability and Trump head for midterm elections showdown
2026-02-11	cnbc-us	698d63236e6392ce6c8cb92d	Tariff revenue soars more than 300% as U.S. awaits Supreme Court decision
2026-02-11	et-aus	698d62bd6e6392ce6c8cb87b	Taylor Quits Frontbench Amid Leadership Challenge Speculation
2026-02-12	et-aus	698d62bc6e6392ce6c8cb878	Taylor Challenges Ley for Party Leadership as 3 Frontbenchers Resign
2026-02-12	et-aus	698ec6d4c1fa2e60d4ea13d1	Taylor Wins Liberal Party Leadership in Landslide
2026-02-13	bbc-top	698ec644c1fa2e60d4ea125a	Taylor Swift asks US government to block 'Swift Home' trademark
2026-02-11	nyp-us	698c2056a317c9d02ef1d473	Teachers email parents demanding they don’t homeschool kids – as San Francisco strike grinds into a third day
2026-02-11	breitbart	698d62486e6392ce6c8cb781	Team USA Bobsled Athlete Jasmine Jones: 'Honored' to Represent U.S. and Air Force at Winter Olympics
2026-02-11	et-canada	698d62c66e6392ce6c8cb8c2	Tearful Carney Says ‘Nation Mourns’ After BC High School Mass Killing
2026-02-11	cnbc-top	698d63ac6e6392ce6c8cba27	Tech investor Orlando Bravo says most software companies don't have enough profit
2026-02-12	cnbc-world	698ec6ebc1fa2e60d4ea13f8	Tech IPO hype gets drowned out on Wall Street by prospect of $1 trillion in debt sales
2026-02-11	notesfrompoland	698d63be6e6392ce6c8cba4b	Teen to stand trial in Poland for planning Islamic State-inspired attack
2026-02-11	nyp-us	698c205ba317c9d02ef1d47a	Teen DUI suspect kills couple on their way home from church in SoCal crash
2026-02-12	nyp-us	698d62e26e6392ce6c8cb91a	Teen killed, two others wounded in massive NYC street brawl
2026-02-11	dw	698c2066a317c9d02ef1d491	Telegram CEO vows to fight for app amid Russia pressure
2026-02-11	straits-times	698c2086a317c9d02ef1d4ed	Telegram app faces further restrictions, possible fines as Russian authorities clamp down
2026-02-11	gbnews	698c1fa7a317c9d02ef1d38f	Ten dead and more than 25 injured as Canada suffers deadliest school shooting this century
2026-02-11	straits-times	698c2082a317c9d02ef1d4df	Ten dead after shooter opens fire at high school in Canada
2026-02-12	dw	698ec7e5c1fa2e60d4ea15fb	Tense start at Berlinale as 'genocide' question coincides with 'technical problems'
2026-02-12	ntp-world	698ec7dbc1fa2e60d4ea15ea	Terrifying video shows plane flying with shredded engine after midair explosion
2026-02-12	bbc-top	698ec644c1fa2e60d4ea125d	Tesco plans to give under-18s Clubcard access this year
2026-02-11	et-uspol	698c2015a317c9d02ef1d3de	Texas Investigating Dubai-Based Developer Over ‘Sharia City’ Concerns
2026-02-11	et-uspol	698d61fa6e6392ce6c8cb5ed	Texas Saddles Up for Senate Primaries: What to Know
2026-02-11	fox-us	698d63356e6392ce6c8cb9a9	Texas border officers arrest 3 fugitives wanted for alleged child sex crimes
2026-02-11	nyp-us	698c2055a317c9d02ef1d472	Texas dad fatally shoots own daughter after ‘big argument’ about President Trump
2026-02-11	tass	698d62b46e6392ce6c8cb85b	Thai police arrest shooter at school in southern Thailand
2026-02-11	africa-news	698d63c16e6392ce6c8cba5e	The Amazons of African cinema triumph at the 4th edition of FIFF Cotonou
2026-02-11	arutz-sheva	698c203fa317c9d02ef1d42f	The Jewish People: Myth or reality? A lie with a purpose
2026-02-11	bbc-top	698c1f9da317c9d02ef1d300	The Papers: 'Terror probe into stabbing' and 'Streeting still intent'
2026-02-11	cnbc-us	698d63226e6392ce6c8cb92b	The jobs picture still looks muddy, even with surprisingly strong January growth
2026-02-11	egyptian-streets	698d622b6e6392ce6c8cb67d	The Silent Struggle Continues: Living With Bulimia During Pregnancy
2026-02-12	africa-news	698ec7fec1fa2e60d4ea163c	The Morocco-Spain-Portugal Business Forum on the 2030 FIFA World Cup opens
2026-02-12	bbc-top	698d62be6e6392ce6c8cb88a	The Dutch love four-day working weeks, but are they sustainable?
2026-02-12	bbc-top	698d62be6e6392ce6c8cb88c	The Papers:  'Police assessing Andrew's "leaks"' and 'Outrage at Prem boss'
