2026-02-12	straits-times	698d624d6e6392ce6c8cb7b1	Chicago teacher shot by Border Patrol agent plans to sue agent and Homeland Security
2026-02-12	thehindu	698ec77ec1fa2e60d4ea1551	Childhood cancer cases on steady rise in Karnataka; 1,882 estimated cases in 2025, with Bengaluru at 349 
2026-02-13	tass	698ec75bc1fa2e60d4ea14a3	Chilean president denounces blockade of Cuba as crime
2026-02-11	cnbc-world	698c1f83a317c9d02ef1d2cf	China consumer inflation rises less than expected in January as producer price deflation persists
2026-02-11	egyptian-independant	698d62106e6392ce6c8cb628	China’s AI industry looks unstoppable in the race to best US rivals. But is it?
2026-02-11	et-chinareg	698d620f6e6392ce6c8cb626	China’s Annual Military Meeting Reveals Unusual Absence of Top Generals Amid Ongoing Purge
2026-02-11	africa-news	698d63c16e6392ce6c8cba5d	Chinese community in Abuja hosts temple fair to mark Spring Festival
2026-02-11	mehr-news	698d618e6e6392ce6c8cb591	Chinese FM felicitates anniversary of Islamic Rev. victory
2026-02-12	breitbart	698ec870c1fa2e60d4ea1739	Chinese Dictator Xi Jinping Reveals ‘Cyberspace Force’ Base in South China Sea
2026-02-12	et-chinareg	698d620e6e6392ce6c8cb623	Chinese Regime Heightens Scrutiny on Residents’ Overseas Income Amid Worsening Economy
2026-02-12	fox-latest	698d62d66e6392ce6c8cb8f5	Chinese criminal gang allegedly recruited Navy members for sham marriages and base access
2026-02-12	japantoday	698ec868c1fa2e60d4ea1715	Chloe Kim falls short of Olympic three-peat, taking silver as Choi Gaon wins women's halfpipe
2026-02-12	bbc-top	698ec644c1fa2e60d4ea124d	Choi, 17, denies Kim historic third halfpipe gold
2026-02-13	gbnews	698ec705c1fa2e60d4ea1429	​Chopper's Political Podcast Episode 81 - Suella Braverman - WATCH IN FULL
2026-02-11	bbc-pol	698c1f96a317c9d02ef1d2e7	Chris Mason: Smiles of a survivor as Starmer attempts his latest reset
2026-02-12	bbc-pol	698d624b6e6392ce6c8cb7aa	Chris Mason: Latest vetting row raises fresh concerns over Starmer's judgement
2026-02-11	gbnews	698d62bf6e6392ce6c8cb8ab	Christian persecution reaches RECORD HIGH as almost 400 million face violence and discrimination
2026-02-11	gbnews-pol	698d622d6e6392ce6c8cb691	Christian nurse suspended by NHS for misgendering trans prisoner demands answers from Labour over delay to single-sex spaces rules
2026-02-11	ukrinform	698d62276e6392ce6c8cb673	CinC Syrskyi reviews combat operations in Zaporizhzhia, Dnipropetrovsk regions
2026-02-12	cnbc-top	698d63ab6e6392ce6c8cba25	Cisco shares slide after earnings fail to wow the Street. Here's our plan for the stock
2026-02-12	cnbc-world	698ec6e9c1fa2e60d4ea13f6	Cisco stock has worst day since 2022 as memory prices pressure margins
2026-02-11	cnbc-us	698d63226e6392ce6c8cb927	Cisco's stock drops 7% on mediocre forecast even as earnings and revenue top estimates
2026-02-11	mainichi	698c1fc6a317c9d02ef1d3ba	City neighboring Tokyo to make day care free for kids aged 2 and younger
2026-02-12	bbc-pol	698ec6d6c1fa2e60d4ea13e2	Civil service pension backlog 'overwhelmed' Capita, boss says
2026-02-12	indiaexpress	698d62356e6392ce6c8cb6dd	Civil Services were not built only for file disposal. Government’s ‘scorecards’ forget that
2026-02-12	mehr-news	698ec668c1fa2e60d4ea12d5	Closing ceremony of 44th Fajr Intl. Film Festival in Tehran
2026-02-11	indiaexpress	698c1fa0a317c9d02ef1d332	Cloudflare forecasts annual sales above estimates as AI drives cloud demand
2026-02-11	dnaindia	698d626e6e6392ce6c8cb7e9	CM Rekha Gupta announces Delhi Lakhpati Bitiya Yojana; Know eligibility, criteria and benefits
2026-02-12	dnaindia	698ec789c1fa2e60d4ea1571	CM Rekha Gupta-led Delhi government to contribute Rs 2940 crore under Metro Phase V, project to be completed in 2028
2026-02-13	thehindu	698ec780c1fa2e60d4ea155c	CM Revanth Reddy urges Centre to procure 18 LMT paddy over and above agreed quantity
2026-02-11	cnbc-world	698c1f83a317c9d02ef1d2d0	CNBC Daily Open: AI might come for financial firms next — and a weak U.S. retail report weighs on stocks
2026-02-12	cnbc-world	698d63c56e6392ce6c8cba87	CNBC Daily Open: Better-than-expected U.S. jobs report and AI fears spook markets
2026-02-13	cnbc-world	698ec6e4c1fa2e60d4ea13ed	CNBC Daily Open: AI is coming after more sectors, and its pace isn't slowing
2026-02-11	cnbc-europe	698d62c26e6392ce6c8cb8b4	CNBC's UK Exchange newsletter: Compass shifts its trading to dollars — and it might not be the last
2026-02-11	cnbc-world	698c1f82a317c9d02ef1d2cd	CNBC's The China Connection newsletter: Inside China’s push to feed 1.4 billion people without U.S. crops
2026-02-13	breitbart	698ec86fc1fa2e60d4ea1721	CNN's Cooper: 'Thousands' of Immigration Officers in Minnesota 'Probably Couldn't Make It on a Police Force' or Military
2026-02-11	fox-us	698d63366e6392ce6c8cb9ad	Coast Guard veteran, wife and two children found dead inside Florida home
2026-02-12	africa-news	698ec7fbc1fa2e60d4ea1630	Cocoa: Ghana slashes farmgate rate paid to farmers
2026-02-13	indiaexpress	698ec6c0c1fa2e60d4ea1306	Coffee row at Bengaluru airport: 3 policemen suspended after ‘midnight assault’ on canteen staff
2026-02-11	straits-times	698d62556e6392ce6c8cb7c9	Colleges took in US$5.2 billion from outside the US in 2025
2026-02-11	straits-times	698d62556e6392ce6c8cb7c6	Colombia's 'outsider' candidate De La Espriella vows military crackdown to boost economy
2026-02-13	nyp-us	698ec810c1fa2e60d4ea1649	Columbia University axes personnel after files reveal Ivy League admitted Jeffrey Epstein’s girlfriend through ‘irregular’ admissions
2026-02-12	saudi-gaz	698ec850c1fa2e60d4ea16eb	Commerce Ministry beefs up inspection tours of commercial stores in Madinah ahead of Ramadan
2026-02-12	et-aus	698ec6d4c1fa2e60d4ea13d3	Commissioner Says Police Not Targeting Any Religion During Protest Response
2026-02-12	indiaexpress	698ec6c9c1fa2e60d4ea136f	Committee hearing: Joint polls do not violate Constitution’s basic structure, says former CJI Gavai
2026-02-11	et-aus	698c2047a317c9d02ef1d451	Commonwealth Bank Shares Soar After ‘Stonking’ Half-Year Result
2026-02-11	straits-times	698c2083a317c9d02ef1d4e4	Commonwealth boss confident of progress on slavery reparations
2026-02-12	thehindu	698ec780c1fa2e60d4ea155e	Community programmes mark Cyberabad Police’s 24th Formation Day celebrations
2026-02-11	et-canada	698d62c56e6392ce6c8cb8bf	Condolences Pour In From Around the World Following BC School Tragedy
2026-02-11	africa-intel	698c209ba317c9d02ef1d51b	Congo : Sassou-Nguesso whips up an extra-large campaign team
2026-02-11	africa-intel	698c209ca317c9d02ef1d51d	Congo : Unable to get paid, Swiss multinational SGS exits the country
2026-02-11	indiaexpress	698d623f6e6392ce6c8cb733	Congress govt grants Cabinet status to BJP leader; withdraws later
2026-02-11	thehindu	698d632f6e6392ce6c8cb974	Congress will bag 80% of civic bodies in Telangana, says Ponnam Prabhakar
2026-02-12	nyp-pol	698ec6f9c1fa2e60d4ea140b	Congress expands probe of TeaOnHer app accused of letting men post nudes of exes
2026-02-12	thehindu	698d632c6e6392ce6c8cb955	Congress legislators of Karnataka to tour Australia, New Zealand from February 16
2026-02-12	thehindu	698ec77cc1fa2e60d4ea154b	Congress demands Petroleum Minister Hardeep Singh Puri’s resignation
2026-02-13	thehindu	698ec777c1fa2e60d4ea150d	Congress MLC Channaraj Hattiholi dismisses rumours that Deputy CM D.K. Shivakumar is planning coup in Karnataka
2026-02-11	indiaexpress	698c1fa1a317c9d02ef1d339	Congress, AAP back doubts raised by Rohit Pawar on Ajit Pawar plane crash
2026-02-12	indiaexpress	698d62366e6392ce6c8cb6e3	Construction of Babri Masjid replica begins in Bengal, sets off political row
2026-02-12	thehindu	698d632b6e6392ce6c8cb944	Construction of ‘Babri Masjid’ begins at Murshidabad
2026-02-12	indiaexpress	698d62326e6392ce6c8cb6b1	Contaminated drinking water supply dominates Chandigarh MC’s General House meeting
2026-02-12	indiaexpress	698ec6ccc1fa2e60d4ea138a	‘Controversy is best avoided, festival safety paramount’: Kala Ghoda director
2026-02-12	fox-us	698ec6fcc1fa2e60d4ea141f	Convicted drive-by killer executed in Oklahoma, requested classic fast-food feast as final meal
2026-02-12	japantoday	698ec86bc1fa2e60d4ea1718	Cooper Woods upsets Mikael Kingsbury for gold in men's moguls in tiebreaker
2026-02-12	gbnews-pol	698ec757c1fa2e60d4ea148c	Council will no longer support State Visits after 'not receiving reimbursement for hosting Donald Trump'
2026-02-12	gbnews-pol	698ec757c1fa2e60d4ea1498	Council hides identity of company tearing down Union Jack flags after shelling out £16k
2026-02-12	africa-news	698ec7fec1fa2e60d4ea1640	Court ruling on Mali sanctions reignites regional integration debate {Business Africa}
2026-02-13	ukrinform	698ec647c1fa2e60d4ea126e	Court sentences Russian agent who tried to 'get hired' by SBU to 15 years in prison
2026-02-12	et-la	698d62d76e6392ce6c8cb902	Craig Colclough: A Conversation With a Californian Opera Singer
2026-02-11	nyp-us	698c2051a317c9d02ef1d46d	Creep charged after dismembered body of missing Indiana teen Hailey Buzbee found in Ohio
2026-02-12	fox-politics	698ec655c1fa2e60d4ea12a9	Cruz targets Minnesota-style fraud with bill requiring proof before federal childcare payouts
2026-02-12	tass	698ec771c1fa2e60d4ea14f6	CSTO Chief of Staff outlines priorities of Russia's 2026 chairmanship
2026-02-12	et-uk	698ec7d5c1fa2e60d4ea15d7	Culture Secretary Intervenes in Daily Mail Owner’s £500M Telegraph Takeover
2026-02-12	japantoday	698ec856c1fa2e60d4ea1702	Curling along
2026-02-11	thehindu	698d63316e6392ce6c8cb985	Curtains go up for VAIGA 2026 fest at Anayara World Market
2026-02-12	thehindu	698ec781c1fa2e60d4ea1561	Customs officials seize cigarettes, gutka and gold worth over ₹15 lakh at RGIA
2026-02-11	thehindu	698c2077a317c9d02ef1d4ab	Cyberabad Municipal Corporation Commissioner takes charge 
2026-02-11	tass	698d62ab6e6392ce6c8cb839	Cyclone Gezani death toll rises to 20 — Madagascar authorities
2026-02-12	africa-news	698ec7fdc1fa2e60d4ea1637	Cyclone Gezani: At least 36 killed, hundreds injured in Madagascar
2026-02-11	ukrinform	698d62296e6392ce6c8cb679	Czech initiative “Memory of Nations” delivers over 350 generators, medical equipment to Ukraine
2026-02-11	indiaexpress	698c1fa1a317c9d02ef1d336	Daily Briefing: Ex-Army Chief General M M Naravane breaks silence on row over memoir
2026-02-12	indiaexpress	698d62336e6392ce6c8cb6ba	Daily Briefing: Bangladesh goes to first parliamentary polls after Sheikh Hasina’s ouster
2026-02-12	tass	698ec774c1fa2e60d4ea1501	Daily cryptocurrencies turnover in Russia reach $648 mln — Finance Ministry
2026-02-13	indiaexpress	698ec6c3c1fa2e60d4ea1328	Daily Briefing: BNP secures massive victory in historic Bangladesh elections
2026-02-12	indiaexpress	698ec6cdc1fa2e60d4ea1391	Dankuni-Surat freight corridor: Railway Board asks agency to update DPR, formalise optimum tech standards
2026-02-11	cnbc-top	698d63ac6e6392ce6c8cba26	David Einhorn says the Fed will cut 'substantially more' than two times. So he's betting big on gold
2026-02-11	gbnews	698d62bf6e6392ce6c8cb8a1	David Lammy urged to block early release of one of Britain's most dangerous terrorists
2026-02-11	bbc-top	698d62be6e6392ce6c8cb88f	Dawson's Creek star James Van Der Beek dies aged 48
2026-02-12	indiaexpress	698d62346e6392ce6c8cb6cc	Dawson’s Creek star James Van Der Beek passes away at 48; Family issues statement: ‘He met his final days with courage’
2026-02-11	indiaexpress	698c1f9ea317c9d02ef1d311	Day after announcement | ‘Sidelined’: Four Navsari BJP leaders from Koli community resign from new district party posts
2026-02-13	indiaexpress	698ec6c1c1fa2e60d4ea1318	Days ahead of daughter’s marriage, gold worth Rs 65 lakh ‘missing’ from bank locker, Vadodara family files police complaint
2026-02-13	indiaexpress	698ec6c3c1fa2e60d4ea1329	Days after swing collapse killed inspector at Surajkund Mela | Ride section cordoned off, cops stationed round the clock, but the show goes on
2026-02-11	cnbc-top	698c2039a317c9d02ef1d404	DC grand jury declines to indict Sens. Kelly, Slotkin for seditious conspiracy: MS Now
2026-02-12	indiaexpress	698d62366e6392ce6c8cb6e6	DC, tehsildar ‘misappropriated funds’ for crucial Bharatmala road project, arrested
2026-02-11	arutz-sheva	698d62086e6392ce6c8cb609	Deadly school shooting in Canada: Suspect identified as 18-year-old woman
2026-02-11	dw-world	698d620b6e6392ce6c8cb61c	Death Penalty on the decline in Southeast Asia
2026-02-11	tass	698d62a56e6392ce6c8cb81d	Death toll from Cyclone Gezani in Madagascar rises to 31 — authorities
2026-02-11	ukrinform	698d62256e6392ce6c8cb66d	Death toll from Russian drone attack on Dnipropetrovsk region rises to four
2026-02-12	ntp-world	698ec7e1c1fa2e60d4ea15f2	Deaths in Iran’s crackdown on protests reach at least 7,000, activists say
2026-02-12	gbnews-pol	698ec757c1fa2e60d4ea1499	Deborah Meaden risks BBC Dragons' Den feud as she slams Jim Ratcliffe's illegal migrant warning amid Duncan Bannatyne backing
2026-02-11	indiaexpress	698d623a6e6392ce6c8cb706	Decline in number of Indians going abroad for studies, says Govt
2026-02-11	indiaexpress	698c1fa4a317c9d02ef1d361	Decode Politics: Why 16th Finance Commission proposal has Himachal govt on the warpath, BJP on the defensive
2026-02-11	indiaexpress	698c1fa4a317c9d02ef1d35c	‘Defective processes’: Odisha rights panel calls for high-level probe into relocation of villages near tiger reserve
2026-02-12	indiaexpress	698ec6d1c1fa2e60d4ea13bd	Defence Ministry signs Rs 2,312-crore deal with HAL for 8 Dornier 228 aircraft, equipment for Coast Guard
2026-02-11	japantoday	698d61e26e6392ce6c8cb5ba	Defending champion Ayumu Hirano and Scotty James set for Olympic halfpipe rematch
2026-02-12	arutz-sheva	698d62086e6392ce6c8cb605	Degel HaTorah slams Yesh Atid’s Stern: Rude and arrogant
2026-02-12	gbnews	698ec706c1fa2e60d4ea143a	Delayed local elections could be FORCED to go ahead as Tories urged to back high-stakes 'fatal motion'
2026-02-11	et-uspol	698c2014a317c9d02ef1d3dd	Delgado Drops Primary Challenge to Hochul for NY Governor
2026-02-11	dnaindia	698d62696e6392ce6c8cb7e3	Delhi govt under CM Rekha Gupta unveils 215-point plan to tackle traffic at 62 key hotspots
2026-02-11	dnaindia	698d626c6e6392ce6c8cb7e6	Delhi to get three new Metro corridors under Phase 5, 16 km length, 13 new stations, check details
2026-02-11	thehindu	698d63316e6392ce6c8cb98a	Delhi HC seeks production, sales details from Rapsodia in Anupama Dayal copyright suit
2026-02-12	dnaindia	698ec788c1fa2e60d4ea1570	Delhi news: New metro corridor to pass through Central Vista, benefit 60,000 govt employees, to connect India Gate, Bharat Mandapam
2026-02-12	indiaexpress	698d62336e6392ce6c8cb6c1	Delhi Metro Phase V(A) approved: New 16km route to connect Central Vista, India Gate, and Airport T1
2026-02-12	indiaexpress	698d62396e6392ce6c8cb703	Delhi Confidential: Word Watch
2026-02-12	indiaexpress	698ec6c9c1fa2e60d4ea136d	Delhi Confidential: Sonia Support
2026-02-12	thehindu	698d632b6e6392ce6c8cb946	Delhi High Court asks Centre to respond to plea on ‘surge’ in missing person cases
2026-02-12	dnaindia	698ec783c1fa2e60d4ea156b	Delhi: CM Rekha Gupta-led govt approves 146 Projects for SC/ST settlements worth Rs 85 crore, 'the era of...'
2026-02-13	dnaindia	698ec782c1fa2e60d4ea1569	Delhi: Schools receive bomb threat emails, premises evacuated; authorities on high alert
2026-02-11	fox-politics	698c1f43a317c9d02ef1d2b7	Dem senator fumes that GOP's foreign funding claim 'delegitimizes' anger of anti-ICE agitators in US
2026-02-13	breitbart	698ec86fc1fa2e60d4ea1726	Dem Sen. Welch: Blocking DHS Funding Has 'Very Little' Impact on ICE, CBP
2026-02-13	breitbart	698ec86fc1fa2e60d4ea1727	Dem Sen. Peters on DHS Shutdown Hurting Coast Guard, FEMA, TSA, Not ICE: Republicans Are Going to Do That
2026-02-11	nyp-pol	698d62006e6392ce6c8cb5f4	Democrat candidate running against NY Rep. Mike Lawler seeks votes on Tinder
2026-02-12	breitbart	698ec871c1fa2e60d4ea1746	Democrat Rep. Jayapal Claims Attorney General Pam Bondi Monitored Her Epstein File Searches: 'Outrageous'
2026-02-12	et-uspol	698ec82ac1fa2e60d4ea1686	Democrats Say GOP Funding Plan for Homeland Security Doesn’t Deliver Needed Changes
2026-02-12	fox-politics	698ec655c1fa2e60d4ea12a8	Democrats salivate at GOP's near zero-vote margin as shutdown looms over ICE reform gridlock
2026-02-12	fox-politics	698ec655c1fa2e60d4ea12b3	Democrats fume at Bondi after photo allegedly shows DOJ tracking Epstein database searches
2026-02-12	fox-politics	698ec655c1fa2e60d4ea12b0	Dems dig in, guarantee shutdown with block of DHS funding
2026-02-13	indiaexpress	698ec6c8c1fa2e60d4ea1353	Derek O’Brien writes | Years after MeToo, a silence, broken briefly, can be heard again
2026-02-11	ukrinform	698c204da317c9d02ef1d462	Deserted from military unit: Ukrainian Armed Forces brigade detains Russian GRU mole
2026-02-12	tass	698ec76bc1fa2e60d4ea14e1	Destruction of Lasar Group plant deals serious blow to Ukraine's war effort — expert
2026-02-13	thehindu	698ec776c1fa2e60d4ea150a	Dhinakaran calls for regularisation of 328 temporary teaching staff in Anna University constituent colleges
2026-02-11	fox-latest	698d62d76e6392ce6c8cb901	DHS unloads on anti-ICE Dems after man arrested with manifesto, 'disturbing' alleged plot to kill agents
2026-02-12	nyp-pol	698d61fd6e6392ce6c8cb5f0	DHS slams ‘activist judge’ for releasing four illegal migrants with attempted murder and child sex crime convictions
2026-02-12	nyp-pol	698ec6f4c1fa2e60d4ea1404	DHS shutdown at the end of Friday inevitable as Sen. Thune admits lawmakers ‘not close’ to a deal
2026-02-13	cnbc-politics	698ec669c1fa2e60d4ea12d9	DHS shutdown all but certain as Democrats and Trump White House can't cut deal
2026-02-12	indiaexpress	698ec6cac1fa2e60d4ea1370	Did Sonam Wangchuk confirm he saw videos that led to detention: Supreme Court
2026-02-12	thehindu	698ec77dc1fa2e60d4ea1550	Did Sonam Wangchuk see videos cited as proof for detention under NSA, Supreme Court asks Govt.
2026-02-11	et-canada	698d62c76e6392ce6c8cb8c5	‘Directly Above Her’: Saskatchewan Man Recalls Fight With Moose to Save Mother
2026-02-11	mainichi	698c1fc9a317c9d02ef1d3c3	Disciplinary actions against Japan police officers reach 337 in 2025, highest in decade
2026-02-11	bbc-top	698c1f9da317c9d02ef1d304	Disney advert banned for showing 'disturbing' severed body
2026-02-11	breitbart	698d62486e6392ce6c8cb78b	Disney’s Woke ‘Snow White’ Ended Up Losing a Staggering $170 Million
2026-02-11	thehindu	698d63316e6392ce6c8cb98e	Distribution of deworming tablets begins in Villupuram
2026-02-12	ukrinform	698d62206e6392ce6c8cb662	DIU secret raid in Crimea: Premiere of Shadows on Edge documentary film
2026-02-12	fox-us	698ec6fcc1fa2e60d4ea141a	DNA splatter suggests Nancy Guthrie was bleeding from ‘either the hands or face,' expert says
2026-02-13	nyp-us	698ec813c1fa2e60d4ea164e	DNA splatter reveals Nancy Guthrie was bleeding from ‘either the hands or face,’ expert says
2026-02-13	indiaexpress	698ec6c5c1fa2e60d4ea1345	Do you really need to read to be at a lit fest?
2026-02-13	indiaexpress	698ec6c9c1fa2e60d4ea1369	Do what you can, not budging: Rahul Gandhi after BJP MP seeks his expulsion from Lok Sabha
2026-02-13	bbc-top	698ec644c1fa2e60d4ea125b	Does Australian politics still have a problem with women?
2026-02-12	breitbart	698ec870c1fa2e60d4ea1730	DOJ Antitrust Head Gail Slater Resigns After Tenure Featuring Google's Infamous Slap on the Wrist Verdict
2026-02-12	et-uspol	698ec82bc1fa2e60d4ea1689	DOJ Wants State Voter Rolls–What to Know
2026-02-11	nyp-pol	698d62056e6392ce6c8cb5fb	Don Lemon hires ex-federal prosecutor who quit in protest over Renee Nicole Good probe
2026-02-12	bbc-pol	698ec6d6c1fa2e60d4ea13de	Don't change rules for migrants already in UK, Labour MPs tell Mahmood
2026-02-11	gbnews-pol	698d622e6e6392ce6c8cb69d	Donald Trump hands over control of THREE Nato bases with Britain set for major defence boost
2026-02-12	gbnews	698ec706c1fa2e60d4ea1437	Donald Trump revokes landmark greenhouse gases ruling despite risk to millions of Americans
2026-02-12	gbnews-op	698ec80fc1fa2e60d4ea1647	Donald Trump just threw Britain a major lifeline because he believes in her more than the PM does - Lee Cohen
2026-02-12	indiaexpress	698ec6c9c1fa2e60d4ea136c	‘Don’t keep the water bottle on your table’: Milind Soman’s no-gym survival guide for office workers
2026-02-12	fox-us	698ec6fcc1fa2e60d4ea1416	DOT closes major commercial trucking loophole blamed for illegal immigrants causing fatal crashes
2026-02-11	africa-news	698d63c16e6392ce6c8cba5a	DR Congo denies selling off mineral wealth under US deal
2026-02-12	saudi-gaz	698ec850c1fa2e60d4ea16e8	Dr. Khalid Al Yousef: A judicial reform figure steps into the role of Saudi public prosecutor
2026-02-11	africa-intel	698c2094a317c9d02ef1d514	DRC : The fiscal tug-of-war between Glencore and Kinshasa
2026-02-12	africa-news	698ec7fcc1fa2e60d4ea1634	DRC: Acting head of UN mission touches down in Goma
2026-02-12	fox-us	698ec6fdc1fa2e60d4ea1425	Driver federally indicted in 100-mph smuggling crash that killed Texas grandma, 7-year-old girl
2026-02-12	gbnews	698d62bf6e6392ce6c8cb89f	Driver killed after car plunges 500ft onto rocks from clifftop California highway
2026-02-11	straits-times	698c2082a317c9d02ef1d4e0	Drone attack sparks fire at a plant in Russia's Volgograd region, governor says
2026-02-11	ukrinform	698c204ba317c9d02ef1d45d	Drone attack on Bohodukhiv: Bodies of three children and one man recovered from under rubble; pregnant woman among injured 
2026-02-11	thehindu	698d632f6e6392ce6c8cb97b	Drug-free Karnataka is our aim: Home Minister Parameshwara
2026-02-11	gbnews	698d62bf6e6392ce6c8cb8a0	Drunk BA passenger is jailed after kissing flight attendant and screaming 'I'll kill you' at crew in mid-air rampage
2026-02-12	indiaexpress	698d62376e6392ce6c8cb6e8	‘Dubious’ transactions at Sabarimala: High Court informed of lakhs sent via money orders by temple staff
2026-02-13	thehindu	698ec77ac1fa2e60d4ea1521	Durgam cheruvu: A glittering view, a gasping lake
2026-02-12	japantoday	698ec858c1fa2e60d4ea1704	Dutch speedskaters win 2 short track Olympics golds
2026-02-12	et-canada	698ec7fac1fa2e60d4ea1627	Early Exposure to Peanuts, Fish, and Eggs Reduces Allergy Risk in Babies: Study
2026-02-12	et-uspol	698ec831c1fa2e60d4ea16a4	Early Voting Begins in North Carolina
2026-02-13	indiaexpress	698ec6c3c1fa2e60d4ea1338	EC to set up polling booths in 78 high-rises, most in Kolkata
2026-02-11	gbnews	698d62bf6e6392ce6c8cb8a8	Ed Miliband's Net Zero drive will trigger financial crash, former chief scientific adviser warns
2026-02-12	indiaexpress	698d62336e6392ce6c8cb6bf	ED summons Punjab ex-CM, Raninder: Foreign assets case back to haunt Amarinder, son
2026-02-12	scrollin	698ec827c1fa2e60d4ea1677	ED summons ex-Punjab CM Amarinder Singh, son in foreign exchange case
2026-02-12	mainichi	698d63426e6392ce6c8cb9cc	Editorial: Hastily formed opposition left in shambles after major defeat in Japan election
2026-02-11	mainichi	698d63416e6392ce6c8cb9c9	Edo-Tokyo Museum to reopen on March 31 after major renovation
2026-02-11	thehindu	698d632e6e6392ce6c8cb965	Education Ministry pushes for AI-led teaching and learning at all levels by next academic year
2026-02-13	indiaexpress	698ec6c9c1fa2e60d4ea1368	Education Minister Dharmendra Pradhan is guest at Adda today
2026-02-11	dn-egypt	698d63616e6392ce6c8cb9e3	Egypt explores healthcare cooperation with Türkiye at global health event in Dubai
2026-02-11	dn-egypt	698d63616e6392ce6c8cb9e7	Egypt to transfer 40 state companies to sovereign fund and list 20 on stock exchange
2026-02-11	egyptian-independant	698d62106e6392ce6c8cb62d	Egypt faces water scarcity challenges, relies on Nile for 98 percent of water resources – Min.
2026-02-12	egyptian-streets	698ec75ac1fa2e60d4ea149e	Egypt Made a Surprise Cameo in Bad Bunny’s Super Bowl Show
2026-02-11	dn-egypt	698d635f6e6392ce6c8cb9e2	Egypt, Kuwait discuss strengthening tourism cooperation
2026-02-11	africa-news	698d63c06e6392ce6c8cba56	Egypt's Sisi names new defence minister in limited reshuffle
2026-02-12	africa-news	698ec7ffc1fa2e60d4ea1641	Egyptian troops take part in training ahead of AU deployment in Somalia
2026-02-11	dn-egypt	698d63616e6392ce6c8cb9e6	Egypt’s SCZONE signs $13m deals for food, fertiliser projects in Sokhna
2026-02-11	tass	698d62b06e6392ce6c8cb84c	Eight OPEC+ countries fall 69,000 bpd short of its January oil production plan
2026-02-11	fox-latest	698c207da317c9d02ef1d4cc	Eileen Gu garners backlash for commenting on Trump's statement while representing China
2026-02-11	straits-times	698d625b6e6392ce6c8cb7da	El Paso flights resume after US anti-drone system prompts sudden shutdown
2026-02-12	tass	698ec76ec1fa2e60d4ea14e9	EL5-Energo power generation rises by 2.7% to 24.38 bln kWh in 2025
2026-02-12	cnbc-top	698ec876c1fa2e60d4ea1757	Electricity prices rising by double the rate of inflation. Data center demand means no relief ahead, analysts say
2026-02-13	thehindu	698ec776c1fa2e60d4ea1508	Elephant tusks worth ₹2 crore stolen from Pangode Military Station in Kerala
2026-02-12	fox-us	698ec6fcc1fa2e60d4ea1418	Elite FBI video unit that worked Kohberger case spotted at Nancy Guthrie's home
2026-02-11	indiaexpress	698d623b6e6392ce6c8cb711	Elon Musk wants to build an AI satellite factory on the Moon
2026-02-11	bbc-top	698d62be6e6392ce6c8cb88d	Emergency call released of boy who swam for hours to save family
2026-02-11	breitbart	698d62496e6392ce6c8cb78f	Enes Kanter Freedom Trashes 'Traitor' Eileen Gu: 'Global PR Asset' for China
2026-02-11	indiaexpress	698d623b6e6392ce6c8cb708	Enforcement Directorate summons Amarinder Singh, son in FEMA case
2026-02-11	syrian-obs	698d619d6e6392ce6c8cb5ab	Engineering Fear: The Subjugation of Women Under “Transitional” Rule
2026-02-11	bbc-top	698d62be6e6392ce6c8cb899	England too 'careful' in defeat by Windies - Brook
