article_id	title
6987205961160417af3ea233	India gains concession from US ‘national-security’ tariffs on auto, aircraft parts and pharma; agrees to buy soybean oil, industrial and agri goods
6987209b61160417af3ea345	At the scene of deadly Pakistan mosque explosion 
6987205961160417af3ea234	ZP, Panchayat Samiti elections | ‘Fitting Ajit homage’: Rohit Pawar tells voters to support Ajit’s ideology
698727001df52fc0ebd68008	Crew-12 mission that includes Russian cosmonaut arrives at space center in Florida — NASA
6987216261160417af3ea471	India-U.S. framework strengthens ‘Make in India’ by opening new opportunities for farmers, says PM Modi
698720d861160417af3ea383	Digital native teens given chance to spot fake news in Japan election
6987209661160417af3ea329	Trump removes 25% punitive tariff imposed on Indian goods for Russian oil purchases
6987213f61160417af3ea3cb	 She’s upending Japanese politics with two words: ‘I’m pregnant’ 
6987205a61160417af3ea235	Pakistan vs Netherlands highlights, T20 World Cup 2026: PAK win by 3 wickets after Faheem Ashraf’s 19th over fireworks
6987205a61160417af3ea236	To improve last-mile connectivity, Delhi govt joins hands with Bharat Taxi
698720d661160417af3ea37f	China OKs several Japan-bound rare earth exports under tightened controls
6987215461160417af3ea41b	 Trump says he didn't see full racist video, says he won't apologize
6987216261160417af3ea472	Textile policy focuses on weaving, processing and technical textiles
69871fe261160417af3ea0e3	Nudist resort residents furious after property owner demands they put clothes on,  cuts off power
6987205a61160417af3ea237	‘Great news for India and USA’: PM Modi hails landmark trade pact with Trump, predicts job surge for women and youth
69871fe361160417af3ea0e4	Judge orders Trump administration to restore federal funds for rail tunnel between NY and NJ
698727001df52fc0ebd68009	US tells Kiev it will reduce its role in peace talks due to upcoming elections — Reuters
6987207161160417af3ea2ae	Canada and France opening new consulates in Greenland's capital amid Trump pressure
6987206d61160417af3ea2a0	Cuba adopts measures to confront energy crisis
6987207161160417af3ea2af	Former MLB player Yasiel Puig found guilty of obstruction, lying to federal investigators
6987205a61160417af3ea238	CBI arrests two MES officers from Pune for taking bribe
6987205a61160417af3ea239	Uttar Pradesh Police families get skill boost with 18 Vaama Sarthi centres
6987205a61160417af3ea23a	India vs USA T20 World Cup 2026 Match Playing 11: Tilak Varma returns to No.3 spot, Ishan Kishan to open
698720d761160417af3ea380	Trump's racist post about Obamas is deleted after backlash despite White House earlier defending it
698720d861160417af3ea381	The Mainichi News Quiz: They're doing what for 'Ninja Day' at that city hall?
6987209661160417af3ea32a	‘The Only City’: This evocative anthology is a window into the polymorphous megapolis of Bombay
69871ff261160417af3ea108	US Justice Department casts wide net on Netflix’s business practices in merger probe, WSJ reports
6987205a61160417af3ea23b	Three students booked for attacking classmate ‘using blade’ at Ahmedabad school where another was murdered last year
69871fe361160417af3ea0e5	Shocking footage shows horrifying moment knife-wielding ‘psychopath’ neighbor stabs girl, 10, and grandfather
6987210761160417af3ea3a5	Hisatsune leads Matsuyama at Phoenix Open as Scheffler makes cut
6987203661160417af3ea123	China Overturns Death Sentence Against Canadian Citizen Schellenberg: Reports
6987205a61160417af3ea23c	2018 Case: Life term in jail for student who stabbed another to death in Gujarat school toilet
6987205a61160417af3ea23d	No buzz, no hype around India this T20 World Cup. And this isn’t a complaint.
6987216561160417af3ea49f	Louisiana AG to Sue California and NY Over Refusal to Extradite Abortion Providers
698727001df52fc0ebd6800a	US Republicans see possibility of losing control over both Congress chambers — Axios
6987209b61160417af3ea338	Colorado funeral home director sentenced to 40 years for corpse abuse
6987203861160417af3ea133	Lib Dem peer suspended again over harassment allegations
6987204961160417af3ea19c	'I did not see it!' Donald Trump refuses to apologise for controversial Obama family social media video
6987205a61160417af3ea23e	‘He was to reach home in 10 mins, we searched many areas’: Brother of man who fell to death in Delhi Jal Board pit
6987203661160417af3ea124	Bail Denied for Toronto Police Officer Alleged to Be ‘Genesis’ of Arrested Group
6987207361160417af3ea2c9	Boy charged with GBH after teacher injured at school
6987205a61160417af3ea23f	Border 2 Box Office Collection Worldwide Day 15 Update: Sunny Deol starrer records its lowest earning day, mints Rs 2.85 cr
6987205a61160417af3ea240	‘Murder… not accident’: Rahul Gandhi, Kejriwal attack Delhi Govt after biker falls into pit dug by DJB, dies
6987205a61160417af3ea241	Man ‘assaulted, forced to remove tilak’ outside Barabanki shrine; one arrested
6987203661160417af3ea125	Tory MP Questions New Police Cooperation Agreement With China Despite Beijing’s Hostile Actions
6987207361160417af3ea2ca	Minister used PR firm to investigate journalists' sources
6987204361160417af3ea159	Jasmine Crockett: Republicans Will Vote for Me in General Election
698720d861160417af3ea382	News in Easy English: Sapporo Snow Festival opens with giant snow sculptures
6987207d61160417af3ea2fa	Group of children aged 3 months to 17 years returned from temporarily occupied territory of Kherson region
6987205a61160417af3ea242	Jackal not killed at Delhi zoo: probe; but records animal found motionless in burrow
6987213f61160417af3ea3cc	 Decisive win for Takaichi may be best scenario for bonds and yen 
6987207161160417af3ea2b0	SBA freezes over 100,000 California borrowers in sweeping $9B pandemic fraud crackdown
6987205a61160417af3ea243	A Kuki-Zo MLA speaks on why he joined Manipur govt: ‘Solution has to be at table, not by guns’
6987205a61160417af3ea244	Bengal budget: Govt aims for record Rs 4,500 cr revenue amid transport dept’s green & digital push
6987205a61160417af3ea245	Few complainants, but ‘conversion net’ probe deals Mirzapur gyms a body blow
6987205b61160417af3ea246	What is Bihar’s Gender Budget, and why did Nitish government spend Rs 2.5 lakh crore in 5 years?
6987205b61160417af3ea247	2020 riots larger conspiracy case: HC notice to Delhi Police on bail pleas of two accused
69871fe461160417af3ea0e6	Inside the small town being torn apart by Newsom’s high speed rail dream: ‘Nowhere for us to go’
69871ff361160417af3ea109	Trump administration won't let student deported to Honduras return
6987214061160417af3ea3cd	 Toyota changes CEO despite its strength through industry turmoil 
69871fe561160417af3ea0e7	Trump says feds have some ‘very strong’ clues in investigation into Nancy Guthrie’s abduction
69871ff361160417af3ea10a	US and India unveil interim trade framework, move closer to broad pact
6987205b61160417af3ea248	Delhi man falls to death in pit: Jal Board suspends three officials, govt orders probe
6987214061160417af3ea3ce	 Takaichi overwhelming rivals in social media battle to go viral 
6987216261160417af3ea47d	Independent MP Pappu Yadav arrested in Patna in a 31-year old case
6987209f61160417af3ea349	JUST IN: Major Nashville Broadway bars to air TPUSA's All-American Halftime show instead of Bad Bunny performance
6987205b61160417af3ea249	2.09 crore voters to decide fate of 12 ZPs, 125 panchayat samitis today
6987203661160417af3ea126	Government Tables Bill Giving Build Canada Homes Land Acquisition Power
6987214161160417af3ea3cf	 Momentum for political reform stalling in Japan 
698727011df52fc0ebd6800b	Brussels supports resumption of dialogue with Russia — Politico
6987204061160417af3ea140	Trump condemns racist video showing Obamas as apes after removing it, but says he won't apologize
6987216261160417af3ea474	India successfully tests fires nuclear capable Agni-3 missile off Odisha coast
6987216561160417af3ea4a0	Trump Signs Executive Order Expanding DHS Access to Criminal Records
6987216261160417af3ea473	Navjot Kaur Sidhu expelled from Congress, days after she ‘quit’ party
6987215261160417af3ea3fb	 Pentagon says it's cutting ties with 'woke' Harvard, discontinuing military training, fellowships
6987205b61160417af3ea24a	BJP MLA Agnimitra Paul’s remark on minorities sparks row in Assembly
6987205b61160417af3ea24b	‘I’m going to the airport, Jai Mata Di’: Jharkhand man goes missing in Saudi Arabia after texting family
6987209b61160417af3ea33a	Can the US help Iran? What Iranians say - inside and outside the country
6987205b61160417af3ea24c	70 Brahmins booked in Darbhanga, Bihar minister warns against ‘misuse’ of SC/ST Act: ‘Will affect social camaraderie’
6987207361160417af3ea2c1	 Justice Department will allow lawmakers to see unredacted versions of Epstein files
698720d861160417af3ea384	Key numbers to watch in Japan's lower house election
6987209661160417af3ea32b	‘History is about people, egos, personality clashes, little jealousies’: Biographer Narayani Basu
6987214161160417af3ea3d0	 Trump orders prioritizing countries with higher defense spending as customers for U.S. weapons 
69871fe561160417af3ea0e8	3 men rescued by NYPD after falling through ice in waters off NYC, dramatic video shows
6987207161160417af3ea2b1	Skier Lindsey Vonn says ACL is '100% gone' after crash, remains determined for Olympic downhill
6987206761160417af3ea283	Nigerian court orders Britain to pay £420m in reparations over colonial-era deaths
698727011df52fc0ebd6800c	US negotiations with Russia and Ukraine proceed well — Trump
6987214161160417af3ea3d1	 U.S. plans initial payment toward billions owed to U.N. 
69871ff361160417af3ea10b	Mexican authorities find remains matching one of 10 kidnapped miners
698727011df52fc0ebd6800d	Kiev urgently needs spare parts for servicing US military equipment — Pentagon
6987214261160417af3ea3d2	 Taiwan to seek extension of arms deals with U.S. amid budget standoff 
6987205b61160417af3ea24d	Anthropic has sent a message to Bengaluru
6987204561160417af3ea16e	Report: Gregory Bovino 'Asked to Leave' Las Vegas Bar
69871ff461160417af3ea10c	US plans initial payment towards billions owed to UN, says envoy Waltz
6987208c61160417af3ea319	Uttar Pradesh: Noida to get circular skywalk, to ease traffic congestion, Rs 26.34 crore allocated, check details,
6987209b61160417af3ea341	What we still don't know about the disappearance of Savannah Guthrie's mother
6987205b61160417af3ea24e	This Budget was blind to the farm and the farmer
6987205b61160417af3ea24f	Ram Madhav writes: Gandhi was driven by a desire to keep India united, Nehru wanted power, no matter the price
6987205b61160417af3ea250	40 years ago February 07, 1986: Butter oil imports banned
69871ff461160417af3ea10d	Trump refuses to apologise for racist clip of Obamas as monkeys
6987205b61160417af3ea251	Tirupati laddu row: ‘Bathroom cleaning chemicals’ used in ghee, Chandrababu Naidu now claims
6987205b61160417af3ea252	Jasprit Bumrah likely to miss India’s opening T20 World Cup game against USA, Ishan Kishan to open
6987205b61160417af3ea253	Note to cricket board: Women’s Premier League is ready
6987205b61160417af3ea254	RBI maintains status quo, conserves policy ammunition
6987205b61160417af3ea255	On agriculture, look for low-hanging fruit, move carefully
6987207361160417af3ea2c7	Trump says he 'didn't see' part of video with racist clip depicting Obamas as apes
69871fe561160417af3ea0e9	California’s soft laws embolden city’s prolific criminals according to LA District Attorney
698720d961160417af3ea385	2,000 Chinese fishing boats gather to form floating wall in E. China Sea
6987204361160417af3ea154	‘Jihad by Immigration’: Mamdani Slammed for Invoking Islamic ‘Hijrah’ to Defend NYC Sanctuary Policy
6987205b61160417af3ea256	Why SC sent back Flipkart’s alleged market dominance case to the NCLAT
6987205b61160417af3ea257	Before you read the book, you admire his art. Meet Ahlawat Gunjan — the designer behind India’s iconic Booker-winning covers
6987205b61160417af3ea258	50 years of Abolition Act: How 3 lives forced into backbreaking work broke shackles of bonded labour
698720d961160417af3ea386	Milan Cortina Olympics officially open with a multi-site ceremony for a spread-out Winter Games
6987214261160417af3ea3d3	 U.S. and India unveil interim trade framework, move closer to broad pact 
6987207e61160417af3ea2fb	Ankara sending clear message to Moscow: its airspace not “grey zone” – expert
6987205c61160417af3ea259	‘I didn’t make a mistake’: Trump refuses to apologise for deleted post depicting Obamas as primates
6987216561160417af3ea4a1	Trump Orders Creation of America First Arms Transfer Strategy
6987214361160417af3ea3d4	 China flexes its muscle at Singapore Airshow as U.S. isolated 
6987205d61160417af3ea25a	Maharashtra Zilla Parishad Election 2026 Live Updates: Voting underway, Dy CM Sunetra Pawar among early voters
6987205d61160417af3ea25b	Ashakal Aayiram movie review: Jayaram, Kalidas Jayaram-starrer is undone by melodrama
6987214361160417af3ea3d5	 Islamic State group claims suicide blast at Islamabad mosque 
6987215261160417af3ea3fc	 Judge orders Trump administration to bring back 3 families deported to Honduras, other countries
6987205d61160417af3ea25c	Easing of tariffs is good news, but engagement with US now comes with statutory warning
6987205d61160417af3ea25d	India–US interim trade deal framework: 10 key takeaways. Read the full statement
6987207161160417af3ea2b2	Super Bowl Sunday menus are changing; party hosts serve up surprises this year
6987205d61160417af3ea25e	In a fragmented world order, AI and energy will hold the key to rewriting rules
6987200161160417af3ea121	Gingin Councillor who allegedly received threatening voicemails to resign
6987204461160417af3ea167	Breitbart Business Digest: The Corrupt Bargain Edition
698727011df52fc0ebd6800e	Armenian president approves date of next parliamentary elections
69871fe661160417af3ea0ea	Stepbrother, 16, suspected in Anna Kepner’s Carnival cruise death appears in federal court
6987214461160417af3ea3d6	 Dow surges above 50,000 for first time as U.S. stocks regain mojo 
6987205d61160417af3ea25f	Parliament is being hollowed out
6987204361160417af3ea150	VIDEO: JD Vance Booed by Spectators During Olympic Games’ Opening Ceremony
6987212561160417af3ea3c1	How Is Security Different at These Olympic Games?
69871ff461160417af3ea10e	Trump says good talks ongoing on Ukraine
6987214461160417af3ea3d7	 U.S. accuses China of secret nuclear testing 
6987207361160417af3ea2c0	 Trump administration approves weed killer dicamba for two common genetically modified crops
6987207161160417af3ea2b3	Joy Reid says GOP using Nicki Minaj as a 'house pet' to put 'blackface' on MAGA
6987205d61160417af3ea260	Don’t drop everything just to do AI: Tech Matters’ CEO Jim Fruchterman warns nonprofits
698727011df52fc0ebd6800f	Fashion show in Milan: what athletes were wearing during Olympic opening ceremony
6987204461160417af3ea15d	Rep. Mark Amodei 30th House Republican Not to Seek Reelection Ahead of Midterms
6987204561160417af3ea16a	MAGA Erupts as Mike Pence’s Think Tank Delays Justice for East Palestine
6987210a61160417af3ea3a9	Leeds beats Forest and take giant step towards securing Premier League status
6987205d61160417af3ea261	Iran says ‘good start’ made in talks with US over nuclear programme
6987210961160417af3ea3a8	Government must reach agreement on right to counsel for people at Minnesota ICE facility, judge says
6987214561160417af3ea3d8	 U.S. aims for March peace deal in Ukraine followed by quick elections 
6987214561160417af3ea3d9	 Russian intel official under Western sanctions is shot and wounded in Moscow 
69871fe761160417af3ea0eb	Alleged hospice scammer showed off $4M luxury home before felony charge
6987204161160417af3ea149	US Unveils Interim Trade Framework With India, Drops Punitive Tariff
6987209b61160417af3ea342	The retired Indian factory worker who built a library of two million books
6987214561160417af3ea3da	 White House defends, then deletes, racist Trump post depicting Obamas as apes 
69871fe861160417af3ea0ec	33 tons of hazardous filth cleared from California homeless encampment
6987204761160417af3ea182	 A charismatic straight talker, Japan's Takaichi is poised to expand her power in Sunday's vote
6987204461160417af3ea15b	Suicide Bombing at Pakistan Mosque Kills 31, Injures 169
6987204761160417af3ea184	 Man tied to the killing of Colombian soccer player Andrés Escobar shot dead in Mexico
6987204761160417af3ea183	 Japan's first female prime minister counts on popularity to help party win election
6987209b61160417af3ea33b	More than 30 killed in blast at Pakistan mosque, officials say
69871fe861160417af3ea0ed	Crypto startup inspired by ‘Lord of the Rings’  becomes first bank approved in Trump’s 2nd term
6987204361160417af3ea14f	Team USA Olympic Skiers 'Heartbroken,' Say They Don't Represent ICE Operations by Wearing American Flag
6987205d61160417af3ea262	‘Where does it go that he eats so much?’: Yuzvendra Chahal spills the beans on his unconventional breakfast
6987214661160417af3ea3db	 Iran says talks with U.S. in Oman were 'good start,' will continue 
6987206761160417af3ea284	British tourist, 37, found dead at popular Spanish holiday hotspot as police launch probe
6987204361160417af3ea153	Exclusive–Karoline Leavitt: TrumpRx Will Save Millions of Americans Thousands of Dollars
69871ff561160417af3ea10f	France and Canada deepen Arctic ties with Greenland consulates
6987207e61160417af3ea2fc	Ukraine’s international reserves reach record high of $57.7 bln
6987205d61160417af3ea263	2020-24: Defence Ministry cleared 35 books, General Naravane’s only one pending
6987205d61160417af3ea264	Maharashtra drops physical verification for Ladki Bahin scheme, extends e KYC deadline to March 31
69871fe861160417af3ea0ee	St. Johns, Firefighters Foundation rally for Lt.’s daughter suffering from ‘rare and aggressive’ brain cancer
69871fe961160417af3ea0ef	Ex-San Francisco mayor appointed Bloomberg pal to key seat in hopes of landing a job: sources
6987207361160417af3ea2c6	Their parents are in disgrace - what now for Beatrice and Eugenie?
6987207361160417af3ea2c8	Where does air pollution go inside our bodies?
6987216561160417af3ea4a2	Rep. Amodei Latest House Republican Not Seeking Reelection
6987207361160417af3ea2d0	Martin Lewis has warned against overpaying student loans - but these graduates are
69871ff561160417af3ea110	France to rally aid for Lebanon as it warns truce gains remain fragile
6987207161160417af3ea2b4	Brantley Gilbert shares why he's performing at Turning Point USA's alternate halftime show
6987207361160417af3ea2cf	'It immerses you in fantasy': Why Bridgerton tourism is booming
6987205d61160417af3ea265	Vidarbha holds 75% of Maharashtra’s minerals and best iron ore; aim is to produce steel cheaper than China: Union Minister Nitin Gadkari
6987206761160417af3ea285	Chester Zoo revives 'extinct' species after handful of specimens discovered in alleyway
6987209b61160417af3ea340	From Hollywood to the homeland: Why African countries are courting black American stars
6987205d61160417af3ea266	Delhi Confidential: Cricket Pitch
6987207361160417af3ea2d1	He has the world's biggest stage. What will Bad Bunny do with it?
6987205d61160417af3ea267	Digital fraud cases: RBI plans compensation up to Rs 25,000 even if victim shares OTP
698720ff61160417af3ea391	Cramer's week ahead: A key jobs report. Plus, earnings from Robinhood, McDonald's and more
698720db61160417af3ea387	In Photos: 7-Eleven rolls out new sweets to up ante in convenience store showdown 
698727021df52fc0ebd68010	Trump signs executive order to impose tariffs on countries trading with Iran
6987207161160417af3ea2b5	'The Crown' star Claire Foy says she battled ‘disgusting’ stomach parasites for five years
6987214761160417af3ea3dc	 'We rise by lifting others’: Milano Cortina Olympics’ opening ceremony touts unity 
6987204261160417af3ea14c	Saudi Arabia opens guest of honor pavilion at Damascus International Book Fair 2026
6987208261160417af3ea306	Trump may have already found his next ‘project in life,’ Mike Huckabee says
6987206761160417af3ea286	Afghan migrant who carried out vicious random attack on woman dies in prison
6987205d61160417af3ea268	Urban consumer confidence declines, reflects growing caution on economic conditions: RBI survey
6987215261160417af3ea3fe	 Mississippians near two weeks without power after winter storm
6987207161160417af3ea2b6	Conservative firebrand vows to purge ‘RINOs’ in battle to replace retiring Vern Buchanan in open Florida seat
6987215261160417af3ea3fd	 Ex-MLB player Yasiel Puig found guilty of obstruction and lying to federal officials
69871ff661160417af3ea111	Trump orders prioritising countries with higher defence spending as customers for US weapons
6987204261160417af3ea14d	Saudi culture minister meets Syrian president in Damascus
6987205d61160417af3ea269	Monetary Policy Meet: Repo rate steady at 5.25%; FY26 GDP, inflation projections raised
6987207161160417af3ea2b7	FCC launching probe into ABC's 'The View' amid crackdown on equal time for candidates
6987207f61160417af3ea2fd	Court in Vinnytsia region sentences two railway saboteurs to 15 years in prison
6987207161160417af3ea2b8	When anti-ICE clashes trigger federal intervention: Experts explain the constitutional breaking point
6987216261160417af3ea478	Gujarat’s Chhari-Dhandh on global Ramsar Map
6987204261160417af3ea14e	Saudi, Slovenian foreign ministers sign cooperation agreement in Ljubljana
6987204361160417af3ea151	Associated Press Complains That Winter Olympics Teams Are 'Overwhelmingly White'
6987204461160417af3ea168	Common Sense Makes a Comeback: Utah Joins Growing List of States Offering PragerU Educational Resources, Includes High School Credit
698727021df52fc0ebd68011	US to take measures against India if it starts buying Russian oil again — Trump
6987204361160417af3ea152	British-American Skier Apparently Urinates 'F*ck ICE' Into the Snow at Winter Olympics
6987205e61160417af3ea26a	Om Birla: Over 19 hours wasted due to disruptions in Budget Session
698720c761160417af3ea35b	Trump removes racist video of Obamas after backlash
6987207261160417af3ea2b9	Lions stars explain what went wrong in disappointing season after big Super Bowl expectations
6987206761160417af3ea28c	North Carolina man charged with three counts of statutory rape held on ICE detainer
6987207361160417af3ea2d2	They were drawn to Korea with dreams of K-pop stardom - but then let down
6987209b61160417af3ea337	Will Sunday's snap election gamble pay off for Japan's first female premier?
6987215461160417af3ea41a	 Authorities 'aware of new message regarding Nancy Guthrie': Sheriff
698727021df52fc0ebd68012	US to lift 25% tariff on India for purchasing Russian oil
6987207261160417af3ea2ba	Mamdani quotes the Quran, Bible to support sanctuary city status
6987216261160417af3ea479	Focus laid on integrating traditional architecture with modern practices at India Stonemart
6987214761160417af3ea3dd	 ‘In Japan, people pack everything they love on their nails’ 
6987204061160417af3ea141	US State Department Announces New Sanctions on Iran Oil Network
6987215161160417af3ea3f2	Trump Orders 25 Percent Tariffs on Nations Trading With Iran
698720fd61160417af3ea38d	Tech AI spending may approach $700 billion this year, but the blow to cash raises red flags
698727021df52fc0ebd68013	Olympic flame of 2026 Winter Games lit in Italy
6987205e61160417af3ea26b	Right to be forgotten: Supreme court to examine if it applies to online news
6987209b61160417af3ea344	Watch: Trump has called to nationalise US elections. Is it a big deal?
6987216261160417af3ea47a	Congress decision to go solo wont impact Left Front’s prospect in WB Assembly polls: Md Salim
6987206761160417af3ea287	Grave belonging to lost Viking king may have been found on English coast
6987207261160417af3ea2bb	San Francisco schools on verge of closing over possible teachers strike
6987207261160417af3ea2bc	Rams' Puka Nacua reacts to Matthew Stafford's MVP, 2026 return: 'I almost did a backflip'
6987208361160417af3ea307	Gaza’s ‘gargantuan’ rebuild now begins after last hostage is finally returned to Israel, Huckabee says
698727021df52fc0ebd68014	Man killed in drone attack on Kursk Region
6987204361160417af3ea157	Georgia House Passes Baby Box Bill, Sends to State Senate
6987216561160417af3ea4a3	What’s Next in Springfield, Ohio, After Judge Pauses End of Immigration Protection for Haitians
69871ff661160417af3ea112	Rights groups issue Florida travel alert ahead of World Cup, citing detention risks
6987209b61160417af3ea336	Milan-Cortina Games begin with vibrant opening ceremony
6987204461160417af3ea15f	Marlow: Sorry Keith Olbermann, Melania Trump Absolutely Is a Movie Star
6987204461160417af3ea165	Exclusive: Trump Admin Accelerates L.A. Fire Recovery, Slashing Red Tape
6987204461160417af3ea169	Exclusive -- SBA Secretary Loeffler: Gavin Newsom Spending More Time Posing for Vogue Than with L.A. Fire Victims
6987204461160417af3ea166	Exclusive -- SBA Secretary Loeffler: California State and Local Officials Causing 'Second Disaster' Post Fires
6987205f61160417af3ea26c	‘Can’t compel’: Supreme Court allows teen to terminate 30-week pregnancy
6987203661160417af3ea127	Foreign Affairs Minister Opens New Consulate in Greenland
6987207f61160417af3ea2fe	Russian attacks damage 316 buildings in Zaporizhzhia this year
6987216261160417af3ea47b	Products by Haryana jail inmates attracting crowd at Surajkund Crafts Festival in Faridabad
6987207561160417af3ea2e3	Leeds beat Forest to move clear of relegation zone
6987204961160417af3ea19d	Education leaders issue major plea to Keir Starmer over 'authoritarian' social media ban for under-16s
