article_id	title
6988fef2b00027da494aa322	Iranian Official Says Country Has Right to Pursue Nuclear Program Amid US Warnings
6988ffd9b00027da494aa564	Aaron Rodgers' chances of returning to Steelers 'increasing' amid Mike McCarthy hire: report
6988ff5fb00027da494aa3ca	PM's chief aide McSweeney quits over Mandelson row
6988ff60b00027da494aa3dc	'Killjoy' - did VAR get late drama in Liverpool v Man City right?
6988ff60b00027da494aa3d7	GB snowboard star Brookes into big air final
6988ffd9b00027da494aa565	Brett Favre says he won't watch Bad Bunny Super Bowl halftime show, will watch All-American show instead
6988fe96b00027da494aa279	Saudi Arabia Pledges Billions for Syria’s Rebuild as U.S. Firms Explore Oil Sector Entry
6988fe96b00027da494aa27a	Syrian Petroleum Company Holds Talks with Two U.S. Firms on Oil Field Investment in Al-Jazira Region
6988fe97b00027da494aa27b	A Festival of Pages and Paradox: Damascus Book Fair Returns Amid Economic Strain and Shifting Tides
6988fe97b00027da494aa27c	Syrian Journalists Association Rejects Government’s Proposed Media Code as Executive Overreach
69890005b00027da494aa662	Haiku in English: Feb. 9, 2026
6988ff80b00027da494aa418	France to provide Ukraine with additional SAMP/T radar during repairs – Defense Minister
6988fec5b00027da494aa2d4	Israeli fighter jets escort commercial flight after ‘terrorist’ scare onboard: reports
6988ff09b00027da494aa343	'He's left us with no choice!' Wes Streeting scolded over puberty blocker trial as parents of trans children launch legal action
6988ff09b00027da494aa344	Why will Donald Trump not be at the Super Bowl?
6988ff35b00027da494aa3ac	Halva bar recalled due to toxins
6988ffe4b00027da494aa606	 GOP Rep. Lawler says image posted by Trump mocking Obamas was 'racist'
6988ff81b00027da494aa419	War update: 283 engagements on front line; Armed Forces of Ukraine eliminate nearly 150 occupiers in Pokrovsk sector
6988ffe7b00027da494aa615	Portugal elects Socialist as president by landslide, exit polls show
6988fea7b00027da494aa293	Japan's PM Takaichi on course for landslide victory in snap election
6988ffd9b00027da494aa566	Man drives 5,600 miles, spends over $12K chasing lifelong dream of extreme journey
6988ff35b00027da494aa3ad	Ofakim residents: 'A new intifada broke out here'
6988fffab00027da494aa652	Dem party bigs unanimously back NY sanctuary state bill, rail against ICE
6988ff5fb00027da494aa3cb	Why McSweeney's departure could prove perilous for the PM
6988fea8b00027da494aa2aa	Aerial footage shows flooded cities as storms hit Spain
6988fe9cb00027da494aa285	Bessent claims China ‘lived up to’ trade deal with Trump, predicts ‘very strong economic growth’ in 2026
6988fe9db00027da494aa286	Jeffries refuses to budge on Dems’ 10 demands that could shut down DHS: ‘Not at this point’
6988ffd9b00027da494aa567	Jordon Hudson goes scorched earth after Bill Belichick Hall of Fame snub
6988ff81b00027da494aa41a	Zelensky thanks railway workers and rescuers who ensure Ukraine's ability to endure Russian attacks 
69890052b00027da494aa68b	Former Socialist Party leader winning runoff presidential election in Portugal
6989000eb00027da494aa676	 US Olympians speaking up about politics at home face online backlash — including from Trump
6988fedab00027da494aa302	 Storm Marta kills at least 4 in Morocco as the country battles floods
69890053b00027da494aa68c	Russia-Turkey relation reach strategic partnership level — Russian diplomat
6988ff09b00027da494aa345	Keir Starmer to make emergency address to Labour MPs tomorrow as he battles to save his job
6988fffbb00027da494aa653	Coworkers get surprise of their lives on lotto ticket they thought won $350: ‘Everything changed’
6988ffbcb00027da494aa48c	Brave RNLI crew battle terrifying storm to save stranded dog
6988ffbab00027da494aa460	President Trump Excoriates 'Real Loser' U.S. Olympian Hunter Hess for Criticizing USA
6988fffbb00027da494aa654	1-year-old boy killed by BMW driver in front of parents in NYC parking lot: cops
6988ffdeb00027da494aa590	Nearly 3,000 found ineligible to be included on voters’ list in Ernakulam
6988fffcb00027da494aa655	DSA now has 100K members as milestone could spell trouble for Dems
6988ffe7b00027da494aa616	Socialist defeats far-right candidate in Portugal's presidential runoff, exit polls show
6988ffdeb00027da494aa591	Suraj Lama cremated in Kochi
6988fffdb00027da494aa656	NYC man, 81, found dead on building roof during near-record-low cold snap
6988fffeb00027da494aa657	Super Bowl becomes who’s who of tech elite as private jets jam up airports: ‘Billionaires picked last in gym class paying $50,000’
6988ffd9b00027da494aa568	Treasury secretary predicts blockbuster 2026 for US economy as Dow hits historic milestone
6988fedab00027da494aa303	 A truck carrying passengers crashes in northern Nigeria, killing at least 30 people
6988ffe7b00027da494aa617	Venezuelan opposition politician Guanipa freed as prisoner releases continue
6988fffeb00027da494aa658	Maniac shoves 58-year-old straphanger onto NYC subway tracks during random attack: cops
6988ff60b00027da494aa3de	Man City produce late comeback to beat Liverpool in chaotic finale
6988ff82b00027da494aa41b	Zelensky announces active work with partners in coming weeks 
69890053b00027da494aa68d	Thai PM’s party winning majority of seats in parliament
6988fea8b00027da494aa297	Iranian Nobel laureate handed further prison sentence, lawyer says
6988ffffb00027da494aa659	Zuckerberg, Musk pictured at Epstein’s ‘wild’ dinner with  other billionaire CEOs after conviction
69890000b00027da494aa65a	Multiple slayings rock San Jose on eve of Super Bowl — marking first killings of 2026
6988ffd9b00027da494aa569	The world’s top nuclear powers have no arsenal limits, here are the countries with nukes
6988fec5b00027da494aa2d5	US pilots jailed in Guinea during fuel stop now asking Trump to step in: ‘Very scary’
6988ffbab00027da494aa463	Knives Out: Labour MPs Call on PM Starmer to Step Down After Top Aid Resigns over Epstein Scandal
6988ffe0b00027da494aa5b9	Each Minister handles his responsibility, says Piyush Goyal on trade deal, Russian oil
6988ff35b00027da494aa3ae	Arabs to hold general strike across Israel?
6988fef2b00027da494aa318	Keir Starmer’s chief of staff resigns after recommending Epstein-connected ambassador
6988ffd9b00027da494aa56a	NCAA is 'clearly' not doing their job in regards to regulating NIL, former NFL agent says
6988ff39b00027da494aa3c0	Charlie Sheen says Bad Bunny was a BAD CHOICE for Super Bowl halftime show—Bill Maher agrees
6988fea8b00027da494aa29d	Washington Post chief executive steps down after mass lay-offs
6988ffbab00027da494aa464	From Backing BLM and Kamala to Bashing ICE, Super Bowl 60 Star Bad Bunny's History of Left-Wing Activist: 'F**K TRUMP'
6988ff82b00027da494aa41c	DSNS to form consolidated teams to restore electricity and heating – Zelensky
6988ff60b00027da494aa3df	US Prosecutors Withdraw Felony Charge Against Top NHL Prospect Gavin McKenna
6988ff35b00027da494aa3af	2-Month-Old Baby Has Days Left Without $180,000 Treatment
6988ff3db00027da494aa3c1	BREAKING: Police activity at Nancy Guthrie's home, investigators search nearby manhole
6988fed8b00027da494aa2fc	‘All-American Halftime Show’ Serves as Alternative to Super Bowl’s Bad Bunny, Green Day Performance
6988ff6fb00027da494aa3f8	Memorial for Swiss bar blaze victims catches fire
69890001b00027da494aa65b	NYPD Police Academy to be renamed after fallen hero Detective Steven McDonald: ‘His name and legacy will live on forever’
6988ff0ab00027da494aa346	Vladimir Putin eyes tiny island to 'change the balance of power' in Europe
6988fed1b00027da494aa2e7	Epstein files: Republican lawmaker Massie calls for Trump Commerce chief Lutnick to resign
6988ffdeb00027da494aa593	Tirupattur police ask tribal people to surrender country-made firearms
6988ff0ab00027da494aa347	Keir Starmer is attempting to blame everyone else but himself, but I'm afraid the buck stops with him, says Nana Akua
6988ff35b00027da494aa3b0	MK Succot pops into Gush Etzion school
69890053b00027da494aa68e	Russia’s Repilov finishes 14th in Olympic luge men’s singles
69890001b00027da494aa65c	Why Savannah Guthrie shouldn’t pay mom Nancy’s ransom yet, according to FBI agent — even as time ticks down
6988fea8b00027da494aa294	Thai PM claims election victory with conservatives well ahead of rivals
6988ff82b00027da494aa41d	Russian drone attacks civilian car in Sumy region, two people injured 
6988fea8b00027da494aa29b	Christchurch shooter seeks to overturn guilty plea
6988ff35b00027da494aa3b1	Hundreds gather to remember man found after two years missing
6988fedab00027da494aa305	 Venezuelan opposition leader freed after 8 months in prison
6988ffdeb00027da494aa594	Gandhi Smaraka Nidhi objects to ‘wrong’ portrayal of Gandhiji in advertisement campaign in Karnataka
6988ffdeb00027da494aa592	People against hate: Uttarakhand residents resist rising communal tensions
6988ffdeb00027da494aa595	 A year on, demands of surrendered Maoists remain unfulfilled
6988ffd9b00027da494aa56b	Retired general argues military action against Iran is 'best option' as Trump faces 'historic opportunity'
6988ffdeb00027da494aa596	‘Despite challenges, T.N. met demands of govt. employees’
6988ffbdb00027da494aa49c	Venezuelan opposition leader Juan Pablo Guanipa freed after 8 months in prison
6988ffe1b00027da494aa5d2	India and Canada agree to shared workplan to guide bilateral cooperation on national security
69890002b00027da494aa65d	Cops seen searching septic tank behind Nancy Guthrie’s Arizona house in latest twist
6988ffe7b00027da494aa618	Norwegian diplomat steps down over Epstein ties, in widening scandal
6988ffdeb00027da494aa597	Fascists, their slaves should be defeated, says Udhayanidhi
69890053b00027da494aa68f	Russia not going to attack Europe, but ready to retaliate — Lavrov
6988ffdeb00027da494aa598	‘Out-of-State’ drug peddlers arrested in 2025 come down from 2024
6988ffdeb00027da494aa599	In a first, a visually challenged woman all set to become a judge in Kerala
6988ffbdb00027da494aa49d	Investigation continues a week after Savannah Guthrie mother was reported missing
69890003b00027da494aa65e	NBA contenders at crossroads following trade deadline
6988ffd9b00027da494aa56c	Spencer Pratt vows to work with federal government on ICE enforcement as LA mayor candidate
6988ff0ab00027da494aa348	Keir Starmer predicted to face a 'fatal 48 hours' after Morgan McSweeney resignation: 'The sharks are circling!'
6988ffd9b00027da494aa56d	Lindsey Vonn undergoes surgery for leg fracture after hard crash during Olympic run
6988fed8b00027da494aa2fd	Trump Endorses Nexstar–Tegna Broadcast Television Deal
6988ff83b00027da494aa41e	Injury toll in Russian morning attack on Kramatorsk rises to four, one person killed
6988ffbdb00027da494aa49e	Epstein sought to meet Putin, built ties with Russian officials, files show
6988ffbdb00027da494aa49f	‘Baaki batsman chanafali bech rahe the kya?’: Basit Ali, Kamran Akmal rip into Pakistan after Netherlands escape
6988fedab00027da494aa304	 Olympic art project in a Milan park invites the public to 'reflect' on the Games' spirit
69890054b00027da494aa690	Epstein case reveals real face of Western elites seeking to rule world — Lavrov
6988ff60b00027da494aa3d6	Man arrested for murder after student's death
6988ffbdb00027da494aa4a0	American skier Lindsey Vonn suffers broken leg, airlifted after horrific Winter Olympic downhill crash
69890054b00027da494aa691	Georgia’s relations with EU remain at low level — PM
6988ffe8b00027da494aa619	Building collapse in Lebanon kills at least six people, local official says
6988fea8b00027da494aa2ac	Cairo, Athens call for international stability force in Gaza and settlement of Iranian nuclear file
6988ffe1b00027da494aa5c2	Leaders of various parties should introspect on the way the country’s politics is being conducted: Sudheendra Kulkarni
6988fef2b00027da494aa319	Iran’s top diplomat says nation’s power lies in defying pressure: ‘No to the great powers’
6988ff0ab00027da494aa349	Sir Keir Starmer isn't out of the woods yet, here's why - Analysis by Christopher Hope
6988ff60b00027da494aa3d4	Dozens of flood warnings in England after days of non-stop rain
6988fe9eb00027da494aa287	Dem pols battle against national voter ID rule despite 71% of their voters backing it
6988fea9b00027da494aa2ad	Yield on Egypt’s international bonds falls to 4% amid strong market performance: Finance Minister
69890004b00027da494aa65f	Bonehead NJ driver’s stunt gone wrong sends pickup sinking through frozen lake
6988ff83b00027da494aa41f	Ukrainian forces drive Russians out of Ternuvate on Zaporizhzhia axis
6988ffdab00027da494aa56e	Fetterman expects DHS shutdown amid partisan funding feud, breaks with Democrats on voter ID
6988ffbab00027da494aa465	VIDEO: Nancy Guthrie Ransom Demand Reaches $6 Million
6988ffdab00027da494aa56f	American Olympian taking social media breather over 'hate' after Trump criticism
6988fea9b00027da494aa2ae	Saudi Ports Authority seeks Suez Canal partnership for Jeddah port development
6988ffdeb00027da494aa59a	Kennel Club of India secretary Sudarsan no more
6988ff35b00027da494aa3b2	Tehran threatens: 'Rain of missiles' on Israel
6988fe9fb00027da494aa288	HHS Secretary RFK Jr. reveals his Super Bowl splurge ahead of the big game: ‘Meat and ferments’
6988ffbeb00027da494aa4a1	Silk, zari, and stardust: How Deepika Padukone, Rekha, and Aishwarya Rai Bachchan made the Kanjeevaram eternal
6988fea9b00027da494aa2af	Al-Sisi reaffirms support for Somalia’s unity, warns against threats to Horn of Africa stability
6988ffbeb00027da494aa4a2	T20 World Cup: Kamindu Mendis rescues Sri Lanka from a spot as co-hosts begin campaign with win over Ireland
6988ffe8b00027da494aa61a	Iran insists on right to enrichment, ready for confidence-building
6988ffdfb00027da494aa59b	Police, Excise launch intensive raid in Perumbavoor; nine NDPS cases registered
6988fea9b00027da494aa2b0	Egypt health minister highlights youth investment at Diplomacy Forum
6988ff0ab00027da494aa34a	Keir Starmer dealt new blow as union boss calls for leadership change over Lord Mandelson scandal
6988fea9b00027da494aa2b1	SODIC’s net profit surges 77% in 2025
6988fef3b00027da494aa325	Iran fifth gold consumer in 2025, global data show
6988ffdfb00027da494aa59c	Lack of feed affects milk production in T.N.; Karnataka does better
6988ff84b00027da494aa420	Kyiv to add 9 MW of power today – Shmyhal
6988fea8b00027da494aa29c	Influential Ghanaian highlife musician Ebo Taylor dies at 90
6988fea9b00027da494aa2b2	Emergency Labour Aid Fund disburses EGP 2.48bn to support over 441,000 workers nationwide
6988ff60b00027da494aa3e0	Why Canada’s China Pivot Makes US Tariff Relief Harder
6988fef3b00027da494aa326	Russia, Oman FMs confer on recently-resumed Iran-US talks
6988fed3b00027da494aa2f2	The winner of Big Tech's earnings Super Bowl wasn't even close
6988fea8b00027da494aa299	US news anchor Savannah Guthrie says 'we will pay' in plea for mother's return
6988ffe2b00027da494aa5db	LSGD joint director restricts construction permits in 13 panchayats in Idukki
6988fea9b00027da494aa2b3	Egypt to import frozen poultry to boost supply ahead of Ramadan
6988ffdfb00027da494aa5a5	Youth urged to take up swimming as part of daily life skill
69890004b00027da494aa660	Mumbling homeless woman left to spend bone-chilling night on NYC sidewalk — as city workers say their ‘hands are tied’
6988ff64b00027da494aa3ec	West Bengal govt employees rally, demand immediate release of DA arrears
6988ffdab00027da494aa570	Kid Rock's Rock the Country festival canceled in South Carolina after Shinedown pulls out over unity concerns
6988ffdab00027da494aa571	Rockets star's explicit outburst toward female ref sparks apology
6988fec6b00027da494aa2d6	Iran sentences locked-up Nobel Peace Prize winner to seven more years in prison during hunger strike
6988ff41b00027da494aa3c2	Pima County sheriff went to U of Arizona basketball game as Savannah Guthrie pleaded for mother's release in new video
69890054b00027da494aa692	Russia, Oman agree on importance of promoting further Iran-US talks
69890054b00027da494aa693	Putin, Lukashenko discuss current international issues over phone — Kremlin
6988ffdbb00027da494aa57f	Saudi Arabia to chair Institute of Internal Auditors board for 2027–2028
6988ffdfb00027da494aa59d	PM Modi vows stronger India-Malaysia ties in strategic pivot; says ‘no compromise’ on terrorism
6988ff84b00027da494aa421	Russian forces shell Dnipropetrovsk region: Three civilians injured
6988ffdfb00027da494aa59e	BRS will win all municipalities in Medak district: Harish
6988feaab00027da494aa2b4	New digital platform to offer 40 initial services for Egyptian social insurance
6988ff46b00027da494aa3c3	Brandi Carlile says singing ‘America the Beautiful’ at Super Bowl is about 'being queer' on ‘the largest stage in America’
6988ff35b00027da494aa3b3	Security forces thwart weapons smuggling attempt
6988ffdfb00027da494aa59f	A.P. govt. signs pact with SRM-A.P. for quantum reference facility
6988ffe8b00027da494aa61b	Iran’s Nobel winner Narges Mohammadi given new prison term of more than seven years
6988ffbeb00027da494aa4a3	Drunk girls attack cab driver with helmets in Bengaluru, booked
6988ff0ab00027da494aa34b	Keir Starmer issued stark warning by ex-aide as Morgan McSweeney exit leaves PM's position 'exposed'
6988ffe0b00027da494aa5ba	Vettilakkolli residents seek basic amenities
6988feaab00027da494aa2b5	Egypt’s engazaat to invest $100m in regional green utility projects
6988fea8b00027da494aa296	France murder trial complicated by twin brothers with same DNA
6988ff79b00027da494aa40d	Iranian Nobel laureate sentenced to over 7 more years
6988ffbcb00027da494aa48d	Bruno Fernandes gives blunt response when asked about Man Utd fan who won't cut his hair until five games won
6988ffdfb00027da494aa5a0	 Namma Metro fare hike put on hold after public backlash; BMRCL to review decision
6988ffe8b00027da494aa61c	For Palestinians returning to Gaza, a bittersweet reunion
6988ffbeb00027da494aa4a4	Able to connect directly with students using social media: MSBSHSE chairperson
6988ffbeb00027da494aa4a5	Mini aircraft crashes in Karnataka, 2 escape with injuries
6988ffbeb00027da494aa4a6	IRCTC Divine East Temple Tour: Railways to operate Bharat Gaurav Deluxe Tourist train – check journey date, route, ticket price
6988ff85b00027da494aa422	Russian shelling of Kherson leaves five women injured 
6988ffbab00027da494aa469	Moscow Arrests Alleged Ukraine-Backed Shooter of Russian Intel Chief
6988fec7b00027da494aa2d7	UK PM Keir Starmer’s top aide Morgan McSweeney quits over Mandelson-Epstein scandal
6988ffbeb00027da494aa4a7	One killed as speeding truck mows down two-wheeler
6988ff65b00027da494aa3ed	Centre starts work on Sawalkote Hydroelectric Project on Chenab after repealing Indus Water Treaty with Pakistan
6988fef4b00027da494aa327	Araghchi congratulates futsal team on winning Asia title
6988ff60b00027da494aa3d2	Andrew shared confidential information with Epstein as trade envoy, files suggest
6988ffbeb00027da494aa4a8	Does banning access to social media for minors under 16 really protect them?
6988ffdab00027da494aa572	Duke staffers 'got punched in the face' as UNC fans stormed court after upset win, coach says
6988ff35b00027da494aa3b4	Government takes aim at dangerous drivers
6988ffdfb00027da494aa5a1	Islamiah College in Tirupattur inks MOU
6988ffbeb00027da494aa4a9	Warring criticises IAS officers’ suspension: AAP making them scapegoats for its own failure
6988ffdfb00027da494aa5a2	Salesman robbed close to police station
6988ffbfb00027da494aa4aa	Seven booked for ‘selling SGPC land’ on the basis of fake authority letter
6988fea8b00027da494aa295	Russia names three suspects in shooting of general
6988ff85b00027da494aa423	Ukraine expects 150 Gripen, 100 Rafale jets – President Zelensky
6988ffdab00027da494aa573	Bill Maher laments rise of gambling culture among young Americans during 'Real Time'
6988ffdfb00027da494aa5a3	Nandi theatre festivals will be organised soon, says Tourism Minister
6988ffbab00027da494aa461	WATCH: Breezy Johnson Breaks Down in Tears During Nat'l Anthem After Capturing Team USA's First Gold Medal
6988ffdfb00027da494aa5a4	Hebbagodi police rescue 6 trapped in lift
6988ffbfb00027da494aa4ab	New photos show Epstein’s ‘wild’ dinner party with Elon Musk, Mark Zuckerberg
6988ffbfb00027da494aa4ac	Op Prahar: part-2 of war against gangsters launched | Be visible, visit crime spots: Punjab DGP to senior cops
6988ffe9b00027da494aa61d	US Treasury chief Bessent hails ‘big victory’ for Japan PM Takaichi in election
6988ffbab00027da494aa46c	Lawler: 'Not Realistic' to Kick Out Over 25 Million Undocumented People
6988ffdab00027da494aa574	DAVID MARCUS: In rural Virginia, mixed signals for Trump and the GOP
6988fec8b00027da494aa2d8	Suspected saboteurs hit Italian rail network as Winter Olympics kick off
6988ffdfb00027da494aa5a6	Two persons arrested for possession of tusks in Vellore
6988ffdfb00027da494aa5a7	KSRTC warns of FIRs as public remove advertisements from buses and shelters
6988fef5b00027da494aa328	Iran should prioritize ties with neighbors in foreign policy
6988fed8b00027da494aa2fe	Trump Meets With Honduran President Nasry Asfura in Florida
6988fef2b00027da494aa31a	North Korea executed teens for listening to K-pop, watching ‘Squid Game’: report
6988ffbfb00027da494aa4ad	Prohibitory orders, drones to ensure copy-free board exams in Pimpri Chinchwad
6988ff35b00027da494aa3b5	Jeffrey Epstein - or the decadence of the Western élite
69890055b00027da494aa694	INTERVIEW: Board of Peace cannot be alternative to UN — European parliamentarian
6988ff0ab00027da494aa34c	Zia Yusuf DEMANDS General Election while 'absolute dumpster fire' blazes through Labour
6988ffdfb00027da494aa5a8	Startup communities launched in two villages in Villupuram district
6988ff26b00027da494aa387	Online Tools Empower and Endanger Women as Egypt Tackles TFGBV
6988ffbfb00027da494aa4ae	Ahead of Valentine’s Day, rose prices bloom, profits wilt for florists
6988ffdbb00027da494aa580	Federation of Saudi Chambers announces formation of  Saudi-Kuwaiti Business Council
6988ffe5b00027da494aa607	 Democratic Sen. Schiff says Trump intends to 'subvert' 2026 midterm elections
6988ffbcb00027da494aa48e	Asda staff slammed as 'appalling' for belittling blind mystery shopper
6988ff4ab00027da494aa3c4	Mamdani under fire for lack of snow, trash removal after NYC storm
6988ffdfb00027da494aa5a9	Manipur district issued prohibitory orders over Kuki-Naga tension
6988ffdab00027da494aa575	Super Bowl 2026 has Hollywood split as A-listers Chris Pratt, Mark Wahlberg and Ben Affleck pick sides
6988fef5b00027da494aa329	Iran’s Ahmad Abbasi named Most Valuable Player
6988ffe0b00027da494aa5b1	IUML should clarify stand on tie-up with JIH, says Govindan
6988ff60b00027da494aa3da	Self-taught Welsh learner travels 4,000 miles to sit exam
6988ffbfb00027da494aa4af	No correction window, tighter eligibility: Pune aspirants respond to UPSC changes
6988ffdfb00027da494aa5aa	Cardinal Poola Anthony elected CBCI president at 37th general body meeting
6988ffdab00027da494aa576	Americans ditch traditional Super Bowl junk food for healthier game day snack options
6988ff85b00027da494aa424	Sybiha: Only Trump can stop war in Ukraine
6988ff35b00027da494aa3b6	The choice we're not making
6988ffbfb00027da494aa4b0	City boy to star in Kohrra Season 2
6988fea8b00027da494aa298	US skier Vonn crashes in downhill run while competing with torn ACL
69890055b00027da494aa695	Israeli military strikes armed radicals in northern Gaza Strip
6988ff4fb00027da494aa3c5	Sen Jon Ossoff requires photo ID for campaign event despite opposition to voter ID laws
6988ffdfb00027da494aa5ab	Why is Centre not initiating CBI inquiry against KCR, asks  Revanth Reddy
6988ffbcb00027da494aa48f	Major Lindsey Vonn health update after Winter Olympics star was involved in awful crash
69890055b00027da494aa696	Putin’s envoy anticipates UK PM’s soon resignation after his chief of staff stepped down
6988ffbfb00027da494aa4b1	Days after 32-hr traffic: Expressway again witnesses snarls with weekend vehicles surge
6988ffe9b00027da494aa61e	Israel to take more West Bank powers and relax settler land buys
6988ffbfb00027da494aa4b2	‘RDG discontinuation an abysmal injustice to Himachal’: Principal finance secy warns of ‘catastrophic’ fiscal crisis
6988fec9b00027da494aa2d9	One dead, six hospitalized after tragedy strikes Sydney music festival
6988ffbfb00027da494aa4b3	Ahmedabad University announces Institute of Manufacturing and Economy
6988ffdfb00027da494aa5ac	Biotechnology to steer accelerated green growth of the future, say experts
6988ffe1b00027da494aa5c4	Call for tranquilised tiger’s rehabilitation in Andhra landscape grows louder
6988ffbfb00027da494aa4b4	Inside Jeffrey Epstein’s plans to create a ‘super race’, with help from AI and gene engineering
6988fec4b00027da494aa2d3	Boycott on US goods in Greenland surges as app sees massive spike in downloads
6988ffeab00027da494aa61f	Italian PM Meloni slams 'illiberal drift' after comedian quits TV show
6988ff60b00027da494aa3dd	An almighty scare - but are England learning?
6988ffdfb00027da494aa5ae	Failure to count DNTs in 2027 Census could alienate over 10 crore people: G.N. Devy
6988ff27b00027da494aa388	Why Sinai Is the Most Healing Place on Earth
6988ffdfb00027da494aa5ad	Mata Vaishno Devi board approves ‘Shakti Museum’, state-of-the-art light & sound show for Katra shrine
6988ff86b00027da494aa425	Zelensky: Around 450 drone companies currently operating in Ukraine
6988fff8b00027da494aa647	South Africa to withdraw troops from UN mission in DR Congo
6988fedab00027da494aa30b	 Iran sentences Nobel laureate Mohammadi to 7 more years in prison
6988ffc0b00027da494aa4b5	‘I’m always left incredibly offended…’: Billie Eilish once opened up about the frustration of being misunderstood with Tourette’s
