article_id	title
6988ffd6b00027da494aa547	On way to deliver 1st wedding invite to temple, 3 of family killed after Audi crashes into them
6988ffd6b00027da494aa548	UP court acquits 22 in Muzaffarnagar riots murder, arson case
6988ff0bb00027da494aa35a	Ed Miliband ‘plotting Labour leadership bid inspired by NYC socialist mayor Zohran Mamdani’
6988ffd6b00027da494aa549	‘No subject’: Washington Post CEO Will Lewis resigns after mass layoffs, thanks owner Jeff Bezos in email to employees
6989005bb00027da494aa6ad	Diplomat doubts value of Olympics without participation of Russian, Belarusian teams
6989000eb00027da494aa678	 Hard hats and dummy plates: Reports of ICE ruses add to fears in Minnesota
6988ffd6b00027da494aa54a	‘Non-compliance’: Court orders release of accused within day of his arrest
6988fedbb00027da494aa30d	 Portugal chooses between a moderate and a populist in runoff presidential election
6988fedbb00027da494aa30e	 Ukraine businesses struggle to cope as Russian attacks bring power cuts and uncertainty
6988ffd7b00027da494aa54b	UPSC Ethics Simplified : When an honest civil servant resigns, is it a failure of the ‘system’ or a test of ethics?
6988fff1b00027da494aa636	Filipino-American who shot ex-partner in front of children found guilty of murder
6988ff33b00027da494aa3a8	 Starmer is facing the final curtain as British prime minister 
6989005bb00027da494aa6ae	Russian air defenses downed 22 Ukrainian drones
6989005bb00027da494aa6af	Krasnopol precision munitions deliver accurate hits — Rostec
6988ffd7b00027da494aa54c	How IIT Mandi opened the gates to global research and internships in Germany and Japan | Life in an IIT
6988ff5bb00027da494aa3c8	BREAKING: Law enforcement are now investigating the home of Savannah Guthrie's sister
6988ffd7b00027da494aa54d	Japan election: PM Sanae Takaichi seeks strong mandate as polls open, warns she will quit if party loses
6988ff20b00027da494aa378	Trade agreement with US amounts to ‘surrender’ by Modi government, alleges Congress
6988ffd7b00027da494aa54e	CBSE CTET 2026: Paper 2 cancelled in two Bihar exam centers
6989000bb00027da494aa670	Voting begins in Thailand's general election
6988ffd7b00027da494aa54f	How a single arrest in Delhi’s Lajpat Nagar led to fall of a massive interstate drug syndicate
6989001eb00027da494aa688	Queensland Government proposes slogan ban amid antisemitism crackdown
6988feaeb00027da494aa2b9	Australia's right-leaning opposition parties reunite
6988ffd7b00027da494aa550	‘Kahaan se superstar hai?’: Basit Ali predicts Babar Azam could be dropped for Pakistan’s clash against USA
6988ffd7b00027da494aa551	“Harassed, made to run from one police station to other”: ‘Missing’ 9-yr-old boy found murdered in Ludhiana
6988fff2b00027da494aa637	Catholic traditionalists risk showdown with Vatican
6988ffd7b00027da494aa552	T20 World Cup: What is the highest team score in T20 WC history?
6988ffd7b00027da494aa553	Inside Google’s secret Taipei Hub: How the Pixel 10 is finally bridging the gap with Apple’s iPhone
6988ffd8b00027da494aa554	UPSC CSE 2026: Commission extends call centre operation facility for aspirants
6988fff2b00027da494aa638	Reaction to Trump’s racist post shows he is not always immune to rules of politics
6988ff6db00027da494aa3f6	Who are Jaspreet Singh, Kamal Kishor Yadav? Two senior IAS officers suspended by Punjab government, here's why
6988ffd8b00027da494aa555	Interstate gang defrauding e-commerce firms busted, 5 held
6989005cb00027da494aa6b0	Lancet-E strike system authorized for exports — developer
6988ffd8b00027da494aa556	AP Dhillon, with a net worth of Rs 83 crore today, once slept on the streets in Canada and worked at gas stations: ‘I used to work for 12 hours before going to college’
6988ffd8b00027da494aa557	How 3 Gurgaon women tracked down their missing sons and begged for their release from a room of horror
6988ffd8b00027da494aa558	Cyber crime not just about financial fraud, senior citizens, women & children being targeted through gaming & apps: Gujarat DGP
6988ff0bb00027da494aa35b	Home Office ‘tried to silence' adviser who raised alarm over growing Islamist threat to Britain
6988ffd8b00027da494aa559	Row over Surat school construction site: Corporator on hunger strike hospitalised, says ‘will resume my fast later’
6988ffd8b00027da494aa55a	Surat civic panel adds projects worth Rs 703 cr to draft budget
6988fff3b00027da494aa639	Toddler detained by ICE returned to custody after hospitalisation and denied medication: Lawsuit
6988ffd8b00027da494aa55b	In Rajkot, 45 Cong workers detained for vandalising set of play on Godse
6988ffd9b00027da494aa55c	Mohali court grants bail to businessman in vigilance case linked to Majithia
6988ffd9b00027da494aa55d	UP Traffic Directorate organises 2-day workshop to boost road safety
6989000eb00027da494aa679	 Car plows into pedestrians at grocery store in California mountain town, injuring 4
6989000bb00027da494aa671	106 wild horses roam around Cape Toi in southwest Japan's Miyazaki Pref.
6988ffd9b00027da494aa55e	Man drives car into pedestrians at grocery store in California mountain town, injuring 4
6988ffd9b00027da494aa55f	The Blue Gold: All about India’s rare, deep-indigo turmeric with supercharged healing power
6988febeb00027da494aa2cc	If U.S. attacks, Iran says it will strike U.S. bases in the region
6988ff34b00027da494aa3a9	 Bangladesh elections test ties with India as China deepens outreach 
6988ffd9b00027da494aa560	Border 2 Box Office Collection Worldwide Day 16 Updates: Sunny Deol’s war drama set to cross Rs 7 crore on Sunday
6988ffd9b00027da494aa561	Javed Akhtar recalls no composer, music company wanted to make ‘Breathless’, made him wait for seven years: ‘If I had not met Shankar Mahadevan…’
6988ff34b00027da494aa3aa	 Japan's ratio of household spending on food hits 44-year high 
6988ffd9b00027da494aa562	Sanjay Shankar Ghadi: From Shinde critic to Deputy Mayor for Sena
6988ffbab00027da494aa46f	'Cut Him!" Fans Demand Removal of Team USA Skiers with 'Mixed Emotions' Over Representing America
6988ffb1b00027da494aa44b	Haiti's transitional council steps down, hands power to PM
6988fea8b00027da494aa2a0	Australia's opposition coalition reunites after row over hate-speech laws
6988ffe4b00027da494aa5f7	Federal appeals court upholds Trump mass detention policy for illegal immigrants
6988ffd9b00027da494aa563	Mann govt suspends 2 IAS officers, shunts out 2 others over smartphone procurement delay
6988ff20b00027da494aa379	Shutting down Anand Teltumbde talk, the authorities are imprisoning our imaginations
6988ff6eb00027da494aa3f7	India-US Trade Deal: Farmers' Unions call for nationwide protests on February 12
6988fea2b00027da494aa28c	Katie Porter is roasted for bizarre Bad Bunny Super Bowl comments
6989005cb00027da494aa6b1	Russia, Belarus expect record high turnover as of 2025 year-end
6988ff5fb00027da494aa3c9	New video shows Savannah Guthrie begging abductor to return mom Nancy: ‘We will pay’
6988ff21b00027da494aa37a	Eco India: How a climate resilient cotton variety is boosting livelihoods in Kutch's arid lands
6988ff23b00027da494aa380	How Bangladesh’s embattled Hindus are going to vote in the first post-Hasina elections
6988ff21b00027da494aa37b	Russia: Four Indians among at least six injured in stabbing attack at university
6988ff35b00027da494aa3ab	 Diver dies in underwater coal mine survey in Japan 
6989000cb00027da494aa672	Olympics: Japan pursues U.S. in figure skating team final as Kagiyama stars
6988ff22b00027da494aa37c	Sunday book pick: Meek men meet neoliberal blues in Sarnath Banerjee’s 2004 graphic novel ‘Corridor’
6988fff3b00027da494aa63a	Washington Post publisher Will Lewis announces departure, following mass layoffs
6988fef2b00027da494aa323	ANU Holds Award for Ex-PM Guilty of Human Rights Crimes as Revocation Drags On
6988feb9b00027da494aa2c6	U.S. pushes Russia and Ukraine to end war by summer, Zelenskyy says
6988ff60b00027da494aa3cf	Illegal, High-Power E-bikes to Be Crushed in Crackdown
6988ff22b00027da494aa37d	Ramachandra Guha: Aggressive majoritarianism crippled Pakistan. Will India fare differently?
6988ffacb00027da494aa43b	Sheriff leading Guthrie investigation spotted at basketball game as family pleads again with alleged ransomers
6988fea3b00027da494aa28d	Gavin Newsom spotted at another Super Bowl party
6988ff60b00027da494aa3d0	Leaders Urge Peace During Israeli President’s Visit
6989005cb00027da494aa6b2	Battlegroup West destroyed 44 Ukrainian quadcopters
6988ff23b00027da494aa37e	‘Tu Yaa Main’ and a short history of the crocodile in cinema
6988fff3b00027da494aa63b	Bugs in food and sickness haunt immigrants held in Texas
6988ff60b00027da494aa3d1	Coalition Reunion Confirmed After Weeks in Deep Freeze
6988fef1b00027da494aa317	Panamanian Drug Lord Convicted in US Federal Court
6988ff23b00027da494aa37f	‘I write in blood, rooted in the soil where I belong’: Jnanpith Award winner Pratibha Ray
6988feb0b00027da494aa2bc	Matsuyama shoots 68 to take 1-shot lead at Phoenix Open with top-ranked Scheffler lurking
6988fedbb00027da494aa30f	 Kim expected to issue major policy goals at North Korea party congress this month
6989000eb00027da494aa67a	 Washington Post publisher Will Lewis says he's stepping down, days after big layoffs
6988fea8b00027da494aa2a9	'I don't want to imagine what happened' - Shock and disbelief in area Nancy Guthrie went missing
6988fea3b00027da494aa28e	Radical LA councilmember Nithya Raman’s shocking record in the spotlight as she enters mayor’s race
6988ff61b00027da494aa3e1	Canada’s Constitution Doesn’t Protect Property, and Homeowners Are Now Paying the Price
6988fff4b00027da494aa63c	‘We will pay’: US TV host Savannah Guthrie pleads for mother’s return
6988ff61b00027da494aa3e2	To Reverse Canada’s Freefalling Test Scores, Bring Back Traditional Education Methods
69890020b00027da494aa689	Sussan Ley and David Littleproud strike deal to reunite Liberals and Nationals
6988fff4b00027da494aa63d	US prosecutors began investigating Renee Good’s killing. Washington told them to stop
6988ff61b00027da494aa3e4	Rob Lantz to Resume PEI Premiership After Winning PC Leadership Race
6988fff4b00027da494aa63e	More snow in Florida than Utah? Why weird weather has dominated the US in 2026
6988ffacb00027da494aa43c	Anti-ICE agitators arrested at federal building in Minneapolis after lewd objects hurled at law enforcement
6988fff5b00027da494aa63f	Trump’s Greenland threats spill into another Danish territory
6988fedbb00027da494aa310	 Thailand votes in early election with 3 main parties vying for power
6988ff61b00027da494aa3e5	Ontario Liberals Announce Date to Select New Leader, Kicking Off Race
6988ff61b00027da494aa3e6	Driver Sentenced for Humboldt Broncos Bus Collision Loses Bid to Stay in Canada
6988ff62b00027da494aa3e7	Ottawa Gives Canada Post a $1.01-Billion Loan Amid Ongoing Financial Struggles
6988ff60b00027da494aa3d9	Fried chicken is booming in Britain - and fish and chips is losing out
6988ffbbb00027da494aa47c	Report: Pelosi Planning to Endorse JFK Grandson Jack Schlossberg in NY House Race
6988ff60b00027da494aa3d8	I’m obsessed with bar livestreams. All the drama of a night out - from my sofa
6988ff62b00027da494aa3e8	Balmy in BC and Alberta as Jet Stream’s Dip South Brings Deep Freeze to Ontario
6988fff5b00027da494aa640	Explainer: Why Trump’s calls to ‘nationalise’ voting have raised midterm fears in the US
6988fea8b00027da494aa2a8	From classroom to camera: A teacher who has become a sensation in Indian cinema
6988ffe4b00027da494aa5f8	Tulsi Gabbard denies wrongdoing over delayed whistleblower complaint referral to Congress members: 'Baseless'
6988ffe5b00027da494aa608	 Arctic blast: Coldest NYC winter in more than 20 years
6989005cb00027da494aa6b3	The Guardian reports on phone call between person close to Trump, foreign intelligence
6989000db00027da494aa674	Olympics: Ski jumper Maruyama wins bronze, Japan's 1st Milan Cortina medal
6988ff0bb00027da494aa35c	Foreign Office launches review into Peter Mandelson’s five-figure US ambassador payoff
6988ffe4b00027da494aa5f9	Nicki Minaj fans say they’re leaving Democrat Party as rapper’s politics spark backlash and praise
6988fea8b00027da494aa2a4	No big names. No big budget. But Heated Rivalry is a big hit
6988ff62b00027da494aa3e9	Labour Board Rejects Legal Challenges to Ottawa’s Vaccine Mandates for Public Servants: Union
6989000db00027da494aa675	Olympics: Snowboarder Kimura wins Japan's 1st gold of Milan Cortina Games
6988ff62b00027da494aa3ea	Mexican Officials Say Body Found Appears to Be of One of 10 Kidnapped Workers of Canadian-Owned Mine
6989000fb00027da494aa67e	 Police arrest protesters at Minneapolis federal building on 1-month anniversary of woman's death
6988fe9bb00027da494aa283	Ottawa May Be Delaying Taiwan Trade Deal to Avoid Upsetting China, Taipei’s Envoy Says
6989005db00027da494aa6b4	Russia to showcase new armament at World Defense Show
6989000fb00027da494aa67c	 Appeals court affirms Trump policy of jailing immigrants without bond
6988fea8b00027da494aa2a6	Pakistan's famous kite festival cautiously returns after 19-year ban
6988fea8b00027da494aa2a7	A singer's tragic death highlights Nigeria's snakebite problem
6988fe9bb00027da494aa284	Insiders: Passive Resistance Spreading Beyond Military in China
6988fea8b00027da494aa2ab	ICE protester says she was 'disgusted' after fake arrest image shared by White House
6989005db00027da494aa6b5	Trump involves top brass in diplomatic efforts for Iran, Ukraine — AP
6988fff5b00027da494aa641	Washington Post CEO Will Lewis out after sweeping job cuts
6988ffb1b00027da494aa44c	Washington Post publisher resigns after job cut uproar
6988ffbab00027da494aa470	Miracle on Ice Legend Blasts American Skier Hunter Hess for Saying He Has 'Mixed Emotions' About Representing the US
6988ffbab00027da494aa471	Team USA Figure Skater Amber Glenn: 'Hard Time' For LGBTQ Community Under Trump Admin
6989000fb00027da494aa67b	 Washington Post publisher Will Lewis says he's stepping down, days after the Post cut a third of its staff
6988ff63b00027da494aa3eb	Students Create Platform to Document Rise in Anti-Semitic Incidents at Concordia University
6988fef2b00027da494aa324	Israel Says Netanyahu to Meet With Trump in Washington Next Week
6988ff72b00027da494aa3fe	Milan: Protest ends in clashes near Olympic Village
6989000fb00027da494aa67d	 Brad Arnold, lead singer of Grammy-nominated rock band 3 Doors Down, dies at 47
6988fedbb00027da494aa311	 Japanese Prime Minister Sanae Takaichi hopes for big win as polls open in national elections
6988feb1b00027da494aa2bd	Malinin upstaged by Kagiyama as Japan keep pressure on U.S. in skating team event
6988ffe4b00027da494aa5fa	Calm amid chaos: Noem defies calls to resign, touts border victory as shutdowns, storms and riots swirl
6988fecab00027da494aa2db	North Korea executed schoolchildren for watching ‘Squid Game’
6988ff0bb00027da494aa35d	Foster parents blocked over vaping and 'wrong' freezer type to see rules scrapped says minister
6988ffbbb00027da494aa474	Brad Arnold, 3 Doors Down Frontman, Dies at 47
6989005db00027da494aa6b6	Takeoff, landing restrictions triggered in three Russian airports
6989005eb00027da494aa6b7	Second tour of presidential election to take place in Portugal
6989005eb00027da494aa6b8	Lead singer of 3 Doors Down rock band died at the age of 47
6988ffbcb00027da494aa484	Schweizer: How Liberation Theologists, Marxists Shifted Catholic Church Toward Open Borders
6988ffbcb00027da494aa485	Schweizer Says It's Time to Ban Dual Citizenship: 'Vitally Important'
6988ffbbb00027da494aa481	Exclusive -- Leavitt: Tom Homan Has Struck Agreements with Nearly All Minnesota Counties to Hand Over Violent Illegal Aliens from Jails
6988ffbbb00027da494aa482	Exclusive: Leavitt Announces Trump's 'Unprecedented' Legal Maneuver to Get Permits for L.A. Fire Victims
6988ffbbb00027da494aa47a	Exclusive: RNC Chair Planning Midterm Convention, Touts Financial 'Superiority' to DNC
6988fef2b00027da494aa31c	Trump's special envoy Witkoff and Kushner visit US aircraft carrier amid Iran tensions, talks
6988ff0bb00027da494aa35e	Rachel Reeves under pressure to delegate delivery of 'non-event' Spring Statement to junior minister
6988fedbb00027da494aa312	 Rescuers recover bodies of miners trapped in Colombia coal mine
6988ff7cb00027da494aa415	Syria and Saudi Arabia sign major investment package
6988fed4b00027da494aa2f5	Nearly a thousand Google workers sign letter urging company to divest from ICE, CBP
6989005eb00027da494aa6b9	Parliamentary elections, referendum to be held in Thailand
6988fecbb00027da494aa2dc	Trump says US held ‘very good talks with Iran’ as Islamic Republic ratchets up rhetoric
6988ffbab00027da494aa46e	WATCH: Media Roasted for Emphasizing JD Vance Was Booed at Olympics, Ignoring Overwhelming Cheers
6989005eb00027da494aa6ba	Innoprom. Saudi Arabia international exhibition to open in Riyadh
6988ffacb00027da494aa43d	NYPD sergeant convicted after throwing cooler at fleeing drug suspect in New York City: report
6988ffe4b00027da494aa5fb	This Senate Democrat wants voter ID for his campaign events — but not federal elections
6988fff6b00027da494aa642	While You Were Sleeping: 5 stories you might have missed, Feb 8, 2026
6988fe98b00027da494aa27d	As Camps Drown, Questions Mount Over Who will Pay the Bill for Over a Decade of Displacement and Economic Neglect
6988fed2b00027da494aa2e9	Hims & Hers pulls copycat weight-loss pill after threats of legal action
6988feccb00027da494aa2dd	Epstein cultivated close ties with two key Russian government figures in the 2010s, files show
6988fec1b00027da494aa2cf	Taiwanese diver dies after search at 1942 mine accident site in Japan
6988fec3b00027da494aa2d2	Man arrested for stabbing convenience store employee, stealing cigarettes
6988fff6b00027da494aa643	US agency investigating if ABC’s The View violated equal time rules for political candidates
6988febbb00027da494aa2c8	Mariah Carey's Olympic act prompts questions about possible lip-syncing and a curious teleprompter
6988fec2b00027da494aa2d1	Faheem blitz sees Pakistan avoid Netherlands shock at T20 World Cup
6988feb8b00027da494aa2c5	Italy's heroic defense stops Scotland's last-gasp charge for Six Nations win
6988feb8b00027da494aa2c4	England thrashes Wales 48-7 in Six Nations opener with Arundell hat trick
6988febab00027da494aa2c7	Man United wins again to make it four in a row for Carrick; Arsenal extends lead to 9 points
6988fec0b00027da494aa2ce	Skiing slopestyle
6988feb2b00027da494aa2be	Farmers report 'catastrophic damage to crops as Storm Marta hits Spain and Portugal
6988febcb00027da494aa2c9	Armchair detectives flood social media as search for Savannah Guthrie’s missing mom continues
6988febdb00027da494aa2ca	French justice opens Epstein-linked probe against former culture minister
6988feb5b00027da494aa2c1	Israel's Netanyahu expected to meet Trump in U.S. on Wednesday and discuss Iran
6988feb6b00027da494aa2c2	Gaza's Rafah border crossing has reopened but few people get through
6988feb3b00027da494aa2bf	Anna Odine Stroem of Norway wins gold in women's Olympic ski jumping, Nika Prevc gets silver
6988feb7b00027da494aa2c3	Italian police fire tear gas as protesters clash near Winter Olympics hockey venue
6988febfb00027da494aa2cd	Swiss racer Von Allmen wins first gold of Winter Olympics
6988febeb00027da494aa2cb	Hilary Knight ties U.S. Olympic goal record in 5-0 win over Finland team coming off stomach virus
6988feccb00027da494aa2de	Trump to hold first Board of Peace meeting this month as it seeks to rebuild decimated Gaza
6988ffb2b00027da494aa44f	How the Epstein-Barr virus triggers MS in some people
6988fed2b00027da494aa2ed	Pressure mounts on American Airlines CEO as carrier lags rivals
6988ffbbb00027da494aa472	Chaos Erupts in Milan as Radical Leftists Clash with Police over 'Unsustainable' Olympics
6988ffbcb00027da494aa483	Exclusive–Karoline Leavitt: 'Tom Homan Is the Perfect Guy to Be in Charge of Minneapolis'
6988ffe4b00027da494aa5fc	Virginia Democrat gives profanity-laced response to Cruz's criticism of the state's redistricting push
6988ff73b00027da494aa3ff	Greenland, Denmark say US talks positive but future unclear
6988ff0bb00027da494aa35f	Labour to spend £650k sending 'clueless' civil servants on education trip to farms
6988ffbbb00027da494aa475	Theater Owners Warn of 'Catastrophic' Collapse over Netflix-Warner Bros. Merger
6988fef2b00027da494aa31d	Kick Iran out of Olympics, World Cup for execution of over 30 athletes, activists demand
6988ffbbb00027da494aa477	Spencer Pratt Calls for Karen Bass, LAFD Officials to Be Fired over 'Watered Down' L.A. Fire After-Action Report
6988fe99b00027da494aa27f	Small Business Administration Suspends 111,620 California Borrowers Suspected of $8.6 Billion Fraud
6988ffacb00027da494aa43e	Two teens arrested after 15-year-old shot near Washington, DC's Union Station
6988ffbbb00027da494aa476	Queer Singer Brandi Carlile Donates $25K to Her Own Nonprofit to Help Legal Fund for ICE Detainees: 'Heartbroken and Angry for Minnesota'
6988ff7db00027da494aa417	How nonviolent protest can break autocratic rule
6988fea4b00027da494aa28f	Rick Caruso blasts Karen Bass — and drops truth bomb about Spencer Pratt’s bid for mayor: ‘I’m going to say something I’ll probably regret’
6988fff6b00027da494aa644	Avalanches in Italy kill three off-piste skiers in Winter Olympics regions
6988fff7b00027da494aa645	US-led Board of Peace to hold first meeting of leaders on Feb 19
6988ff0bb00027da494aa360	Green Day urges ICE agents to 'quit your sh**ty jobs' as singer slams Donald Trump ahead of Super Bowl performance
6988ff73b00027da494aa400	Families call for truth on Kosovo War's missing people
6988fef2b00027da494aa31e	Russia to 'interrogate' two suspects in attempted assassination of top military general
6988fea8b00027da494aa2a5	The woman tasked with kicking Australian kids off social media
6988ffdbb00027da494aa57d	 Man charged with threatening to kill Vance and possessing child abuse files
6988ffacb00027da494aa43f	Bishop Ronald Hicks replaces Dolan as Archbishop of New York with installation at St Patrick's
6988ff74b00027da494aa401	France: Ex-minister Jack Lang resigns amid Epstein probe
6988ffbbb00027da494aa473	Maher: Many 'Gaza Protesters' Want All Israelis Dead
6988fed9b00027da494aa300	Federal Judge Orders Transportation Department to Restore Hudson Tunnel Project Funding
6988fecdb00027da494aa2df	This new spy thriller is unexpectedly timely with Trump’s push for Greenland
6988fff7b00027da494aa646	US pushes Russia and Ukraine to end war by summer, Zelenskiy says
6988ffbcb00027da494aa487	Dee Snider Resigns from Twisted Sister Due to Health Struggles, Band Cancels Tour
6988ffbbb00027da494aa479	Report: Democrat Ilhan Omar's Husband's Winery May Be in Trouble Due to Islamic Ban on Alcohol
6988fedbb00027da494aa313	 Tourists stopped from seeing The Last Supper, while Olympic VIPs including Vance visit
6988fed3b00027da494aa2ef	In reversal, Trump backs Nexstar's proposed acquisition of Tegna
6988ffbcb00027da494aa488	Body Believed to Be Lil Jon's Son D.J. Young Slade Found in Pond Near Atlanta
6988feceb00027da494aa2e0	Kyiv only getting 4-6 hours of electricity a day in February after relentless Russian strikes
6988fea8b00027da494aa2a1	France investigates ex-minister Jack Lang over Epstein links
6988ffdbb00027da494aa588	Saudi Arabia deports 11,656 illegal residents in a week
6988fef2b00027da494aa31f	Iran vows to 'target US bases' if American forces launch an attack: report
6988fe99b00027da494aa280	ICE Calls On Newsom Not to Release 33,179 Criminal Illegal Immigrants Into Communities
6988ffdbb00027da494aa589	Road safety rate jumps to 70% as 43 traffic signals removed in Eastern Province
6988ffbcb00027da494aa489	Report: Immigrant Activists Want 'Allies' to Stop Using Anti-ICE Whistles
6988ffbbb00027da494aa478	Hegseth Cuts War Department Ties with His 'Woke' Alma Mater Harvard
6988ffdbb00027da494aa58a	&quot;Spears of Victory 2026&quot; joint air exercise concludes
6988ffe4b00027da494aa5fd	Man arrested for allegedly threatening to kill JD Vance was in possession of child sexual abuse materials: DOJ
6988ff8db00027da494aa439	'Keir Starmer is a disaster from start to finish - for the sake of the country, step aside,' Nana Akua blasts
6988fed2b00027da494aa2ea	Trump administration equity stakes pose risks to U.S. companies and markets
6988ff74b00027da494aa402	Italian police probe 'sabotage' on rail lines to Olympics
6988fedbb00027da494aa315	 Haiti's presidential council dissolves after rocky tenure as unelected US-backed ruler remains
6988fedbb00027da494aa314	 Gunmen in northern Nigeria kill 3 villagers and kidnap 11, including a Catholic priest
6988ffbbb00027da494aa47d	DC U.S. Atty Pirro Says 'We Are Not Done Yet' on Benghazi
6988fecfb00027da494aa2e2	Tehran’s foreign minister warns they’re ready to attack US bases in Middle East if Trump strikes Iran
6988fed0b00027da494aa2e3	French justice opens Epstein-linked investigation against former culture minister
6988fed0b00027da494aa2e4	Sweden’s loneliness wake-up call: Workers getting PTO to tend to relationships
6988ffbbb00027da494aa47b	WH's Leavitt: Attention on the Obama Truth Social Post 'Merely a Distraction for the Fake News Media'
6989000fb00027da494aa680	 Armchair detectives flood social media as search for Nancy Guthrie continues
6988ffe4b00027da494aa5fe	Trump says nuclear talks in Oman were 'very good,' claims Iran wants a deal 'very badly'
6988fef2b00027da494aa320	Ambassador Mike Waltz lays out ‘America First’ vision for US leadership at the UN
6988ff24b00027da494aa381	Air pollution can increase risk of motor neurone diseases, worsen outcomes
6988ffdbb00027da494aa58b	Saudi Arabia condemns RSF attacks on hospital, aid convoy in Sudan
6988fed3b00027da494aa2f1	Berkshire Hathaway outperforms this week as tech stocks sink
69890052b00027da494aa68a	Automakers largely sit out 2026 Super Bowl advertising amid industry uncertainty
