article_id	title
6987208861160417af3ea310	I worked for the BBC. This is the very cynical motivation behind the unpopular licence fee rise - Danny Kelly
6987206061160417af3ea274	Road under 3-ft snow, Mandi villagers carry 75-yr-old patient for 7km in makeshift chair
6987216461160417af3ea498	CPI(M) MP moves Right to Disconnect Bill in Rajya Sabha
69871ffb61160417af3ea11e	Italy’s Meloni plays down ICE agent furore as she meets US V-P Vance
6987270c1df52fc0ebd68039	Russia’s gas production down 3.2% annually in 2025 — statistics
6987204161160417af3ea145	US Military Strikes Drug Boat in Eastern Pacific, Killing 2
698726a61df52fc0ebd67fad	A surf academy is enticing Senegalese girls back to school
6987208e61160417af3ea31b	Bharat Taxi to be rolled out across India in next 3 years: Amit Shah
6987207161160417af3ea2a6	Greenland: Canada, France open consulates in Nuuk
6987216561160417af3ea49a	European stocks close higher as bumper earnings week concludes
6987270c1df52fc0ebd6803a	West tries to drag Russia into Epstein scandal — Foreign Ministry
6987206061160417af3ea275	NBW against Eknath Khadse for non appearance in court for Friday
698726a61df52fc0ebd67fac	Survivors of deadly attack on villages in Nigeria left reeling
6987270c1df52fc0ebd6803b	Russians stranded in Cuba will soon be taken to Russia — tourist industry union
698726a61df52fc0ebd67faf	US, Russia Seek New Arms Talks as Last Nuclear Pact Expires
6987207161160417af3ea2a7	European nations gear up to ban social media for children
6987214861160417af3ea3de	 Dance pair puts U.S. ahead of Japan in team figure skating as Sakamoto shines 
6987270d1df52fc0ebd6803c	Zelensky does not care that Ukraine has turned into vast cemetery — opposition politician
6987270d1df52fc0ebd6803d	Iran, US hold 'very serious' talks on nuclear program — Omani foreign minister
6987203861160417af3ea12f	Stellantis Selling Stake in Windsor Battery Plant as It Takes $35B Hit From EV Shift
6987270d1df52fc0ebd6803e	Rosatom’s seeking Hungarian contractors for Paks II NPP project — Atomstroyexport
698726a61df52fc0ebd67fae	Pokémon theme park opens in Japan as tourism boom drives demand
6987216661160417af3ea4a9	Trump Says He’s Still Looking ‘Seriously’ at Sending $2,000 Tariff Rebate Payments
69871ffb61160417af3ea11f	British police search properties in probe into ex-ambassador Mandelson over Epstein ties
6987206a61160417af3ea29a	This easy-to-get blood test can help detect cancer before symptoms appear
6987206a61160417af3ea29b	Dow blows past 50K for first time ever as tech stocks bounce back from earlier losses
69871ffb61160417af3ea120	Wanted: Volunteers to host nuclear waste, forever
6987270d1df52fc0ebd6803f	Merz says EU ready for talks with Russia, but without 'parallel communication channels'
6987270e1df52fc0ebd68040	Zelensky understates death toll three times not to pay compensation to widows — MP
6987209761160417af3ea32c	Afghans in Pakistan awaiting US resettlement abandoned once again
6987208561160417af3ea30a	Pakistan suicide bomber kills 31 killed by suicide bomber in Islamabad
6987270e1df52fc0ebd68041	Kiev's trail recognizable in assassination attempt on Russian general — legislator
6987270e1df52fc0ebd68042	Federal Statistics Service estimates Russia's GDP growth in 2025 at 1%
6987208f61160417af3ea31c	A pit dug overnight, a warning ignored: How DJB safety failures led to the Janakpuri biker's death
6987270f1df52fc0ebd68043	En+ to invest $3.2 bln into thermal power plant construction in Irkutsk Region
6987209b61160417af3ea343	'They sent a letter asking to preach. Then they massacred us' - Nigerians on jihadist attack
6987208661160417af3ea30b	Horrifying video captures massive Russian fireball in fuel tanker blast
6987203861160417af3ea134	Head of firm founded by Mandelson to quit after Epstein releases
6987215b61160417af3ea42f	James Comer demands business records from Rep. Ilhan Omar’s husband
6987208861160417af3ea311	There was only ONE person to save The Grand Tour after Clarkson and co but Amazon has made a big mistake - Alex Davies
6987204a61160417af3ea1a4	Police search Lord Mandelson's homes as part of Jeffrey Epstein investigation
6987270f1df52fc0ebd68044	Russia’s agriculture ministry cites stable ties with Brazil in agribusiness
6987270f1df52fc0ebd68045	Oil and gas revenues of Russian budget down 50.2% in January — ministry
6987203861160417af3ea130	Judge Trims Sentence in Alberta Sex Assault Case Due to Indigenous Heritage
6987206861160417af3ea293	Neighbor spotted mysterious white van before Savannah Guthrie's mother vanished from home: report
6987204a61160417af3ea1a5	'Not doing ANYTHING for us!' Women's activist accuses Labour of 'lies' as she demands closed borders
698720cb61160417af3ea364	Germany news: Merz wraps up Gulf investment charm offensive
6987203861160417af3ea136	Trial hears ex-MP is person of 'highest integrity'
6987208861160417af3ea312	Peter Mandelson's menace was staring us in the face across the pond. Your PM is in global trouble - Lee Cohen
6987270f1df52fc0ebd68046	Federal budget deficit totaled $22.1 bln in January — Finance Ministry
698726a61df52fc0ebd67fb2	Malawi: supply stocks improve, but fuel crisis far from over
698726a61df52fc0ebd67fb0	Zimbabwe agrees to staff-monitored programme with the IMF
698727101df52fc0ebd68047	Putin offers condolences to Pakistani leadership over terror attack in Islamabad
698727101df52fc0ebd68048	The Netherlands counts on early conclusion of peace in Ukraine — acting minister
6987216661160417af3ea4ab	US Arrests Key Suspect in 2012 Benghazi Attack, DOJ Announces
698727101df52fc0ebd68049	US, EU will not defend Baltic states in case of their conflict with Russia — senator
6987204a61160417af3ea1a6	Drivers face annual price hikes for hated Congestion Charge and major London tunnels
698720cb61160417af3ea365	German train conductor's death highlights rise in violence
6987204761160417af3ea188	 After Epstein fallout, UK leader Starmer faces hurdles and rivals as he battles to keep his job
6987204261160417af3ea14a	EU Countries Agree on Terms for $106 Billion Loan to Fund Ukraine
698727101df52fc0ebd6804a	AI-drones to help plant trees, combat desertification — Nature and People Foundation head
698727111df52fc0ebd6804b	EU going to block Russian oil transportation together with G7 countries
698726a61df52fc0ebd67fb1	Shutdown of Kenya’s Koko biofuel firm wipes out clean cooking options
6987206861160417af3ea297	Навигация по функциям в 1хбет: скачать приложение
698727111df52fc0ebd6804c	Lavrov says talks with OSCE representatives addressed complex issues
698727111df52fc0ebd6804d	European Commission presents 20th package of anti-Russian sanctions
698727111df52fc0ebd6804e	Russia agrees with Xi about importance of eliminating root causes of conflict — Lavrov
698727121df52fc0ebd6804f	MAI develops more energy-efficient UAV electric motor control system
6987207461160417af3ea2da	Snoop Dogg, selfies and a clean sweep for GB curlers
6987208761160417af3ea30c	Mastermind behind Benghazi attack arrested and in US custody as Bondi takes dig at Hillary Clinton
698727121df52fc0ebd68050	About 95% of wounded Russian soldiers return to duty — official
6987203861160417af3ea135	County council facing 'effective bankruptcy'
698727121df52fc0ebd68051	Remotely detonated munition to be effective against UAVs — Russian military expert
6987206861160417af3ea294	Benghazi terror suspect extradited to face US charges, appears in federal court
6987209761160417af3ea32d	Assam CM’s remarks violate Constitution, urge Supreme Court, president to intervene: Ex-bureaucrats
698720db61160417af3ea389	Poland charges five men for smuggling cigarettes from Belarus with balloons
6987215161160417af3ea3f3	Iran, US Hold Talks in Oman Over Tehran’s Nuclear Program
698727121df52fc0ebd68052	Dismantling of Ukrainian regime to guarantee peace for Russia — former Ukrainian PM
698727131df52fc0ebd68053	Lavrov advises OSCE leadership ‘not to aim for global initiatives’
6987215b61160417af3ea430	Olympic fans urged to ‘be respectful’ to US officials, athletes at opening ceremony
6987204a61160417af3ea1a7	Donald Trump slammed for posting social media video depicting Obamas as monkeys
6987209b61160417af3ea33c	Fisherman fleeing elephants killed by crocodile in Zambia  
6987204161160417af3ea146	US Ambassador Cuts Ties With Speaker of Polish Parliament, Citing ‘Unprovoked Insults’
6987204a61160417af3ea1a8	'We can't go on like this!' Keir Starmer handed brutal takedown while Labour 'feathers own nest'
6987215361160417af3ea40e	Podcast: Yitro recognizes the one true G-d of Israel
6987209b61160417af3ea347	Watch: Ukrainian soldier thought to be dead calls his family
6987215361160417af3ea40f	Podcast: Greatest of the true spiritual seekers
6987209861160417af3ea32e	Uttar Pradesh SIR: Deadline to file objections extended to March 6
698727131df52fc0ebd68054	Lavrov calls on journalists to request list of those killed in Bucha
698727131df52fc0ebd68055	Russian metallurgical coal prices in Asia rise by 6.4% in early 2026
698727131df52fc0ebd68056	Dutch minister acknowledges that Russia does not seek conflict with NATO
698726a61df52fc0ebd67fb3	Senegal surf school in Dakar brings girls back to class
6987207161160417af3ea2a8	How Philippines' schools embraced German language
6987209861160417af3ea32f	Rush Hour: Kunal Kamra denies seeking panel adjournment, FIR against film ‘Ghooskhor Pandat’ & more
698727141df52fc0ebd68057	US-Iran talks in Oman conclude, another round planned — Axios correspondent
698726a71df52fc0ebd67fb6	Meet the Kenyan teaching robotics to children in rural areas
6987204a61160417af3ea1a9	Hundreds of anti-Ice protesters descend on Winter Olympic opening ceremony before JD Vance arrival
6987215261160417af3ea404	 Norwegian crown princess issues apology amid scrutiny of Epstein links
698726a71df52fc0ebd67fb4	Top Russian intelligence officer in critical condition after Moscow shooting
698726a71df52fc0ebd67fb5	Deadly Kwara massacre exposes Nigeria’s worsening security crisis
698727141df52fc0ebd68058	OSCE chairman urges to resume diplomatic efforts on Ukraine
698727141df52fc0ebd68059	Kalashnikov Group begins production of 9-mm SR.2M submachine gun
6987208761160417af3ea30d	US accuses China of secret nuke testing as it calls for broader arms control treaty
6987206861160417af3ea295	12 Minneapolis anti-ICE agitators arrested after massive crowd gathers outside Hilton hotel
6987204a61160417af3ea1aa	Parliament revamp will cost each taxpayer £1k if MPs refuse to leave House
6987215c61160417af3ea431	How Scott Bessent could help Kevin Warsh get confirmed as Fed chairman
698720cb61160417af3ea367	EU says TikTok's 'addictive design' harms children
6987208861160417af3ea313	There is a silver lining to the BBC licence fee hike. The nuclear option is now unavoidable - Rebecca Ryan
6987209961160417af3ea330	In charts: How India doesn’t exercise
6987208f61160417af3ea31d	'Charging full fare under RAC not justified': Parliamentary panel recommends partial refunds from Railways
6987203861160417af3ea132	Three things that could bring Starmer down - and what might save him
698720cc61160417af3ea368	Women's Bundesliga dispute shows no sign of ending
6987209961160417af3ea332	‘I am in pain everyday’: How debt pushed a town in Tamil Nadu into selling kidneys
698720cc61160417af3ea369	German exports to US plummet, but Europe provides a boost
6987209961160417af3ea331	Judge, activist blew whistle on deaths in Meghalaya mines – days before third explosion killed 23
6987204861160417af3ea190	 A bombing at a Shiite mosque in Islamabad kills at least 31 and wounds dozens
6987204b61160417af3ea1ab	Angela Rayner 'preparing bid to OUST Keir Starmer - but faces crucial stumbling block
6987204b61160417af3ea1ac	Emmanuel Macron wants Britain to pay £2bn to join EU plan to arm Ukraine
6987207361160417af3ea2c2	 Her jabs go viral. He's known to quote the Bible. How social media is shaping a Texas Senate race
6987204761160417af3ea189	 Facing Trump tariffs, Africa's leading economy says it's close to China trade deal
698726a71df52fc0ebd67fb8	Why Ghana’s Parliament swapped suits for smocks
698720cd61160417af3ea36a	Could Hungary win its case against the EU's Russian gas ban?
6987204261160417af3ea14b	Russian General Shot Multiple Times in Moscow
6987208861160417af3ea30e	Americans again warned to ‘leave Iran now’ as Oman hosts indirect talks on Tehran’s nukes
6987203961160417af3ea139	MP Calls for Legal Protection for Egypt’s Delivery Workers
6987215361160417af3ea410	Iran willing to cede nuclear program, but not ballistic missiles, report says
698720cd61160417af3ea36b	China grows while Europe slows in South American EV market
6987215361160417af3ea411	A warning from Zev Jabotinsky
6987210461160417af3ea3a2	Iran's Khamenei stays away from talks as JD Vance says dynamic makes diplomacy 'much more complicated'
698726a81df52fc0ebd67fb9	Spain searches for missing woman as Storm Leonardo floods south
698720db61160417af3ea38a	Poland wins European Rail Champion Award
6987204161160417af3ea147	US Embassy Issues Alert Urging Americans to Leave Iran
6987209061160417af3ea31e	32nd Avenue CEO Dhruv Sharma arrested in Rs 2.5 crore cheating case, why Gurugram's popular hub facing protests?
6987209a61160417af3ea333	31 killed in suicide attack at Islamabad mosque, 169 injured
6987214861160417af3ea3df	 Smile Japan opens Olympic campaign with narrow win over France 
6987215361160417af3ea412	The secret connection between heaven and earth
6987204661160417af3ea17b	Russian General Known For UK Chemical Weapon Attack, Wagner Mutiny, Shot in Attempted Moscow Assassination
6987215361160417af3ea413	Daring assassination attempt deep in Russia
6987207361160417af3ea2c3	 Trump's aggressive tactics force a reckoning between local leaders and Washington
698726a81df52fc0ebd67fba	Protests in Minneapolis as immigration crackdown continues
6987216661160417af3ea4ac	White House Says Trump Has No Plans to Deploy ICE at Polls, Won’t Rule Out Federal Presence
6987215d61160417af3ea432	All 19 NY House Dems — including AOC — back Kathy Hochul for re-election
6987210361160417af3ea399	How Trump's child tax credit changes could impact your refund this season
6987208961160417af3ea314	I hate missing my show but the hard left needed this slap around the face with patriotism - Patrick Christys
6987204b61160417af3ea1ad	Nigel Farage wins crucial Wales election victory in Plaid leader's seat following Reform's Senedd announcement
6987204861160417af3ea18c	 Pope, an avid athlete, extols physical and spiritual benefits of sport in Olympic message
6987204861160417af3ea18d	 Russia and US discussed nuclear arms and agreed talks need to start soon, Kremlin says
6987209161160417af3ea31f	Delhi government starts process to draft bill for Unified Transport Authority, DUMTA
6987209a61160417af3ea334	For children: Nikoo and Zubin spot a fantastical leaf creature and decide to get to the bottom of it
6987215d61160417af3ea433	David Zaslav dodged an awkward antitrust hearing on Capitol Hill — but he may get called again
6987204861160417af3ea18a	 Deal is signed in Beirut to transfer 300 Syrian prisoners in Lebanon to their home country
6987215361160417af3ea414	Parashat Yitro: Reward and Punishment
6987209b61160417af3ea33d	Coin portrait of late Queen draws criticism in Australia 
6987209b61160417af3ea33f	FBI fugitive found hiding in Wales can be extradited to USA
6987215361160417af3ea415	Haze and rain expected over weekend
6987215361160417af3ea416	Shovavim: A time for  joy, a time for introspection
6987204861160417af3ea18b	 Norway investigates former prime minister over Epstein ties
6987206861160417af3ea296	Nancy Guthrie's son sends captors message after alleged ransom note deadline and more top headlines
6987215e61160417af3ea434	AOC-backed Dem holds narrow lead in special NJ House primary to replace Gov. Mikie Sherrill
6987203a61160417af3ea13e	US Retains Right to ‘Militarily Secure’ Chagos Air Base, Trump Says
698726a81df52fc0ebd67fbc	Kagame criticises international "threats" against Rwanda as US sanctions loom
6987216761160417af3ea4ad	Governments Should Pull Funding If Schools Don’t Address Bullying: Civil Rights Board Vice Chair
6987215361160417af3ea417	Rabbi Shmuel Eliyahu: This is why fewer Arabs visit Temple Mount
698720ce61160417af3ea36c	Cycle syncing exercise could optimize results for women
6987209b61160417af3ea335	Supreme Court refuses to entertain plea by Prashant Kishor’s party seeking fresh polls in Bihar
6987207461160417af3ea2db	Spanish skater given Minions music permission
6987204861160417af3ea18e	 The death toll from a bombing at a Shiite mosque on Islamabad's outskirts has risen to 24, a Pakistani official says
6987200661160417af3ea122	Parents thought their baby was dead when mum gave birth on Kwinana Freeway after Midland hospital handpass
6987206b61160417af3ea29c	Dad claims 16-year-old daughter took her own life after meeting a predator on Roblox, slams game platform beloved by kids
698720db61160417af3ea38b	Court orders pretrial detention for former Polish justice minister Ziobro
698726a81df52fc0ebd67fbb	Portugal hit by worst floods in decades as Storm Marta looms
6987208961160417af3ea315	The Mandelson scandal must not distract us from Keir Starmer's suicidal banning frenzy - John Redwood
698726a81df52fc0ebd67fbd	Ukraine and Russia swap 157 prisoners each in first exchange in months
698726a91df52fc0ebd67fbe	Plastic, sofas, medical waste: Bosnia’s river nightmare returns
6987215361160417af3ea418	Why the Super Bowl antisemitism ad misses the mark
6987204861160417af3ea18f	 Canada and France opening consulates in Greenland following tensions over US push for control
698726a91df52fc0ebd67fbf	Morocco flood disaster: Ksar El Kebir underwater as 140,000 forced to flee
6985c6ab8b91fa54b33d42af	 Iran and US to reopen nuclear talks in Oman after weeks of tension
6985c70f8b91fa54b33d4332	Protesters rally in Milan against US ICE presence, school closures ahead of opening ceremony
6985c59f8b91fa54b33d3fb8	Working Women’s Forum hosts U.N. side event on grassroots women’s cooperatives
6985c5a38b91fa54b33d3fe0	Parliament Budget Session: ‘19 hours, 13 minutes wasted due to disruptions,’ Lok Sabha Speaker informs the House
6985c59e8b91fa54b33d3fb5	Supreme Court gives Telangana Speaker more time to decide anti-defection pleas against BRS MLAs who shifted allegiance
6985c6188b91fa54b33d412f	RBI moves to shield customers from small fraud, caps compensation at Rs 25,000
6985c59f8b91fa54b33d3fb9	Hyderabad airport issues advisory as app-based cabs may not be available on February 7 due to pan-India strike
6985c70f8b91fa54b33d4333	US calls for new multilateral arms control agreement following new START expiry
6985c6188b91fa54b33d4130	For cancer immunotherapy, gently recovering lab-grown cells is key. Indian researchers may have just found a way
6985c5df8b91fa54b33d4072	Russia’s Kuryer ground robot can carry up to 10 TM-62 anti-tank mines — instructor
6985c6188b91fa54b33d4131	Vadh 2 Movie Review: Neena Gupta, Sanjay Mishra fails to deliver on its promise
6985c55b8b91fa54b33d3f29	White House launches direct-to-consumer drug site TrumpRx. Here's what to know
6985c6aa8b91fa54b33d42ae	 Russian lieutenant general shot by assailant in Moscow, investigators say
6985c59e8b91fa54b33d3fb6	T.N. CM Stalin inaugurates upgraded headquarters hospitals, labs, Samathuvapurams
6985c6198b91fa54b33d4132	Doctors of the wild: How these five animals mastered medicine
6985c6bf8b91fa54b33d42e2	Russian general shot several times in Moscow
6985c5978b91fa54b33d3f86	Andy Murray's grandmother tragically dies just weeks after grandfather passed away
6985c5a18b91fa54b33d3fbf	India-U.S. trade deal in final stages, it will open up new phase in ties, says Jaishankar
6985c69a8b91fa54b33d4281	FIR against film ‘Ghooskhor Pandat’ for allegedly hurting public sentiments
6985c6198b91fa54b33d4133	‘Sacrilegious affront’: HC denies bail to advocate accused of demanding Rs 30 lakh bribe to ‘influence’ Punjab judicial officer
6985c55b8b91fa54b33d3f26	Toyota promotes finance chief Kenta Kon as CEO in second leadership change in 3 years
6985c6198b91fa54b33d4134	Parliamentary panel recommends review of ‘Superfast train’ benchmark
6985c5978b91fa54b33d3f87	'You've missed the point!' GB News star slaps down Labour Minister after attempting to defend Keir Starmer
6985c5df8b91fa54b33d4073	China backs Iran in defending its sovereignty, opposes military pressure — MFA
6985c6198b91fa54b33d4135	Karnataka Cabinet clears Rs 42 crore subsidy to provide vehicles for street vendors in GBA jurisdiction
6985c5e08b91fa54b33d4074	Kremlin welcomes US-Iran talks in Oman
6985c59e8b91fa54b33d3fb7	Four hospitalised after gas leak at factory in Gujarat’s Vapi
6985c6198b91fa54b33d4136	A Hyderabad techie jumped in front of a train. Riddle for police: Why did her grown children jump with her?
6985c5658b91fa54b33d3f65	Russians amassing heavy equipment for further assault on Myrnohrad – military
6985c5e08b91fa54b33d4075	OSCE chair highlights need for organization to prepare for potential ceasefire in Ukraine
6985c5598b91fa54b33d3f1f	Stellantis shares plunge 23% after automaker announces $26 billion hit from business overhaul
6985c5598b91fa54b33d3f20	Goldman Sachs is tapping Anthropic’s AI model to automate accounting, compliance roles
6985c5a18b91fa54b33d3fc1	UDF’s Puthuyuga Yatra: V.D. Satheesan flags Kerala’s financial crisis and promises vision for State’s future
6985c6198b91fa54b33d4137	‘Hindustani Memne’: Reclaiming forgotten histories, questioning comfortable narratives
6985c5a18b91fa54b33d3fc2	Unhappy with pay hike, ASHA workers protest outside Bengal health department head quarters
6985c5a18b91fa54b33d3fc0	No one can claim copyright over anti-Hindi agitations, Parasakthi producers tell Madras High Court
6985c5a48b91fa54b33d3ff0	Parliament Budget Session Day 8 highlights: Both Houses adjourned till Feb 9
6985c5978b91fa54b33d3f88	Average UK house price climbs past £300k after strongest monthly rise in over a year
6985c6198b91fa54b33d4138	Pakistan blast: At least 12 killed in suicide bombing at Islamabad mosque during Friday prayer
6985c7318b91fa54b33d4387	Fox Nation reveals the scandals and secrets of America’s first presidents in ‘The White House’
6985c5a18b91fa54b33d3fc4	Cricketer Rinku Singh’s Facebook account hacked; Aligarh police launches probe
6985c5978b91fa54b33d3f89	Seattle Seahawks head coach Mike Macdonald highlights biggest challenge ahead of Super Bowl clash
6985c55f8b91fa54b33d3f3c	"Amadou and Mariam: Sounds of Mali" documents life of singing duo
6985c6c08b91fa54b33d42e8	Jeweller Pandora switching to platinum from silver as prices surge
6985c6ba8b91fa54b33d42c7	Father of Manchester terrorist praises Hitler
6985c6198b91fa54b33d4139	Yash’s Toxic seals Rs 120 crore deal with Sri Venkateswara Creations, Dil Raju says, ‘Yash stands as a formidable titan of Indian cinema’
6985c59f8b91fa54b33d3fba	Kalaburagi not prepared for water shortage in summer due to mismanagement by civic body, alleges opposition
6985c70f8b91fa54b33d4334	Brazil signals new openness to Mercosur-China talks as Beijing seeks deeper ties
6985c5978b91fa54b33d3f8a	Tony Hawk denies marrying on Jeffrey Epstein's island as skateboarding icon debunks 'narrative of nonsense'
6985c59f8b91fa54b33d3fbb	Woman, her lover among four arrested for husband’s murder in Rajasthan's Sri Ganganagar
6985c5e08b91fa54b33d4076	Military leaders, specialists under threat during wartime — Kremlin
6985c6198b91fa54b33d413a	‘History repeated’: Anushka Sharma reacts as Smriti Mandhana leads RCB’s Women’s Premier League 2026 win, Virat Kohli also congratulates the team
6985c5e18b91fa54b33d4077	Putin has no plans to meet with OSCE chair — Kremlin spokesman
6985c6198b91fa54b33d413b	‘Baseless’: Chandrashekhar Bawankule denies clean chit for Parth Pawar as probe panel gets 8-day extension
6985c59f8b91fa54b33d3fbc	India's imports from China dip in multiple sectors in 2024-25: Jitin Prasada
6985c55a8b91fa54b33d3f21	Bitcoin narrowly avoids falling under $60,000 as it bounces off lows
6985c5a08b91fa54b33d3fbd	Congress launches ‘save land, save race’ rally in poll-bound Assam
6985c5e18b91fa54b33d4078	Kremlin praises Abu Dhabi talks as constructive, complex work
6985c6988b91fa54b33d4268	Minnesota green energy program funded by Obama fined for killing bald eagle: ‘National treasure’
6985c7318b91fa54b33d4388	Palantir's Shyam Sankar: Here's what executive and leaders using AI should do
6985c7318b91fa54b33d4389	SEN JOHN KENNEDY: Democrats’ defund-the-police plan failed, but here they go again
6985c7318b91fa54b33d438a	Why Melania's hit documentary terrifies critics who desperately wanted her to fail
6985c7318b91fa54b33d438b	I infiltrated radical groups 40 years ago. Leftists are desperate for martyrs
6985c5e18b91fa54b33d4079	Abu Dhabi talks touched upon future of New START — Kremlin spokesman
6985c5e18b91fa54b33d407a	Press review: Iran open to deal but Trump may attack and Cuba prepares for mobilization
6985c5658b91fa54b33d3f66	Lithuanian Foreign Ministry expects 20th package of sanctions against Russia to be ambitious
6985c6688b91fa54b33d4202	Pakistan: Blast hits Islamabad Shiite mosque — police
6985c69a8b91fa54b33d4282	Podcast: Why the ‘end of capitalism’ is being debated yet again
6985c5a18b91fa54b33d3fbe	Development of one Telangana tourism project under PRASHAD scheme completed; three ongoing
6985c5e28b91fa54b33d407b	Russia, US agree on need to begin New START talks promptly — Kremlin spokesman
6985c70f8b91fa54b33d4335	More storms coming as Leonardo swells rivers, bursts aquifers in Spain and Portugal
6985c6198b91fa54b33d413c	Uttar Pradesh SIR gets fourth extension, final roll to be published in April
6985c6c08b91fa54b33d42f3	Average house price tops £300,000 for first time, says Halifax
